ID,Title,Author,Date,Votes,Tags,Posts,Views
44122,Better and more customizable bookmarks,DanteV,2020-02-12T22:05:14.831Z,0,,5,57
36684,open bookmarks in browser new tab page suboption,urfausto,2019-04-19T08:06:27.313Z,0,,4,152
43714,Add asynchronous DNS optional function for bookmark URL,m2001,2020-01-26T04:47:41.310Z,0,,1,19
43690,Refresh Bookmark Image from Address Bar,Sillvva,2020-01-24T21:05:59.551Z,0,,1,11
43623,required confirmation of deletion of the bookmark and the bookmark folder,theimer,2020-01-22T19:43:34.228Z,0,,2,17
43115,Import from Microsoft Edge Insider,NathanYumekoe,2019-12-29T16:21:08.093Z,0,,3,54
43036,Breadcrumbs + normal folders in Bookmark Manager,myVivaldiUsername,2019-12-25T13:49:50.846Z,0,,1,31
42889,More options for the bookmarks bar (Scaling  distance  change favicon),Crimzon,2019-12-20T13:04:05.588Z,0,,2,37
42618,Option for separate bookmark folder backgrounds within the Spead Dial.,ozone1979,2019-12-09T17:43:36.606Z,0,,1,18
42427,Default position in folder for new bookmark,BaronAsh,2019-11-28T19:02:19.933Z,0,,6,42
42349,[Bookmarks panel] Select multiple bookmarks at once,jumpsq,2019-11-24T20:03:08.429Z,0,,3,45
41203,I search the folder by name. Does not show bookmarks in folder.,FatihSultan,2019-10-06T07:41:03.648Z,0,,3,66
40345,Improve bookmarks editor,fauthd,2019-09-13T13:57:11.854Z,0,,2,58
39673,Clear bookmark trash should be optional when deleting browser data,internetexplorer,2019-08-25T13:55:46.604Z,0,,1,18
37940,Edit SpeedDial,brianerc,2019-06-06T15:24:27.076Z,0,SPEED DIAL:THUMBNAILS:LINKS,10,309
39019,bookmark bar - characters should be bolder,ilp0000,2019-07-24T07:18:18.375Z,0,,3,160
38555,Please add tabs stack meta data to sync,jp1,2019-06-30T16:16:30.353Z,0,TABS:BOOKMARKS:SYNC:STACKS,1,98
37660,New added bookmarks on the right side.,darkarth,2019-05-25T11:29:53.900Z,0,BOOKMARKS BAR,2,153
37661,bookmark & main menu into the same color as setting menu,darkarth,2019-05-25T11:35:37.550Z,0,MENUS:BOOKMARK FOLDER:COLOR,2,130
37383,Option to store only current folder/subfolder position in bookmarks,deb10042,2019-05-15T06:19:05.376Z,0,BOOKMARKS,1,119
36527,Synchronizing Bookmarks with Firefox,pedja,2019-04-13T10:14:03.743Z,0,BOOKMARKS:SYNC,2,194
36215,Opening a folder of bookmarks via a nickname should open in new background tabs...,TsunamiZ,2019-04-04T08:48:45.637Z,0,TABS:BOOKMARKS:NICKNAMES,1,138
35898,URL templates as bookmarks,CassandraNewell,2019-03-28T00:55:08.795Z,0,BOOKMARKS:SPEED DIAL,3,228
34773,Indicator that website is bookmarked.,LAPIII,2019-02-18T18:03:13.640Z,0,RESOLVED,7,309
33314,Drag Bookmark To Tab,mohkamfer,2018-12-21T19:20:46.164Z,0,TABS:BOOKMARKS:BOOKMARKS BAR:DRAGANDDROP,3,301
33112,More Features and Settings for Start Page,Fever,2018-12-16T04:11:10.191Z,0,BOOKMARKS:CUSTOMIZE:START PAGE,2,327
28926,URL Easy Update,Too_many_browsers,2018-07-24T09:37:14.005Z,0,BOOKMARKS,3,449
32590,Send Bookmark to Folder,matiasmovie,2018-11-28T15:16:09.686Z,0,BOOKMARKS:BOOKMARK FOLDER,3,356
32403,Middle-click on a Bookmarks Bar Folder Should Open Two Tabs,indieloser,2018-11-21T07:30:09.509Z,0,BOOKMARKS BAR:TAB:MIDDLE-CLICK:FOLDER BROWSE,2,370
32015,Make all imported bookmarks show icons immediately,yukitaga,2018-11-07T11:10:15.065Z,0,BOOKMARKS:IMPORT:FAVICONS,3,449
31105,Show decoded URLs in popups on mouse hover,drkh,2018-10-11T03:53:18.530Z,0,BOOKMARKS:BOOKMARKS BAR:BOOKMARKS PANEL,1,302
30223,Open Bookmarks in Nested Folders in New or Background Tabs,NemoAnonymous,2018-09-22T01:36:54.416Z,0,BOOKMARK FOLDER,4,401
30135,Enlarge Bookmark Thumbnails in Speed Dial,capedghost,2018-09-18T07:53:19.209Z,0,SPEED DIAL:THUMBNAILS:SPEED DIAL SIZE,1,483
29937,Center align Speed Dial with "None" Max Columns,zook,2018-09-10T03:53:30.402Z,0,SPEED DIAL,5,567
29701,Share Sync with Google Accounts or 3rd-party Sign-in,APassingMe,2018-08-30T21:13:30.840Z,0,SYNC,6,1235
29120,Bookmark Folder URL Filter,Ryo500,2018-08-01T18:31:07.206Z,0,BOOKMARKS,3,527
27609,Smart Bookmarking/Foldering,Ouroboros4545,2018-05-23T21:15:15.239Z,0,BOOKMARKS:BOOKMARK FOLDER,4,1082
26411,Independent New Tab Position Setting for Speed Dial Tabs,DominateEye,2018-04-02T19:49:53.464Z,0,SPEED DIAL:NEW TAB,3,434
25286,Bookmark Description in a Second Language,SVGuss,2018-02-20T22:39:04.783Z,0,BOOKMARKS,3,720
