ID,Title,Author,Date,Votes,Tags,Posts,Views
60212,Smooth tab dragging like Chrome and Edge,Njsmooth,2021-04-28T19:27:25.654Z,2,,3,47
49489,⚡⚡⚡Hibernate Background Tabs Button⚡⚡⚡,stardepp,2020-08-06T07:23:32.756Z,2,,16,315
59657,Additional tabs customization,Buglocker,2021-04-15T22:23:40.394Z,2,,1,30
58457,Configurable actions on tab bar clicks,williamscaleba,2021-03-20T03:51:02.616Z,2,,3,33
52515,Switching tabs by any means (e. g. F2) should also update the position of the list to quickly find that tab,pkr,2020-11-03T06:14:26.494Z,2,,3,36
59028,Add option to automatically start renaming tab stack after creation,rzjnzk,2021-03-31T13:18:10.314Z,2,,1,15
58158,Keep behavior of tab stacks the same as normal tabs when closing the second last tab of a tab stack,LPChip,2021-03-15T17:20:32.311Z,2,,9,75
57945,Shortcut key for new tab in current tab stack,ulriksf,2021-03-10T05:54:56.368Z,2,,6,34
56594,Move Stacked Tabs to New Stack,bkonia,2021-02-06T22:13:18.335Z,2,,4,28
56433,Tab Notifications in Stacks,bkonia,2021-02-04T05:32:27.291Z,2,,1,22
56286,Smart Tab Stacks (by Host),slalm,2021-02-01T16:45:22.971Z,2,,5,69
56018,Use independent 2-level tab switching for mouse wheel,Avi,2021-01-28T13:36:11.753Z,2,,2,39
56117,Close pinned tabs with shift+middle click,Stardust,2021-01-29T17:40:06.279Z,2,,3,30
56096,Add a Menu Item to move current Tab to a Tab Stack,dpn,2021-01-29T12:04:25.646Z,2,,1,14
55994,Improve Two-Level Tab Stacking allowing fully expanding tabs,stdedos,2021-01-28T08:20:24.928Z,2,,2,28
55847,Decrease Min Width of a tiled tab,snakedoc,2021-01-24T05:27:44.389Z,2,,3,28
54381,Make the tab fullscreen/maximized when dragging from one monitor to another,Slopz,2020-12-13T14:57:39.453Z,2,,1,16
53573,Tab auto-reload timer and typing,PetteriKautonen,2020-11-28T05:21:29.403Z,2,,1,18
52846,Selecting text and seeing copy popup options,antusystem,2020-11-10T14:54:40.784Z,2,,2,44
52178,Keep Tabs Hibernated Even When Clicking Them,isaacjara17,2020-10-25T15:36:51.725Z,2,,3,34
44237,Vertical Tabs - Mouse Hover Toggle Width,ChimeraLove,2020-02-16T16:09:56.293Z,2,,2,39
51016,Keep minimized tabs minimized (old Opera behavior),Tealing,2020-09-23T12:08:05.202Z,2,,1,21
50649,accent at the top for the active tab,matiasmovie,2020-09-12T10:16:43.193Z,2,,18,86
49929,Use device name or custom name for synchronized tabs,pasce,2020-08-22T10:03:57.148Z,2,,6,57
48712,Let us choose a custom colour to highlight the currently selected active TAB,Eftegarie,2020-07-02T17:31:10.261Z,2,,5,87
49144,Allow for different open locations of new tabs,jammaschan,2020-07-23T08:17:23.015Z,2,,4,57
34438,Design Tab management Tabs View Timeline One tab with all tabs,viqdoclearning,2019-02-07T19:13:38.344Z,2,TABS,3,191
44486,Mini player on tabs bar,biso95,2020-02-26T12:43:54.686Z,2,,2,27
43464,Adjustable Tab Cycler Width,Sparrows,2020-01-14T15:29:03.201Z,2,,6,63
42667,Ability to directly search name of saved session in F2 menu,sisisisi,2019-12-11T10:49:41.865Z,2,,2,24
38875,Ultrawide monitor tabs,PRiSMiWi,2019-07-16T16:56:34.994Z,2,,2,147
38729,Tab bar position based on window width,marenz,2019-07-09T13:39:52.053Z,2,POSITION:WINDOW:VERTICAL:TABS,1,111
32850,New Tab Button Position Options,dracho,2018-12-08T21:51:15.540Z,2,NEW TAB:BUTTON,5,475
38265,Unread Badges for reactive tab stack,Seasonly,2019-06-20T10:01:13.430Z,2,TABS:UNREAD:TAB STACKS,1,132
38010,Option to disable remote sessions sync,Leradis,2019-06-09T11:23:44.073Z,2,SYNC:REMOTE SESSIONS:TABS,5,213
37019,"Smart Tile Layout" based on monitor resolution,MrMista,2019-05-04T18:39:44.428Z,2,TABS:TILING,3,190
36229,Assign Default Window for new tabs,smartptr,2019-04-04T12:07:25.001Z,2,WINDOW,2,154
36051,Have "Align Next Close Button" work for middle click (and double click if enabled),aeonvex,2019-03-31T20:56:31.878Z,2,TABS:MIDDLE-CLICK:CLOSE TABS,1,142
35493,Add Proxy each tabs,syauqi,2019-03-15T07:35:48.889Z,2,TABS:PROXY,3,239
35218,Dragging tabs out to new window that is capable of windows multitask,chimmpres,2019-03-05T23:27:57.942Z,2,TILING,3,250
26759,New Tab Icon and Position to Follow Mouse Cursor,Seasonly,2018-04-18T08:06:18.126Z,2,NEW TAB,5,1130
35020,Allow me to make tab stacking the default,Grannath,2019-02-27T08:21:29.262Z,2,TAB STACKS,2,192
34431,Show the URL on the Status Bar when Hovering the Tab,zhangdl,2019-02-07T17:52:48.598Z,2,TABS:STATUS BAR,2,206
34178,Convert Tab to a Private Window,revolt73,2019-01-29T09:25:33.738Z,2,TABS:PRIVATE WINDOW,6,248
33169,Make Tab-stack Tab Selector More Distinctive,Gregor,2018-12-17T22:35:33.297Z,2,TABS:TAB STACKS:SELECTION,3,338
33106,Add Visual Indicator for Tiled Tabs,LiorL,2018-12-15T23:39:58.124Z,2,TABS:TILED TABS,2,224
32983,Clone Tab from Normal Window to Private Window,AltCode,2018-12-12T21:43:44.568Z,2,TABS:CLONE TAB:PRIVATE WINDOW,3,248
32921,Save a Tab Stack to a Speed Dial Folder,richter03,2018-12-11T09:24:55.528Z,2,TAB STACKS:SPEED DIAL:BOOKMARK FOLDER,3,428
32144,Option to Remove Mute/Unmute Icon from Tabs,sventhebarbarian,2018-11-11T23:54:17.533Z,2,TABS:MUTE:ICONS,4,560
31426,A Tab Stack Bar,hebgbs,2018-10-19T20:57:10.924Z,2,TAB STACKS,4,398
31418,Save Tiled Tabs as One Bookmark,bjarteao,2018-10-19T18:07:17.687Z,2,TILING:BOOKMARKS,2,460
30249,Please allow tab-preview-on-hover to be bigger,SteveThackery,2018-09-22T22:15:24.196Z,2,THUMBNAILS:SIZE,4,460
29960,Option to Place Vertical Tab Bar Outside of the Panels,aminought,2018-09-10T20:44:22.638Z,2,TAB BAR:PANELS,2,315
28607,Move Tabs into Title bar of System Window,My1,2018-07-11T10:50:13.190Z,2,TABS:TITLE BAR,15,2017
28495,Open Video in Same Tab,Neophyte,2018-07-06T22:14:45.348Z,2,TABS:VIDEO,1,558
26542,Right-click to Open Link in New Foreground Tab,Alex77777,2018-04-08T09:16:49.072Z,2,NEW TAB,12,3145
25478,Move Trashcan and New Tab Buttons to Top of the Thumbnails,jacotreus,2018-02-27T12:21:45.582Z,2,TAB BAR:TRASHCAN:THUMBNAILS:GUI,2,618
65701,New tab location - would be great to have more options,konoppo,2021-08-27T18:19:44.054Z,1,,1,24
65668,V Sessions | Tags/Prefixes,Zalex108,2021-08-26T17:34:15.962Z,1,,1,30
64261,tab-stack like Biscuit,bingling00,2021-07-22T17:16:27.019Z,1,,3,97
65701,New tab location - would be great to have more options,konoppo,2021-08-27T18:19:44.054Z,1,,1,24
65668,V Sessions | Tags/Prefixes,Zalex108,2021-08-26T17:34:15.962Z,1,,1,30
64261,tab-stack like Biscuit,bingling00,2021-07-22T17:16:27.019Z,1,,3,97
65160,Add an option to open quick commands searches in another tab INSIDE the current tab stack,ultrapoci,2021-08-11T20:06:31.567Z,1,,1,20
64713,more compact tab group hiding,matiasmovie,2021-08-02T03:26:33.310Z,1,,1,28
64711,Another frame for a group of tabs (according),matiasmovie,2021-08-02T03:21:26.000Z,1,,1,19
64684,Let drag open links in the blank area after the last tab,sgLaus4tune,2021-08-01T14:28:42.199Z,1,,2,17
64498,Move tab stack to specific window via quick command,tsrodr,2021-07-28T18:56:27.864Z,1,,2,38
61715,Add shortcut to fuzzy-search open tabs,matklad,2021-05-31T09:26:16.355Z,1,,8,81
63930,Allow disabling Alt+Click shortcut to close all other tabs,SuneEnough,2021-07-13T00:47:53.030Z,1,,3,57
63632,Pinned tabs in the vertical tab bar should always be displayed on top of the tab list!,PeterPanino,2021-07-06T15:36:13.745Z,1,,14,115
63573,Middle click at New Tab Button => paste from clipboard in new tab and go,VovanVE,2021-07-05T02:05:41.616Z,1,,5,76
63595,color tabstack tabs on title change,xenoterracide,2021-07-05T14:06:24.056Z,1,,2,33
63254,Making a Page Stick to Specific Tile,thehumanx,2021-06-28T02:47:05.155Z,1,,1,21
63044,Hide PiP window when hovering,genuz,2021-06-23T05:41:08.701Z,1,PIC-IN-PIC,2,36
62574,Tabs as a Tree Structure with Systematic Colour Coding and Boarders / Separators,sirinath,2021-06-14T14:47:06.534Z,1,,1,38
62066,Tab Stack Titles,ChimeraLove,2021-06-09T13:07:54.383Z,1,,1,25
61895,Allow stacking by Drag and Drop but only for existing stacks,vrnvorona,2021-06-05T15:41:44.945Z,1,,1,25
61494,Tabs that can turn into apps,renerebolledo,2021-05-24T21:28:04.658Z,1,,2,34
61062,Kanban your Tabs with 2 level Tab stacking (75% Tip  25% request),WildEnte,2021-05-14T07:12:52.572Z,1,,5,61
60856,Close faster multiple tabs in a "tab stack",delcedo,2021-05-09T19:19:01.619Z,1,,4,49
60613,Intuitive live sessions(windows binding),hxss,2021-05-04T16:24:31.742Z,1,,4,38
60496,Move Tab to the Start/End,camemb3rt,2021-05-02T19:39:22.946Z,1,,1,28
60460,Two line tab variation,Seasonly,2021-05-02T09:03:40.842Z,1,,1,36
60003,Two level tab stacking sidebar option  aka "workspaces",schammy,2021-04-24T06:23:40.719Z,1,,1,36
59963,Icons in tab context menus (#2),StephanJohn,2021-04-23T08:14:49.580Z,1,,3,36
59962,Control time before mouse-hover over a tab-group opens tab preview,StephanJohn,2021-04-23T08:07:07.286Z,1,,1,23
59848,Feature Request: Allow "Find" to search across all open tabs,joeduffus,2021-04-20T17:47:27.316Z,1,,3,28
59605,PIP for any tab,edgein,2021-04-15T06:53:40.480Z,1,,2,20
59464,iPad Style Tabs Overview,posto,2021-04-11T13:02:48.326Z,1,,1,20
59339,Customizable Interval in Periodic Reload Submenu (Previously: "Customizable Interval for Periodic Reload"),deneban,2021-04-07T18:48:07.279Z,1,,8,34
59262,Option to show pinned tabs in multiple windows,lmariscal,2021-04-05T19:17:42.860Z,1,,2,18
59077,Let us choose to put the tabstacked-tabline above the main tab-line.,Suvaius,2021-04-01T13:43:46.133Z,1,,2,23
58976,Startpage for pinned tabs,ClausKiss,2021-03-30T05:44:53.123Z,1,,3,25
42612,"Switch Tabs by Scrolling" is far too sensitive on touchpad,rossjrw,2019-12-09T09:48:24.432Z,1,,5,70
58653,Option for add a tab into Windows Taskbar and the Start Menu,rfacundo1705,2021-03-24T00:38:16.330Z,1,,1,18
58639,Custom Width | Near / Related,Zalex108,2021-03-23T18:06:09.270Z,1,,1,23
58500,Desktop "Web Apps',gloruiousfly,2021-03-20T21:23:44.142Z,1,,1,30
50887,Increase Tab history length,browseruser,2020-09-19T03:39:06.714Z,1,,2,79
57486,ability to format tab from context menu,janrifkinson,2021-02-24T19:05:51.658Z,1,,3,45
56997,Shortcut/setting for tiling selected tabs?,anijatsu,2021-02-15T06:25:30.288Z,1,,6,35
56999,Sessions like in OmniWeb,mbert,2021-02-15T08:09:16.090Z,1,,1,23
56764,A convenient one handed way to make tab selections...,TsunamiZ,2021-02-10T10:59:21.462Z,1,,1,22
56421,Option to Lock the Height of the Tab Bar,tsunamy,2021-02-03T22:21:19.918Z,1,,9,76
56284,Combine stacks and tiling,felagund,2021-02-01T16:27:23.229Z,1,,3,36
56300,Add option "send to/copy to main window" in private window and add in non private window option "open tab in private mode",matiasmovie,2021-02-01T20:39:18.528Z,1,,2,18
25707,Option to Periodically Destroy the Link between Related Tabs,kakato10,2018-03-06T22:56:27.360Z,1,NEW TAB:HISTORY LIST,4,662
32839,New tab position: "unparent" a tab,brliron,2018-12-08T09:28:00.321Z,1,TABS:NEW TAB,3,318
55438,Sidekick-like sidebar,eparizzi,2021-01-13T10:57:08.933Z,1,,8,162
27617,Double-click a Link to Open a Tab in the Foreground,Seasonly,2018-05-24T08:46:36.596Z,1,LINKS:TABS,16,1722
54421,Add Mouse Gesture to the root of the website,FikaMedHasse,2020-12-14T09:58:52.330Z,1,,4,34
54221,Real time tab preview,mtumishi_burika,2020-12-10T23:50:21.531Z,1,,3,38
54192,Show loading progress as progress bar and as favicon progress/spinner together,cookiebinary,2020-12-10T13:48:46.062Z,1,,1,21
54116,Better tab popup thumbnail sorting,dampfish,2020-12-09T10:50:34.883Z,1,,4,20
45849,Disctinct keyboard shortcuts for Close action with specific Close Tab Activation,lolmaus,2020-04-18T16:59:10.609Z,1,,2,29
47288,Natively limit the Number of Tabs Opened in a Window  store the the following tabs on a file and re-open them in order as they are closed.,Eichenberger,2020-05-23T06:48:12.386Z,1,,7,84
46379,Tab Groups - More Moving-options + Backup,ToxicCookie,2020-04-28T14:04:22.056Z,1,,2,37
52880,Perfect grouping of tabs,romdev,2020-11-11T13:51:27.897Z,1,,11,78
52591,show tabs in full screen by mousing to top,Willl,2020-11-04T20:43:37.947Z,1,,3,66
51334,Add a Tab Divider for Tab Organization,GarrDByrd,2020-10-03T13:17:44.500Z,1,,5,33
51252,Prevent reload of background tabs / caching of web page content,goedl,2020-09-30T12:59:57.889Z,1,,1,27
51039,Mute group of tabs,matiasmovie,2020-09-23T23:48:44.519Z,1,,9,24
49758,Keyboard Shortcut to show Tab History List,MindStateTrain,2020-08-15T19:53:58.854Z,1,,2,23
49738,Saving and Reopening a Tiled Tab Group,bopancake,2020-08-14T23:33:24.755Z,1,,2,18
35565,Zoom remember by url or domain,avj,2019-03-18T11:18:55.102Z,1,ZOOM,3,242
49597,Implement "Create Tab stack from group Parent-Children",barbudo2005,2020-08-10T16:17:05.071Z,1,,2,21
48894,Sync tabs more frequently,mpierce,2020-07-10T22:43:05.957Z,1,,4,53
48895,Can saved tab sessions be synced to the Vivaldi cloud?,mpierce,2020-07-10T22:45:30.147Z,1,,2,30
48738,Option to position mute and PiP buttons on the same side as the close button,AltCode,2020-07-03T18:38:01.215Z,1,PIC-IN-PIC,1,21
45626,Go to the site from which you came to a tab,oskark,2020-04-11T00:20:07.477Z,1,,5,96
45882,Tab Preview enlargeable,stardepp,2020-04-20T06:16:06.887Z,1,,4,58
46901,Improved keyboard navigation on tab stacks,jasonfu9966,2020-05-11T20:53:02.170Z,1,,2,19
46897,Project based Tab-grouping,paul157,2020-05-11T17:45:13.996Z,1,,6,79
46138,Show stack thumbnails when CLICKING to tab instead of HOVERING mouse cursor,fanliver,2020-04-24T07:58:12.420Z,1,,1,19
45739,Switch tab by scrolling shouldn't affect rmb+scroll,S4dPanda,2020-04-15T14:12:16.854Z,1,,8,51
44827,Tab Highlighting within Tab Cycling and the default Tab List,Sparrows,2020-03-11T14:37:23.433Z,1,,1,13
44676,Dragging tab out of the current windows should create a new window where released,GeeZuZz,2020-03-05T14:05:01.773Z,1,,4,27
42106,Close tab on Shift+Click,jumpsq,2019-11-12T05:25:29.483Z,1,,6,89
44189,Ability to open a new tab that is identical to currently focused tab,npquintos,2020-02-14T17:55:50.307Z,1,,4,45
44157,Halt YouTube streaming on one tab when another YouTube tab is selected and auto engage for streaming.,gwp777,2020-02-13T21:44:41.518Z,1,,1,15
43358,Custom Thumbnails for tab stacks,witchparker,2020-01-09T21:42:29.312Z,1,,3,24
43317,Delete key should close tabs  when multiple tabs are selected,k7gV8Y,2020-01-08T14:46:19.231Z,1,SHORTCUT,2,28
43022,Resize tabs and tab stacks,yerbestpal,2019-12-25T01:28:33.826Z,1,,2,37
42598,Grouped tabs - show which one emits sound,sneaky4oe,2019-12-08T14:34:21.648Z,1,,1,24
42131,Add a pseudo-tab "divider" ("space tab"  "empty tab"  "stub tab"),kivagant,2019-11-13T09:15:57.441Z,1,,2,43
41977,Option for 'Open a new tab' button to always open a tab as last one,lyghters,2019-11-07T08:14:21.921Z,1,,4,60
41859,Clear Individual Tab History,Joescope,2019-11-03T19:13:43.741Z,1,,1,39
41324,Have tabs on a slide to put custom gap sizes between tabs.,ruggah,2019-10-11T18:13:58.628Z,1,,3,52
41313,command-line option to open urls in tiled mode,marcomausf,2019-10-11T09:31:19.486Z,1,,1,32
40756,Open image in new tab --->>> Image as desktop background,stardepp,2019-09-23T05:50:15.587Z,1,,2,34
39899,Close All Tabs - Saved Link List (TabGrenade),Robert96757,2019-09-04T20:13:49.905Z,1,,4,77
39900,Handle tiled tabs like (manual) tiling WMs do,potmeklecbohdan,2019-09-04T20:20:59.877Z,1,,1,38
39438,Button on the panel to mute/unmute sound on all tabs,Fighter4Freedom,2019-08-15T07:04:53.977Z,1,MUTE,1,45
39086,Close tabs on another PC through sync,Zeta616,2019-07-27T17:54:17.830Z,1,,1,68
39074,Session Enhancements,smelly,2019-07-27T02:28:20.732Z,1,,2,106
38793,Close Tabs Inactive For More Than An Hour,k7gV8Y,2019-07-11T23:22:12.045Z,1,,5,242
26266,"Copy tabs to..." Option for Windows Manager and Tab Bar,ozoratsubasa,2018-03-28T07:46:26.919Z,1,PANELS:TABS,4,713
33575,Quick Commands for Tab Stacking and Tiles,cellyforever,2019-01-04T04:38:55.479Z,1,QUICK COMMANDS:TAB STACKS:TABS,2,264
38689,Option to disable middle click on tabbar resizer,Hadden89,2019-07-07T08:41:53.796Z,1,,7,239
38659,Constantly displaying a tab group when clicking on tabs,Kovan2002,2019-07-05T11:57:35.210Z,1,TABS,1,98
38456,Tab minimum height in vertical tab layout,Kapoff,2019-06-26T11:01:06.281Z,1,THUMBNAILS:VERTICAL:TABS,1,142
38225,Tab Stack Thumbnail Preview Display Time Limit,jeronymite,2019-06-19T04:50:58.901Z,1,,1,116
38141,Reverse direction of "tab scrolling",zopiac,2019-06-14T19:43:35.209Z,1,TABS:TAB CYCLING:SCROLLING:SCROLL WHEEL,3,163
34384,Do not Jump to Minimized Tabs on Closing Tabs,opera6rules,2019-02-06T22:34:20.860Z,1,TABS:MINIMIZE:CLOSE TABS,3,272
37402,Quick Group & Tile Current Tab > By Right-Clicking Target Tab Stack,Manix,2019-05-15T20:24:49.224Z,1,TABS:TAB STACKS:TILING,4,223
37556,Close Tab Activation - Activate New Tab,Ayrlin,2019-05-20T23:40:18.112Z,1,TAB CLOSE:TAB,1,125
36518,Cross Profile Tab Sharing,dies_felices,2019-04-13T00:09:14.928Z,1,TABS:PROFILES:SHARING,1,183
36290,Automatically change tab location based on conditions,mackhax0r,2019-04-05T17:11:12.516Z,1,WINDOW:TOOLBAR:TABS,2,218
35861,Simple Change To Tabs Garbage Can,jaxtraw,2019-03-27T16:22:58.373Z,1,CLOSED TABS:TOOLBAR,3,181
35854,Live set of tabs,roti,2019-03-27T14:40:56.263Z,1,SESSIONS,3,203
35476,Tab Title Text on light background.,fuller1754,2019-03-14T17:42:36.124Z,1,TABS:THEMES,1,162
35113,Treating stacked tabs like normal tabs,Zyzto,2019-03-02T02:13:11.344Z,1,TAB STACKS,5,355
34752,Stacked Tabs Appearance,AstralDust,2019-02-18T08:13:48.092Z,1,TAB STACKS:CUSTOMIZE:TABS,1,248
34488,Auto-New-Separate-Tab-Stack,uhm,2019-02-08T22:54:20.525Z,1,TABS:TAB STACKS,5,384
31500,Splitting Tiles  and More Tiling Options,hebgbs,2018-10-22T06:51:34.011Z,1,TILING,2,462
33416,Option to allow closing pinned tabs with confirmation,alexander.gorbovets,2018-12-26T01:48:59.642Z,1,PINNED TABS,3,220
32996,Allow to save single tab as a session from tab bar without "selecting" it,ROTFL,2018-12-13T10:46:31.856Z,1,TABS:SESSIONS,10,324
32968,Option to Open Session Replacing Current Tabs,iurum,2018-12-12T09:52:31.748Z,1,SESSIONS:TABS,1,215
32707,Add an index number to each tab of the tab bar for easy shortcut selection,hzxiaojun,2018-12-04T10:40:28.245Z,1,,6,190
32369,"Paste and Go" on a Tab,ryofurue,2018-11-20T04:55:10.047Z,1,BACKGROUND TAB:TABS:PASTE AND GO:CONTEXT MENU,1,286
30970,Tile Tabs by Selection,Alkalin0,2018-10-07T09:10:12.837Z,1,TILING,2,409
31348,Upload indicator?,leien,2018-10-17T19:15:25.852Z,1,INDICATOR:LOADING:UPLOADS,1,242
29721,Make Tabs More Optically Distinct,DavidXanatos,2018-09-01T14:08:43.554Z,1,TABS:THEMES,7,581
28710,Shortcut to Switch to Particular Tab,robert.rehammar,2018-07-16T19:53:21.172Z,1,SHORTCUTS:TABS,4,614
28093,Move Tab to.... Submenu Options,rojaviv,2018-06-18T22:55:12.059Z,1,CONTEXT MENU:TABS:WINDOWS,2,751
25783,Tab Switching Modal Popup using Ctrl + Tab (or other way),huh,2018-03-10T15:34:18.536Z,1,TABS:SHORTCUTS:TAB CYCLING,1,3990
65761,Larger thumbnails in tab cycler,Davikar,2021-08-29T23:16:54.995Z,0,,2,23
65673,minor UI tweak - make the "close area" on the x button bigger,Panino,2021-08-26T22:32:03.085Z,0,,7,89
65495,Close tab-stack based on the same domain or group.,Ryanchuang,2021-08-21T15:19:08.572Z,0,,5,84
65522,Change next video or song,Chickenwingstew,2021-08-22T22:27:00.788Z,0,,2,18
47760,open new pages in new window,theMrX,2020-06-08T00:33:36.938Z,0,,5,54
65360,X button from top fullscreen like other Chromium-like browsers,alexvis2020,2021-08-17T16:46:12.520Z,0,,1,37
65224,Tab Suspender,elitre,2021-08-13T11:23:53.792Z,0,,3,65
64957,Tab Stack Rule,Nonlone,2021-08-07T00:20:34.277Z,0,,6,95
65181,Add close button to all tabs on second level stacked tabs,pauloaguia,2021-08-12T09:37:13.138Z,0,,1,21
65761,Larger thumbnails in tab cycler,Davikar,2021-08-29T23:16:54.995Z,0,,2,23
65673,minor UI tweak - make the "close area" on the x button bigger,Panino,2021-08-26T22:32:03.085Z,0,,7,89
65495,Close tab-stack based on the same domain or group.,Ryanchuang,2021-08-21T15:19:08.572Z,0,,5,84
65522,Change next video or song,Chickenwingstew,2021-08-22T22:27:00.788Z,0,,2,18
47760,open new pages in new window,theMrX,2020-06-08T00:33:36.938Z,0,,5,54
65360,X button from top fullscreen like other Chromium-like browsers,alexvis2020,2021-08-17T16:46:12.520Z,0,,1,37
65224,Tab Suspender,elitre,2021-08-13T11:23:53.792Z,0,,3,65
64957,Tab Stack Rule,Nonlone,2021-08-07T00:20:34.277Z,0,,6,95
65181,Add close button to all tabs on second level stacked tabs,pauloaguia,2021-08-12T09:37:13.138Z,0,,1,21
65063,Search bar to filter tabs in current window,Kalyori,2021-08-09T11:28:42.344Z,0,,4,58
65141,Move Vivaldi menu button to right,Thescorb0,2021-08-11T08:40:10.340Z,0,,4,42
65047,Customizable tile color highlighting,ronyxs,2021-08-09T03:11:25.294Z,0,,7,113
65035,Tab stacking in tab groups,elitre,2021-08-08T18:47:35.145Z,0,,4,53
59997,Select the video tab when returning from picture-in-picture,ribeirobreno,2021-04-24T01:29:39.659Z,0,,3,46
64518,Compact Display Style for Accodion,tree1891,2021-07-29T02:45:49.911Z,0,,3,56
64968,Popup with longer title when hover tab,matiasmovie,2021-08-07T07:58:35.515Z,0,,6,69
64963,Accordion tab stack indicator is too hard to see when accent color and background color are similar,ariberkowitz,2021-08-07T03:55:22.860Z,0,,1,18
42323,Vertical Stacking Tabs,kihrian,2019-11-22T20:02:42.150Z,0,,5,156
64891,Rename Folders Tab's,Kardia,2021-08-05T10:18:53.014Z,0,,1,26
64817,Hide Tabs,AnotherNora,2021-08-04T05:28:50.145Z,0,,2,28
64801,Better tab switch order when using single-key switching,stevehav,2021-08-03T18:44:31.152Z,0,,1,25
64714,Frame around tab group in compact mode,matiasmovie,2021-08-02T03:30:41.920Z,0,,7,96
64655,Disable cyclic tab switching by scroll,softisaweapon,2021-08-01T00:27:08.825Z,0,,3,56
64712,Move tab to another group by right-clicking on the tab,matiasmovie,2021-08-02T03:23:56.244Z,0,,1,18
64658,Highlight Tiled tabs,progrockusa,2021-08-01T01:45:50.212Z,0,,2,33
64371,option to not hide the 2nd level of tabs when switching to a tab that is not stacked,areider,2021-07-26T01:09:25.696Z,0,,4,51
64397,Shortcut new tab in newly created stack,raystanz,2021-07-26T15:10:40.228Z,0,,2,50
64015,Show tabs  on full screen,TomHatz,2021-07-15T16:00:41.304Z,0,,3,91
64375,can Vivaldi have some Opera GX stuff,Alexpd7706,2021-07-26T03:02:24.082Z,0,,2,36
64342,Force "Open in New" for specific tabs.,solforge,2021-07-25T05:12:03.799Z,0,,1,25
64247,tab environment: open all the tabs from the folder,Reastr,2021-07-22T10:14:17.924Z,0,,4,44
64268,The panel can directly add favorite URLs,svivaldi,2021-07-22T19:56:52.264Z,0,,1,20
64262,Tab can be pin in the tab-stack,bingling00,2021-07-22T17:32:41.878Z,0,,2,36
64155,Tab Levels/Folders,silasmccord,2021-07-19T15:33:57.405Z,0,,3,80
64126,hiding tabs,MikeSavad,2021-07-19T00:34:47.241Z,0,,1,35
64018,Tab password lock,sakrayaami,2021-07-15T19:00:18.193Z,0,,3,59
63834,Reopening Closed Window,TheShadowDancer,2021-07-10T12:09:28.366Z,0,,3,47
63752,Does Vivaldi have built-in functionality like OneTab?,BeOS,2021-07-08T21:31:39.622Z,0,,3,67
63709,Activate tab with mouse hover,Neeo,2021-07-08T03:53:57.810Z,0,,2,33
62431,Move pinned tabs,sondenis,2021-06-12T13:41:37.237Z,0,IN PROGRESS,5,86
63455,option to move grouped or stacked tabs to left panel in a folder,M0E,2021-07-02T08:39:08.791Z,0,,8,50
63253,Hotkey to toggle hide tabs,MadRey,2021-06-28T02:25:17.552Z,0,,3,15
63236,Place focus in address bar when new tab is opened,dhsOnVivaldi,2021-06-27T16:10:37.604Z,0,,2,63
63203,タブタイリング中にリンクを踏んで開いた新しいタブをそのままタイリングしてほしい。,horihori4179,2021-06-26T13:13:08.628Z,0,,4,36
62950,The selected tab is difficult to distinguish,sirinath,2021-06-21T04:21:33.390Z,0,,3,58
62854,Option to only show favicon in tabs,xep097,2021-06-19T02:35:46.281Z,0,,2,39
62752,Delay closing second level tabs used for tab-stack,codemedic,2021-06-17T08:17:03.875Z,0,,3,38
62513,Find/replace in All Tabs  Find/replace in Stacked Tabs,sirinath,2021-06-13T17:15:00.326Z,0,,1,18
61869,Unhibernate/wake tab stack,chrabia,2021-06-04T13:46:07.715Z,0,,2,52
62326,Option for opening links in new tabs at the end of the tab list,mbert,2021-06-11T09:45:26.833Z,0,,1,25
62153,Preserve window order on,alexandremckinnon,2021-06-10T03:24:48.257Z,0,,1,22
59994,Middle Click New Tab button opens a new tab next to the on in focus.,camemb3rt,2021-04-23T23:39:58.815Z,0,,4,85
61810,Tiled Tab Minimum Size,ChrisKerswell,2021-06-02T21:57:03.904Z,0,,2,45
61868,Multilevel tab stacks?,chrabia,2021-06-04T13:38:19.752Z,0,,3,74
61867,Reorder tabs in the stack by shortcut,chrabia,2021-06-04T13:33:48.074Z,0,,1,27
61571,Generated color for tabs,lear62,2021-05-27T08:58:14.270Z,0,,7,112
61271,Tab tiling - overflow scroll,deathau,2021-05-19T04:28:30.738Z,0,,1,38
61210,put a different background image behind tabs,BillyCS,2021-05-17T12:33:20.835Z,0,,4,89
60103,Option to fully disable close and disable-sound buttons on tabs,perljshtml,2021-04-26T14:17:25.602Z,0,,4,54
61071,Add Audio Icon in Menu,tbussmann,2021-05-14T10:36:30.956Z,0,,1,24
61055,Ability to pin favicon for tab stack and not change it while switching between tabs inside,mihanentalpo,2021-05-14T04:01:24.067Z,0,,1,42
60988,tabbar under navbar,adacom,2021-05-12T17:39:20.641Z,0,,3,48
60643,[Linux] Open terminal emulator in Vivaldi,redqueen,2021-05-05T10:12:46.630Z,0,,11,128
60745,Bottom tab bar has unwanted gap on Linux,emvaized,2021-05-07T07:52:55.186Z,0,,4,46
60907,Open previous in new tab with recent history of previous tabs.,kubek8,2021-05-10T20:35:57.440Z,0,,2,41
60515,Native Tree Tabs  with Mouse pointer activated visibility,jerskine,2021-05-03T00:43:05.576Z,0,,1,31
60371,Option to open any new tab in a tab stack,ppatel,2021-04-30T19:34:14.078Z,0,,3,24
59160,Move the "reopen closed tab" command to the top so we can access it faster...,TsunamiZ,2021-04-03T10:21:22.451Z,0,,5,49
60287,Please streamline tabs/stacks/sessions,vvsurfr,2021-04-29T19:42:33.224Z,0,,3,38
59879,A tab back/forward for accessing recently used order (if this is not the default tab cycling order),saturnus,2021-04-21T13:35:00.179Z,0,,7,79
