ID,Title,Author,Date,Votes,Tags,Posts,Views
24406,Horizontal Tab Scrolling Instead of Shrinking,longvoid,2018-02-01T11:56:13.384Z,180,TABS:SCROLLING:FIREFOX:PIPELINE,165,7766
24395,Private Tabs,kurevska_registracia,2018-02-01T10:17:08.762Z,127,TABS:PRIVATE MODE:NICE TO HAVE,12,3017
24608,Implement Tree-style Tabs,Hadden89,2018-02-03T05:05:07.741Z,118,,53,5261
28208,Rename Tabs,Pesala,2018-06-25T17:39:57.928Z,90,TABS:RENAME,32,2118
25453,Multiple Row Tabs,LonM,2018-02-26T15:52:47.681Z,84,TABS:IN PROGRESS,165,6774
16674,Color a Single Tab (or Tab Group),netean,2017-05-08T16:20:07.319Z,79,TABS:TAB STACKS,43,2619
16674,Color a Single Tab (or Tab Group),netean,2017-05-08T16:20:07.319Z,79,TABS:TAB STACKS,43,2619
48834,Tab group switching with hiding tabs (Panorama  workspaces),mozh,2020-07-08T11:39:16.996Z,77,,25,681
44340,PWA Installation for all websites,Darthagnon,2020-02-20T11:49:34.438Z,63,,44,1394
44340,PWA Installation for all websites,Darthagnon,2020-02-20T11:49:34.438Z,63,,44,1394
24578,Open Bookmark Folder in Tab Stack,Artex,2018-02-02T17:25:04.496Z,58,BOOKMARKS BAR:BOOKMARK FOLDER:TAB STACKS,16,1490
35364,Keyboard shortcut to close tab stack,MisterSanders,2019-03-10T02:25:02.025Z,53,TAB STACKS:SHORTCUTS,11,536
25451,Option to Autohide Tab Bar / UI,somebody,2018-02-26T12:46:33.100Z,46,TAB BAR:GUI:AUTO-HIDE,15,2597
24283,Reorder Tab Stacks by Dragging Thumbnails,Guilimote,2018-01-31T16:20:13.457Z,46,TAB STACKS:THUMBNAILS:DRAGANDDROP,3,998
25969,Follower Tabs,chaswmsday,2018-03-17T17:58:18.619Z,37,TABS,19,1702
29800,Increase Max Width of Vertical Tab Bar,Tinsmith,2018-09-05T07:05:10.825Z,37,,55,1339
24338,Chrome-like Tab Dragging,AltCode,2018-01-31T21:27:53.595Z,37,TABS:NEW WINDOW:DRAGANDDROP,2,752
32855,Option for Automatic Tab Hibernation,terere,2018-12-09T07:33:30.776Z,36,HIBERNATION:TABS,19,1997
32855,Option for Automatic Tab Hibernation,terere,2018-12-09T07:33:30.776Z,36,HIBERNATION:TABS,19,1997
24335,Option to Create Tab-stack by Ctrl-clicking or Middle-clicking on Links,trevtech,2018-01-31T21:22:17.941Z,33,TAB STACKS,12,1145
28287,Possibility to keep tabs for later / Set Aside Tabs / Reading List,Ornorm,2018-06-29T15:34:36.302Z,33,,33,1999
25542,Configurable Middle-click (e.g. open Tabs in Foreground),schreck,2018-03-01T02:53:25.551Z,32,,60,6016
24343,Create Tab Stacks from Pinned Tabs,AltCode,2018-01-31T21:45:01.712Z,32,TAB STACKS:PINNED TABS,7,1297
30065,Option to disable tab hibernation,Nekomajin,2018-09-15T06:27:04.905Z,31,TABS:HIBERNATION,18,1589
31786,Auto Hibernate Tabs by a Rule (memory saving and speed up feature),djaddo,2018-10-29T15:56:59.976Z,30,TABS:HIBERNATION:MEMORY,4,539
24151,Tab Stack Commands,LonM,2018-01-31T09:34:51.643Z,30,TAB STACKS:SHORTCUTS:MOUSE GESTURES,7,1415
56898,function of "workspaces" as in the new opera,cOAPerator,2021-02-13T05:41:13.042Z,29,,14,269
34494,More Complex Tab Auto-Stacking,AltCode,2019-02-09T09:53:40.611Z,29,TAB STACKS,18,876
26231,Vertical Tab Bar needs (Auto)Scroll to Active Tab Functions,dude99,2018-03-27T11:17:48.844Z,29,VERTICAL:TAB BAR:SCROLLING,19,1239
24659,Tab Snooze / Keep for later time,dakira,2018-02-04T00:44:40.363Z,28,TABS:HIBERNATION,13,1062
24970,Separate Options for Tab Cycling and Scrolling Tabs on Tab bar,Formedras,2018-02-12T04:27:44.871Z,27,TABS:SCROLLING:TAB CYCLING,25,2149
27576,Middle-click on Tab Bar to Open New Tab,Tell,2018-05-22T10:46:56.840Z,27,MIDDLE-CLICK:TAB BAR:NEW TAB,21,1378
24298,Show Pinned Tabs as Icons on Vertical Tab Bar,Flex,2018-01-31T18:27:48.495Z,26,TAB BAR:ICONS:PINNED TABS,5,1064
60170,Bring back the tab sliding implementation,Nekomajin,2021-04-27T22:10:39.187Z,23,,4,245
24983,Mouse Hover on a Tab Activates it!,maxtao,2018-02-12T12:44:19.539Z,22,,21,3605
24587,Highlight duplicate tabs with blinking,ROTFL,2018-02-02T18:51:58.300Z,21,TABS:HIGHLIGHT,25,1752
35522,Ability to re-open multiple tabs  after a bulk close,CheVe11e_191,2019-03-16T09:37:45.169Z,21,TABS:CLOSED TABS,19,497
24402,Switchable Tab Groups similiar to Firefox Panorama,kurevska_registracia,2018-02-01T11:06:50.467Z,21,TAB GROUPS:FIREFOX,2,557
25489,Separate Position Settings for New Tab and Open in New Tab,DannyRomano,2018-02-27T16:57:01.529Z,20,TABS:SETTINGS:POSITION,26,1703
25048,Centering Interface to the Webpage/ Tabs and Bookmark Bar Centering,Seasonly,2018-02-14T08:40:24.877Z,20,TABS:BOOKMARKS BAR:GUI,2,860
36664,Option to exclusively use the "small" audio playing badge.,Dinjoralo,2019-04-18T16:00:41.589Z,19,TABS:GUI:MUTE:AUDIO,3,228
37467,Pin Tab Stacks,Para-Noid,2019-05-17T20:31:51.133Z,19,,9,343
32265,Open New Tab Within Tab Stack,Killy.MXI,2018-11-15T23:29:32.188Z,19,TABS:TAB STACKS:NEW TAB,10,951
45771,Adding to Block List by Clicking on Links,Pesala,2020-04-16T10:25:07.485Z,19,,1,60
32993,Tab Stack Cycling,baconshirt,2018-12-13T09:35:27.553Z,19,TABS:TAB STACKS:TAB CYCLING,9,801
30535,Option to close pinned tabs when closing a window,pafflick,2018-09-28T06:29:26.893Z,18,PINNED TABS:CLOSE TABS:TABS,13,671
26559,Do not close tab group popup after closing a tab,cab404,2018-04-09T11:10:43.855Z,18,TAB STACKS:CLOSE TABS:IN PROGRESS,5,836
25581,Extended Tab Management,robert.rehammar,2018-03-02T09:19:50.187Z,18,TABS,4,763
28296,Tab Nesting Supporting Horizontal Tabs,Dayanto,2018-06-30T02:10:26.816Z,17,TABS:TAB STACKS,15,1945
30731,Rename "Clone Tab" to "Duplicate Tab",DannyRomano,2018-10-01T20:43:03.434Z,17,TABS:CLONE TAB,13,977
34820,Update/Replace saved session,6HRFcBhv,2019-02-19T20:28:18.434Z,16,,5,277
24340,Drag Tabs between Private Windows,AltCode,2018-01-31T21:32:05.487Z,16,,14,1359
27460,Keep "+" Visible when Using Vertical Tabs,goedl,2018-05-17T09:17:07.985Z,16,TAB BAR:VERTICAL,18,1318
29835,A Shortcut to Force Links to Open in the Current Tab,kivagant,2018-09-06T15:27:55.610Z,15,SHORTCUTS:LINKS:TABS,12,743
25862,Option to Automatically Stack Tabs by Host,Shadess,2018-03-13T20:13:35.262Z,15,TAB STACKS,5,868
25643,Option to Increase Height of Tab-stacking Indicator,Hadden89,2018-03-04T15:39:37.244Z,15,TAB STACKS:GUI:CUSTOMIZE,8,1337
24574,Option to Keep Tab Stacks with Only One Tab,ThinkingDes,2018-02-02T16:55:04.174Z,15,TAB STACKS,3,827
24658,Allow Drag & Drop Between Tabs,kurevska_registracia,2018-02-03T23:38:56.557Z,15,TABS:DRAGANDDROP,1,691
26233,Delay Option on Popup Tab Tooltips/Thumbnails,Hadden89,2018-03-27T12:44:58.275Z,14,,4,735
26422,Open Link as Tiled Tab Stack,andydelz,2018-04-03T08:17:38.033Z,14,TILING:TAB STACKS:LINKS,6,1125
25942,Set Size for Tab Previews in Tab Stacks,raystanz,2018-03-16T12:24:47.633Z,14,TAB STACKS:THUMBNAILS,17,1177
28593,Shortcuts to Tab-stacks -> Tab,fizch,2018-07-10T23:16:22.378Z,14,SHORTCUTS:TAB STACKS,3,838
24398,Allow Dragging things to Empty Part of Tab Bar,kurevska_registracia,2018-02-01T10:22:46.230Z,14,TAB BAR:DRAGANDDROP,7,936
25259,Mark Tab as Important,qwer0,2018-02-20T08:06:35.715Z,14,TABS:HIGHLIGHT,7,1301
24129,Split Tab,Pesala,2018-01-31T09:21:49.805Z,13,TABS:TILING,5,873
24129,Split Tab,Pesala,2018-01-31T09:21:49.805Z,13,TABS:TILING,5,873
40762,Scheduled autosave for Sessions,RammsteinAM,2019-09-23T07:58:35.336Z,13,,5,77
31648,Pause/Play media controls in the tab,zeiglerxz,2018-10-25T19:48:35.342Z,13,VIDEO:AUDIO:MEDIA,2,744
29595,Close Tabs to Left/Right of Tab Stack,vulture,2018-08-25T11:25:38.771Z,12,TAB STACKS:CLOSE TABS:CONTEXT MENU,7,485
30895,Save Tab Stack as Session,JasonJosephNYC,2018-10-05T12:07:08.353Z,12,TAB STACKS:SESSIONS,12,606
27439,Suggestion for Efficiently Updating Tab Thumbnails,Ouroboros4545,2018-05-16T02:57:50.911Z,12,TABS:THUMBNAILS:UPDATE,7,1075
24334,Create New Window on Dropping Tabs onto Page,AltCode,2018-01-31T21:19:57.185Z,12,TABS:NEW WINDOW:DRAGANDDROP,6,982
24716,Setting to Mute Tabs by Default,TyrianMollusk,2018-02-05T12:58:43.973Z,12,TABS:MUTE,2,1226
49457,Move "Open a new tab" button on the vertical tabs,krepkay,2020-08-05T11:04:40.098Z,11,,5,98
34679,Move to next tab stack with keyboard,cat83293,2019-02-15T13:39:40.753Z,11,TABS:TAB STACKS:SHORTCUTS,5,450
26706,Setting for Spacing Above Tabs in Maximized and Non-maximized Windows,Pesala,2018-04-15T10:02:04.581Z,11,,8,1476
24336,Optional Confirmation Dialog when Closing All Tabs but Active,david.cortes,2018-01-31T21:23:51.569Z,11,TABS:CLOSE TABS:GUI:WARNING,3,621
32922,Add "Close all Tabs" to Tab submenu,KlausB,2018-12-11T09:48:21.695Z,11,TABS:CONTEXT MENU:CLOSE TABS,7,354
31549,Loading Class for Tabs,luetage,2018-10-23T14:43:52.519Z,11,TABS,2,345
30787,Custom Page Tiling Layouts,jwoodard80,2018-10-02T19:04:01.987Z,10,TABS:TILING:TILED TABS,17,1422
46043,Swap tiled tabs with tabs outside of tiling,perspective,2020-04-23T08:04:49.298Z,10,,7,110
57176,Option to Auto expand/shrink 2 level columns vertical tabbar,dude99,2021-02-18T04:40:42.997Z,10,,1,44
29407,Shortcuts to Change Tab Bar Position,Aldrnari,2018-08-16T14:57:11.596Z,10,SHORTCUTS:TAB BAR,11,1067
25684,Vertical Tabs - Show Grouped Tabs as in Window Panel,Chevi,2018-03-06T06:20:56.819Z,10,TAB STACKS:VERTICAL:TABS,6,613
38556,Please add tab stacks to sync,jp1,2019-06-30T16:25:32.849Z,10,TABS:SYNC:STACKS,1,125
24173,Show URL on the Thumbnails,bimlas,2018-01-31T09:41:46.437Z,10,THUMBNAILS:URL:POP-UP:TABS,4,1137
33108,Make Stacking Tabs Quicker,LiorL,2018-12-16T00:31:49.408Z,10,TABS:TAB STACKS,16,1115
32476,Permanent Tab Tiling,otiv,2018-11-23T15:49:13.439Z,10,TABS:TILING,2,390
31491,Marker/Highlighter for Active Tab on Tab Bar's Scrollbar,dude99,2018-10-21T20:21:24.195Z,10,TAB BAR:SCROLLBAR,1,359
26017,Option/Shortcuts to Cycle/Scroll/Switch Tabs only Inside Current Stack,q11q11,2018-03-20T08:41:39.451Z,10,TAB STACKS:SHORTCUTS:TAB CYCLING,3,772
56282,Specify Icon for Tab Stacks,bkonia,2021-02-01T15:43:35.190Z,9,,2,85
32956,Animation of opening/closing tabs,Gregor,2018-12-11T21:57:50.415Z,9,ANIMATIONS:OPENING:CLOSE TABS:TABS,3,345
47446,Move a tab (or group of tabs) from one profile to another,rhk,2020-05-29T12:08:42.531Z,9,,1,27
36624,Add a option to show popup thumbnails only for stacked tabs.,Ghos3t,2019-04-17T03:29:23.391Z,9,THUMBNAILS:TABS:TAB STACKS,1,198
29208,Triple click or double click a tab to clone it...,TsunamiZ,2018-08-06T11:05:46.058Z,9,CLONE TAB:DOUBLE-CLICK,5,735
27334,Tabs Outliner style Tab Management,Omsir,2018-05-11T10:38:11.654Z,9,TABS,6,1506
29845,Web Page preview,AltCode,2018-09-06T21:52:45.073Z,8,MAC:MACOS,12,562
49064,Scroll to the top of the page by clicking the active tab,litchi.waffler,2020-07-19T17:20:41.053Z,8,,6,91
24367,Double-click Tab Bar to Open New Tab,ugly,2018-02-01T05:52:53.262Z,8,NEW TAB:BUG:DOUBLE-CLICK,7,929
27443,Tab Stacking: Text List on Mouse-over instead of Image Preview,cholzer,2018-05-16T06:47:35.234Z,8,TAB STACKS,10,1029
24500,Movement of Tabs,fweeks,2018-02-02T02:28:19.823Z,8,TABS:WINDOW:DRAGANDDROP,4,1064
24408,Tab List Button on Tab Bar,longvoid,2018-02-01T12:12:54.837Z,8,TABS:MENUS,6,1034
29412,Fix Sound Indicators on Tab Stacks,bushwakko,2018-08-16T19:04:15.991Z,7,TAB STACKS:ICONS:MUTE,2,389
37081,Separating pinned and unpinned tabs,jmiisc,2019-05-07T08:45:55.831Z,7,TABS:PINNED TABS:VERTICAL:IN PROGRESS,4,213
28859,Text color of background tabs is always either black or white  which doesn't match with some themes...,TsunamiZ,2018-07-21T20:39:40.614Z,7,,7,714
49306,Tabs Separator,thepeche,2020-07-30T04:27:21.375Z,7,,4,124
33587,Automatically Tile Tabs without Selection,luetage,2019-01-04T16:56:50.729Z,7,TABS:TILING:SHORTCUTS,12,638
44981,Open in new tab link markers,dude99,2020-03-17T08:55:05.104Z,7,,8,114
38339,Support for Middle Click on Synced Tabs,LonM,2019-06-22T09:45:36.087Z,7,SYNC:TABS:MIDDLE-CLICK:REMOTE SESSIONS,1,133
32358,Tab Stack Button Design,Khaolos,2018-11-19T16:28:16.745Z,7,TAB STACKS,3,456
34728,Tab Stack Highlight Active Tab,Kalyori,2019-02-17T11:46:56.315Z,7,TAB STACKS:TABS:THUMBNAILS,6,355
25665,Scrolling Over Empty Tab Bar Area to Switch Tabs,duarte.framos,2018-03-05T17:35:05.244Z,7,TABS:SCROLLING,10,902
33616,Automatically hibernate new tabs if number of open tabs exceeds X,Darkmatter,2019-01-06T07:13:03.882Z,7,HIBERNATION:BACKGROUND TAB,1,223
29610,Option to Hide New Tab Button,potmeklecbohdan,2018-08-26T09:04:42.276Z,7,BUTTON:NEW TAB:TABS,8,1300
25979,Increase Width of the Most Used Tabs,Seasonly,2018-03-18T14:20:15.618Z,7,TABS,3,793
24906,Remove Tab Spacing in Native Windows,zolcos,2018-02-10T00:49:35.607Z,7,TABS,4,722
30588,Independent Tab Bar Position per Window,GeeZuZz,2018-09-28T20:21:22.392Z,6,TAB BAR:WINDOW,3,438
61439,Confine "Close Tab in Recently Used Order" to current Stack,paul1149,2021-05-22T21:43:39.016Z,6,,4,92
61498,Vivaldi needs more UI animations to feel smoother,emvaized,2021-05-25T05:40:26.272Z,6,,1,57
52624,► Timed Tabs That Open When Scheduled. Hear me out...,JasonJosephNYC,2020-11-05T17:46:02.652Z,6,,5,62
56877,"Close tabs to the right" and two row tabs,kingsteved,2021-02-12T18:31:33.322Z,6,,3,48
56744,Set "close tab activation" option to last in stack,Kikey,2021-02-09T21:58:16.628Z,6,,3,47
48867,Scroll tiled tabs simultaneously,ldexterldesign,2020-07-09T22:15:21.126Z,6,,2,32
32133,Single Close Tab button on the right of the tab bar,sventhebarbarian,2018-11-11T14:11:53.155Z,6,TABS:USER INTERFACE,4,437
38873,Second row of Tabs,YamiryuuZero,2019-07-16T15:08:32.080Z,6,,3,202
35434,Tabs opened from History Navigation buttons should copy the parent tab history,loxaxs,2019-03-13T09:15:22.209Z,6,TABS:CLONE TAB,1,158
34189,Marquee scroll for tabs playing media,LonM,2019-01-29T14:51:05.165Z,6,TABS:AUDIO:ANIMATIONS,3,290
24768,Colored frame for tiled tabs,Seasonly,2018-02-06T14:42:02.653Z,6,TILING:TABS:GUI,1,505
32963,Optional Functions for Double-click on Tab,Gregor,2018-12-12T05:36:43.184Z,5,DOUBLE-CLICK:TABS,7,445
32963,Optional Functions for Double-click on Tab,Gregor,2018-12-12T05:36:43.184Z,5,DOUBLE-CLICK:TABS,7,445
36738,Color for group of tabs,alfaex,2019-04-21T16:23:25.191Z,5,TABS:UI DESIGN,4,313
63903,🚩Place recycle bin "delete all" from bottom to top🚩,stardepp,2021-07-12T14:12:21.542Z,5,,5,74
29801,Make Resizing of Vertical Tab Bar Independent for each Window,Tinsmith,2018-09-05T07:07:24.307Z,5,TAB BAR:VERTICAL,2,314
32948,Opening new page using Start Page,Gregor,2018-12-11T20:58:35.237Z,5,TABS:START PAGE:OPENING,3,262
46403,Remove the favicon border/shadows,pryley,2020-04-28T21:15:03.677Z,5,,5,195
59432,Include Custom Setting for Periodic Reload on the Menu,Pesala,2021-04-10T19:53:32.761Z,5,,2,24
56710,New Layered Tabs needs to add a visible attribute to the body class,drannex42,2021-02-09T08:09:55.341Z,5,,4,117
54159,Untile a single tab from a tiling,valiowk,2020-12-10T00:33:14.010Z,5,,3,76
51400,Right-click menu option for periodic tab reload,rabe85,2020-10-06T21:50:43.981Z,5,PIPELINE,4,62
45765,Change width tab (no modification),stardepp,2020-04-16T08:31:21.116Z,5,,19,207
50147,Show popup thumbnails only for stacked tabs,RandPC,2020-08-28T20:47:52.349Z,5,,1,33
24195,More Space Above Tabs if not Maximized,Pesala,2018-01-31T09:55:17.289Z,5,GUI:TABS:TITLE BAR:WINDOW,4,636
46404,Please change the vivaldi:// favicons to suit the current theme,pryley,2020-04-28T21:23:42.255Z,5,,4,74
25128,Remove Tab Group Duplicates,cmason,2018-02-16T08:45:04.655Z,5,TAB STACKS:DUPLICATE,5,894
39217,Open tab after current tab stack,Hadden89,2019-08-03T01:06:25.497Z,5,TAB STACKS,5,131
34373,Restore Open Tabs After an Update,CheechGe,2019-02-06T16:00:47.610Z,5,UPDATE:SESSION RESTORE,5,673
33936,Close/pin/unpin/move remote tabs,alexander.gorbovets,2019-01-19T09:30:22.430Z,5,,2,198
34455,Tab stack list preview,mivanit,2019-02-08T04:11:04.318Z,5,TAB STACKS:TABS,3,319
34028,Make Tab Sound Icon more Noticeable and less Obstructive,chegr,2019-01-23T00:59:45.291Z,5,AUDIO:PLAYBACK:ANIMATIONS:TABS:ICONS,8,551
33991,Show Insecure Status for HTTP Site on Tabs,Seasonly,2019-01-21T14:46:47.694Z,5,TABS:SECURITY,5,385
32952,Show Extender Menu if Tabs do not Fit the Tab Bar,Gregor,2018-12-11T21:39:19.418Z,5,TAB BAR:BUTTON:TABS,6,440
24754,Tab Stacking from Bookmarks Folders,Asires,2018-02-06T10:18:59.112Z,5,TAB STACKS:BOOKMARK FOLDER,2,677
31374,Copy URL of Tab Stack  Tab Selection,wailord,2018-10-18T10:07:26.473Z,5,TAB STACKS:SELECTION:TABS,2,451
29709,Add Tab Context Menu Entry "Close Tabs by Host",npro,2018-08-31T10:52:41.817Z,5,CLOSE TABS,4,451
27316,Large Tab Previews,mariospilot01,2018-05-10T12:50:14.596Z,5,THUMBNAILS:TAB BAR:PREVIEW,12,2234
26105,Open previous page in new tab,alexander.schultz,2018-03-22T19:01:35.253Z,5,TABS,18,2197
27564,Treat Tab Stacks as One Tab when Scrolling,n.i.c.k,2018-05-21T22:31:31.011Z,5,SCROLLING:TAB STACKS:SHORTCUTS,6,1063
51662,Configurable action for middle click on empty tabbar space,emvaized,2020-10-15T08:12:53.178Z,4,,4,37
51662,Configurable action for middle click on empty tabbar space,emvaized,2020-10-15T08:12:53.178Z,4,,4,37
62648,Edge-style vertical tab shrinking,Vyadei,2021-06-15T13:52:08.208Z,4,,2,62
61652,Vertical Tab Bar Scrolling instead of Tab Shrinking,SachinShekhar,2021-05-29T11:46:49.332Z,4,,1,43
56499,New tab hotkey for second level,Holly,2021-02-05T12:10:53.311Z,4,,6,92
57572,group tabs to be horizontal and the second row tabs to be vertical.,molio,2021-02-27T07:40:40.940Z,4,,23,128
24320,Links opened in a new tab should inherit the zoom setting of the parent,ghpy,2018-01-31T19:55:00.913Z,4,ZOOM:TAB ZOOM,13,1037
55903,Wider pinned tabs,rado.liba,2021-01-25T22:53:20.177Z,4,,1,28
31587,Open Link Outside of Tab stack,Ornorm,2018-10-24T16:36:00.437Z,4,TAB STACKS:LINKS,12,591
34689,Better Context Menu Access Keys,LAPIII,2019-02-15T19:39:12.807Z,4,ACCESSIBILITY:A11Y:CONTEXT MENU,3,229
43108,Bookmark names as tab titles,libcub,2019-12-29T05:38:29.215Z,4,,7,95
42633,remember the speedial tab last used,mrzhouyc,2019-12-10T07:05:39.739Z,4,,3,62
35179,Hide the CLOSE button on background tabs,v25,2019-03-04T15:42:58.859Z,4,TABS:CLOSE TABS,6,384
29493,Home Button for Pinned Tabs Should Rewind to the First Page,haskell,2018-08-20T23:03:53.427Z,4,TABS:PINNED TABS:HOME PAGE,7,585
42246,"Stack by host" should put the tabs inside already existing host stack (if present).,mariomatteis,2019-11-19T09:07:44.042Z,4,,2,34
28251,Option to Show Tabs from All Windows in Tab Cycler,Pesala,2018-06-28T08:35:45.582Z,4,TABS:WINDOWS:TAB CYCLING,4,590
33636,"Show Popup Thumbnails" option hides switcher on tab groups,cab404,2019-01-06T18:22:45.889Z,4,TABS:TAB GROUPS:UI DESIGN,14,635
36702,Mark hibernated tabs with a ZZZ icon overlay...,TsunamiZ,2019-04-20T07:37:19.922Z,4,,3,246
36368,Open new link outside of tab stack,terrdavis,2019-04-08T21:12:32.177Z,4,TAB STACKS:SHORTCUTS:TABS,4,409
36121,Add a new category to tab settings called "double click on tab"...,TsunamiZ,2019-04-02T08:35:05.469Z,4,TABS:SHORTCUTS,1,148
35883,Adjust font size of tab titles,david.cortes,2019-03-27T20:27:43.923Z,4,GUI:FONT SIZE:TAB BAR,1,187
34335,Automatically un-mute tabs that were playing when using "Prioritize active tab" option,SuperFly,2019-02-05T15:09:38.590Z,4,TABS:MUTE:MUSIC:MEDIA:AUDIO,5,520
34514,warning/options when opening a page you already have open,aach1,2019-02-10T06:33:24.821Z,4,,1,116
34041,Hibernate not used tab if it consumes too much CPU (or: Protect the battery from rogue sites),marcond,2019-01-23T14:45:30.343Z,4,HIBERNATION,1,142
32565,Close Cloud Synced Tabs on Other Devices,advaits,2018-11-27T09:26:54.196Z,4,TABS:SYNC:CLOSE TABS,2,335
31892,Search for Tab Stacks in Quick Command,RbR,2018-11-02T06:54:26.010Z,4,TAB STACKS:QUICK COMMANDS:SEARCH,2,359
32186,Play sounds in inactive tab when explicitly asked  leaving other tabs muted,Nostromo,2018-11-13T14:13:47.441Z,4,TABS:MUTE:AUDIO:BACKGROUND TAB,2,417
31097,"Pause the page" or "Lightweight Reader mode",apil_ua,2018-10-10T18:33:42.750Z,4,READER VIEW,1,378
30834,Option to Show Webpage Icons in Tab-stack Previews,gmoss,2018-10-03T18:59:36.900Z,4,TAB STACKS:PREVIEW:ICONS,2,379
27923,Different Keyboard Languages for Different Tabs,bong,2018-06-10T12:31:26.032Z,4,TABS:LANGUAGE,1,425
65130,Hotkey for closing tab stack & Pressing 'x' button at top level closes tab stack,sshingler,2021-08-11T06:14:14.182Z,3,,5,68
65130,Hotkey for closing tab stack & Pressing 'x' button at top level closes tab stack,sshingler,2021-08-11T06:14:14.182Z,3,,5,68
64777,Whitelist for "Hibernate background tabs",DRYN,2021-08-03T11:50:18.594Z,3,,1,26
63339,Remove the favicon border/shadows,niko83,2021-06-29T14:54:11.746Z,3,,2,43
60357,Tab Stack | 2 Level Positioning,Zalex108,2021-04-30T16:13:18.763Z,3,,19,136
56364,Keyboard Shortcuts for moving tab in tab stack,legobuilder26,2021-02-02T22:06:52.597Z,3,,2,41
43918,Reload Tab Stack option,JustinsaneS222,2020-02-04T03:32:49.244Z,3,,6,84
59266,Bouncy Tabs,Smoejoe,2021-04-06T01:01:09.700Z,3,,3,57
56647,desperately need better tab management  especially on tab opening/closing,v0id,2021-02-08T02:08:04.769Z,3,,9,121
58875,Configurable notification sound per tab/domain,VoodooPriest,2021-03-27T18:19:42.443Z,3,,1,21
56209,Revert New tab position behaviour changed when opening from pinned tabs,militzer,2021-01-31T10:33:16.983Z,3,,2,21
34095,Tab background images...,TsunamiZ,2019-01-24T22:01:21.381Z,3,,9,470
57178,Option to invert Parent/Child column for 2 level stacking Tabbar,dude99,2021-02-18T08:14:38.830Z,3,,1,24
56222,Feature to point out current tabs in two level tab stacking,noneoftheabove,2021-01-31T15:33:38.266Z,3,,20,214
56698,Tab Tiling Master-Detail mode (with video example),S0und,2021-02-08T22:15:56.824Z,3,,13,97
56227,Create tab stack out of one tab,6HRFcBhv,2021-01-31T16:43:42.538Z,3,,3,48
55279,New tab position - As first tab,pepitosbesseguti,2021-01-08T18:34:01.579Z,3,,1,22
54781,Auto Hibernate Background tab stacks,joshinator414,2020-12-22T16:32:56.765Z,3,,1,20
33539,Disable Tabs,buzzb,2019-01-01T23:49:44.015Z,3,TABS,3,180
54097,Compact popup thumbnails,LupSpie,2020-12-09T04:11:31.130Z,3,,1,23
52562,Open link in new tab separate stack,ChaayaBandara,2020-11-04T06:09:05.629Z,3,,4,35
52095,Option to drag some word to tab and search,cassil,2020-10-23T06:24:35.542Z,3,,2,19
35158,Clone a tab by simply dragging it down and releasing it in the same window...,TsunamiZ,2019-03-03T22:25:40.989Z,3,,6,302
45322,Picture in Picture (PiP) Mode for Tabs,MKluge,2020-03-30T11:59:52.851Z,3,PIC-IN-PIC,5,66
45077,Show first 9 tabs' number when pressing Ctrl,Wrexes,2020-03-20T12:31:39.375Z,3,,11,73
42635,Option to Make New Background Tab Most Recently Used Tab,kuronekoua,2019-12-10T07:29:18.354Z,3,,0,97
41914,Disable animated fav icon,keikdono,2019-11-05T12:30:43.173Z,3,,1,31
41252,Increasing tab size,VVivid,2019-10-08T13:25:28.623Z,3,,3,66
32415,Show Cloud Synced Tabs in the F2 Search,alexander.gorbovets,2018-11-21T11:35:51.152Z,3,SYNC:QUICK COMMANDS,2,333
40150,Tab previews arranged like Apple's cover flow view option in Finder when too many tabs are open for their previews to be large enough to see.,hungryLlama,2019-09-10T21:13:41.138Z,3,,1,39
39688,When closing tab from tab group the tab thumbnails disappears all at once,Prvock,2019-08-26T07:42:05.370Z,3,,1,30
38448,Auto tab discarding flag disappeared,MannixMD,2019-06-26T07:57:58.995Z,3,HIBERNATION,1,133
38216,Ability to prevent specific tabs from hibernating,jkdba,2019-06-18T14:07:43.030Z,3,,6,234
27357,Vertical Tab Bar Width Per Window,0xBADDCAFE,2018-05-12T17:04:59.518Z,3,TAB BAR:VERTICAL:WINDOWS,2,724
33384,Prefix Quick Command to Find Tabs,hesxenon,2018-12-24T15:04:04.761Z,3,TABS:SHORTCUTS:QUICK COMMANDS,6,450
35395,Make modal password boxes modal to only the tab that request them.,tiva,2019-03-11T13:24:59.561Z,3,POPUP:TABS,2,202
34660,Colorize Tabs that are Playing Audio,dracho,2019-02-14T20:33:25.889Z,3,TABS:AUDIO:COLOR,1,217
33945,Open Image in New Tab with Original Size Regardless of System UI Scale,sprayer,2019-01-19T15:14:26.182Z,3,TABS:IMAGE:ZOOM,2,277
33884,Disable Tab Cycler With Two Tabs,fuller1754,2019-01-17T17:06:28.962Z,3,TAB CYCLING:TABS,1,194
32932,Use Tab Selection Shortcuts to Select Tabs in a Stack,TheDuck,2018-12-11T14:44:25.848Z,3,TABS:TAB STACKS:SHORTCUTS,2,304
31697,Visible Close Button for Tiled Tabs,Ornorm,2018-10-27T02:24:29.648Z,3,TILED TABS:CLOSE:MOUSE,26,1277
31049,Tile Tab Stacks as Separate Tiles,shoust,2018-10-09T14:08:55.919Z,3,TAB STACKS:TILING,2,368
30704,Option to Use Existing Blank Tab When a Link Opens  in a New Tab,drkh,2018-10-01T06:39:17.055Z,3,NEW TAB:LINKS:TABS,4,482
29770,Make Mouse Button Actions on Tab Configurable,CheVe11e_191,2018-09-03T18:32:51.133Z,3,TABS:CONTEXT MENU:MOUSE,1,307
28630,Hibernate Tabs that are Not Selected,ozoratsubasa,2018-07-12T06:35:30.914Z,3,TABS:HIBERNATION,1,505
27455,Auto Switch to Vertical Tabs after x-amount of Tabs,DannyRomano,2018-05-16T23:38:13.918Z,3,TAB BAR:POSITION,2,563
26051,Option to Open New Tabs at Top for Vertical Tab Bar,pepito.sbezzeguti,2018-03-21T10:23:02.284Z,3,TAB BAR:NEW TAB:VERTICAL,1,470
26007,Always honor middle-click to open new tab/background tab,NemoAnonymous,2018-03-20T02:35:54.622Z,3,TABS:LINKS,1,271
58959,New 'Close Tab' commands,paul1149,2021-03-29T15:14:04.820Z,2,,3,59
58959,New 'Close Tab' commands,paul1149,2021-03-29T15:14:04.820Z,2,,3,59
64710,More colors for tab groups,matiasmovie,2021-08-02T03:20:08.094Z,2,,1,27
64699,Multi Vertical Tab Stacks + many other improvments,VivaldiUser1234,2021-08-01T21:05:01.485Z,2,,1,33
63655,Copy all links contained inside a tab-stack at once,LenglBoy,2021-07-07T07:57:39.842Z,2,,4,55
63760,Change tab closing behavior so that it stays within the same tab stack,mindthebees,2021-07-09T02:17:32.925Z,2,,1,36
56941,Custom favicon for stacks,mvsvlitin,2021-02-13T21:25:13.927Z,2,,5,68
63095,Send to device from tab context menu,Gonchi10,2021-06-24T06:18:51.117Z,2,,3,46
63018,Tab names in two lines,VahIV,2021-06-22T09:22:08.671Z,2,,1,38
62903,Contextual Notes,AkramShaban,2021-06-19T23:24:13.821Z,2,,1,35
61289,Add tab context men items to move tab to 1st and lst position,boroda74,2021-05-19T15:39:02.185Z,2,,3,51
61293,Tab Stack Names in Quick Command Search,premwork,2021-05-19T16:57:46.873Z,2,,2,26
59899,Always stack new tabs by host,ElectricAlgorhythm,2021-04-22T02:30:24.929Z,2,,7,126
