ID,Title,Author,Date,Votes,Tags,Posts,Views
33747,When closing tabs  allow option to keep width of tabs the same until you mouse out of the tab bar,uglook,2019-01-10T20:12:19.524Z,0,,2,148
33531,Joining Many Tabs Using the Mouse,ksus,2019-01-01T18:50:45.817Z,0,TABS:SESSIONS:TAB STACKS,12,945
33371,Relational New Tab and Close Tab Options,HonoredMule,2018-12-23T19:24:36.292Z,0,TABS:NEW TAB:POSITION,2,275
33225,New Tabs Should Open at the Top/Left,fabioromeo,2018-12-19T12:23:21.423Z,0,TABS:NEW TAB:TAB BAR,3,322
32953,Scrolling List in Recently Closed Tabs Menu,Gregor,2018-12-11T21:44:35.880Z,0,CLOSED TABS:SCROLLING:MENU:TABS,1,261
32829,End Current Tab Process Shortcut,metafaniel,2018-12-07T19:08:05.889Z,0,TABS:SHORTCUTS:TASK MANAGER,1,194
32813,Different ways of Switching Tabs for Different ways of Activating the Switcher,killchain,2018-12-07T10:16:00.940Z,0,TAB CYCLING:TABS:SHORTCUTS,6,384
32750,Tabs and bookmarks - why not create Tabmarks.,svenna,2018-12-05T16:17:20.674Z,0,TABS:BOOKMARKS,1,161
32596,Another Column of Tabs for New Tabs next to Pinned Tabs,robertebrown,2018-11-28T21:07:14.888Z,0,TABS:PINNED TABS:NEW TAB,2,356
32336,Load Previous and Next Pages in New Tab,Ashtar,2018-11-18T19:25:44.438Z,0,,13,415
32289,Search Engine Inside a Tab,Sebatrox,2018-11-16T19:18:22.741Z,0,TABS:SEARCH ENGINES,5,452
31532,Tab Preview on Videos and Thumbnail,notorious,2018-10-23T04:44:20.644Z,0,TABS:VIDEO:PREVIEW:THUMBNAILS,5,770
30756,Rename "Accent color from Active page" to "Adaptive Tabs Color" and place it under Tabs settings,rejzor,2018-10-02T08:54:37.288Z,0,,3,505
30541,Enable toggling "Tab thumbnails" when "Show Tab Bar" is disabled,hunsharp,2018-09-28T07:48:13.384Z,0,THUMBNAILS:TABS:SHORTCUTS:TAB BAR,8,494
24536,Tab Profiles (Restrictions),becm,2018-02-02T11:05:51.572Z,0,TABS:SECURITY:PRIVATE MODE,2,804
28879,Option to Open Folders and Sites as Hibernated Tab Groups,dannyswift,2018-07-22T17:05:42.841Z,0,HIBERNATION:TAB GROUPS,2,472
27034,Tab Dragging and Scrolling like a Google Search,Mija-El,2018-04-28T17:14:32.013Z,0,SCROLLING:TABS,6,914
24130,Opening Sites from a Panel Omits Tab Stack,jkierzkowski,2018-01-31T09:22:40.842Z,0,TAB STACKS:LINKS:PANELS,2,727
