ID,Title,Author,Date,Votes,Tags,Posts,Views
83843,Hovering the tabs bar  magnifies the tab,jimmyz,2023-02-16T09:10:01.042Z,0,ZOOM:TAB BAR,1,16
83825,Split tab bar location,vkleinschmidt,2023-02-15T20:31:36.284Z,0,TAB BAR:TAB STACKS,5,32
77772,Pinning tab stack and tabs separately on two-level tab bar,Gregor,2022-07-22T19:54:31.961Z,0,TABS,7,120
83798,Submenu for search history - easy search for typed entries,Gregor,2023-02-14T20:24:09.885Z,0,SEARCH:USER INTERFACE:MENUS:HISTORY:ADDRESS BAR,1,25
83797,Option to automatically close bookmarks folders when the panel closes.,thegreensplurge,2023-02-14T17:43:55.280Z,0,PANELS:BOOKMARKS:USER INTERFACE,2,25
83717,Add extension hotkeys to command chains.,Uhri0009,2023-02-12T01:41:16.153Z,0,COMMAND CHAINS:EXTENSIONS:KEYBOARD SHORTCUTS,1,46
83666,A calculator in the title bar,teteka,2023-02-10T04:23:11.494Z,0,STATUS BAR:ADDRESS BAR,6,71
83516,Would Vivaldi consider a Pro version focused on security?,RasheedHolland,2023-02-04T15:25:56.971Z,0,PRIVACY &AMP; SECURITY,24,314
83669,Add option to show entry folder content when search in bookmarks,davidgarciasantes,2023-02-10T07:24:55.487Z,0,BOOKMARKS,1,59
83646,[[topic:topic_is_deleted]],ambbma,2023-02-09T12:31:33.212Z,0,,0,24
83527,Show one specific image in "Load images: cached" mode,picvfud,2023-02-05T00:13:59.751Z,0,MEDIA:WEB PAGES,2,47
63752,Functionality like OneTab,BeOS,2021-07-08T21:31:39.622Z,0,TABS,23,430
83327,How about a built-in 2FA authenticator in Vivaldi?,RasheedHolland,2023-01-29T15:18:29.230Z,0,,15,80
83335,Reminders for The Reading List Please,brianrubin,2023-01-29T20:03:02.943Z,0,USER INTERFACE,5,36
83276,Export Notes to Bookmarks Format,saay,2023-01-27T19:08:56.263Z,0,NOTES:BOOKMARKS:BOOKMARK BAR:SETTINGS,3,49
83243,please add "close on back" functionality,sbernecchia,2023-01-26T15:44:51.231Z,0,TABS:NAVIGATION:USER INTERFACE,1,54
47407,Remembering tabs for closed windows (accidental or not),giomac,2020-05-28T09:25:30.133Z,0,TABS,7,68
83164,Don't change panel bar view settings when opening a panel with a hotkey,demonwing,2023-01-24T01:24:49.301Z,0,PANELS,2,41
83088,Isolate Each Web Site In Its Tab,quartchug,2023-01-21T03:56:11.721Z,0,WEB PAGES:TABS:PRIVACY &AMP; SECURITY:PAGE ACTIONS:COOKIES,2,52
83062,Use bookmark nickname (or description or title) as tab title,RadekPilich,2023-01-20T09:29:22.255Z,0,TABS:USER INTERFACE:BOOKMARKS,3,54
82861,Profiles and Profile Manager,derei,2023-01-13T12:40:12.348Z,0,USER INTERFACE:PROFILES,10,151
83013,Extensions display name,sraczka,2023-01-18T21:28:07.499Z,0,USER INTERFACE:EXTENSIONS:DEVELOPER TOOLS,2,49
77062,Quick Commands - add "Bookmark Tab Stack",RadekPilich,2022-06-26T10:02:53.009Z,0,SETTINGS:COMMAND CHAINS:QUICK COMMANDS:TAB STACKS:BOOKMARKS,2,71
82904,youtube fullscreen,RishitBhardwaj,2023-01-14T12:11:53.113Z,0,WEB PAGES:PAGE ACTIONS:MEDIA,2,52
82897,Reader Mode and html comment class,jamesthebud,2023-01-14T10:51:39.113Z,0,USER INTERFACE:READER VIEW,1,39
82879,Blink Away Shortcut,dalinar,2023-01-13T20:59:45.134Z,0,KEYBOARD SHORTCUTS:TABS,2,39
82768,mirror open stacks and stack names across all devices including possibly mobile,Kunjan,2023-01-10T17:16:34.846Z,0,TABS:TAB STACKS:SYNC:SESSIONS,8,112
82793,Session Taskbar Shortcuts,caseybarx,2023-01-11T18:28:44.269Z,0,TAB STACKS:KEYBOARD SHORTCUTS:SESSIONS,1,34
82781,Fast hide webpanel icons with right click,voicemorpher,2023-01-11T09:21:13.064Z,0,PANELS:TOOLBARS,1,23
82722,I want more space for a line.,jian9,2023-01-09T04:35:06.854Z,0,NOTES,2,66
82603,being able to open 2 profiles (accounts) on Vivaldi browser at the same time?,ZaferN,2023-01-04T06:44:09.591Z,0,SESSIONS:PROFILES,8,106
82703,Creation of Favicons,Lekamea,2023-01-08T14:12:01.891Z,0,START PAGE:SPEED DIAL:THEMES:NAVIGATION:EXTENSIONS:BOOKMARKS,2,65
80823,Sort bookmarks in Ctrl+D menu,igormsk,2022-11-09T07:51:44.984Z,0,BOOKMARKS:BOOKMARK BAR,3,91
82660,Save penultimate session,paul1149,2023-01-06T10:39:41.536Z,0,USER INTERFACE,4,62
82650,"Open Link in New Tab in Window X" right-click option on link,alexandremckinnon,2023-01-06T01:53:00.760Z,0,WINDOW:TABS:MENUS:NAVIGATION:BOOKMARKS,3,39
82474,After a bookmark search  the ability to open a found by matching folder name,kirill1996,2022-12-29T13:50:43.300Z,0,BOOKMARKS,1,31
82448,Give us the ability to configure “new tab position” behavior for each of different methods used to open a new tab and for whether a new tab is opened from inside a tab stack or outside.,Drkhn,2022-12-28T16:10:41.291Z,0,TABS:TAB STACKS:TAB BAR:KEYBOARD SHORTCUTS:SEARCH,1,52
82447,Tab Stack | New tab position,Drkhn,2022-12-28T16:02:04.295Z,0,TABS:TAB STACKS,2,63
82436,Search link text,Xium,2022-12-28T13:39:37.478Z,0,PAGE ACTIONS:MENUS,1,33
82433,Is it possible to have 2 different session on the same window?,alohl669,2022-12-28T12:47:46.003Z,0,SESSIONS:PROFILES,3,48
82406,left-click opens external links in background,peefy,2022-12-27T12:13:19.464Z,0,WEB PAGES:TABS:SETTINGS:NAVIGATION,3,52
82231,New Speed Dial folder created by drag & drop,FatProtea,2022-12-21T02:31:48.220Z,0,USER INTERFACE:SPEED DIAL,3,59
82291,[Improvement] Tabs Sessions: Easier access for stored tabs + auto-update new tabs entries,TheGB0077,2022-12-22T16:01:58.502Z,0,TABS:TOOLBARS:SESSIONS,5,76
82232,Privacy mode doesn't permanently change settings,FatProtea,2022-12-21T02:38:15.518Z,0,WINDOW:USER INTERFACE:SETTINGS:PRIVACY &AMP; SECURITY:AD &AMP; TRACKER BLOCKER,2,55
82253,Sign in to mastodon account on any server,xinnix,2022-12-21T16:58:31.299Z,0,USER INTERFACE:MENUS,3,41
82246,'Double Click' tab to move it to a new window,GeoffG,2022-12-21T13:18:54.357Z,0,USER INTERFACE:TAB STACKS:MOUSE GESTURES,2,39
82106,Revamp Web Protocol Handlers for improved Fediverse integration,SoniEx2,2022-12-17T03:29:47.847Z,0,NAVIGATION:WEB PAGES:USER INTERFACE,3,59
82058,Please support Apple Pay,IdanAdar,2022-12-16T07:16:49.729Z,0,PRIVACY &AMP; SECURITY,3,65
81276,Translate Hot Key,dalinar,2022-11-28T10:54:16.390Z,0,TRANSLATE,5,79
82031,Sorting system for downloads,visvitalis,2022-12-15T16:50:25.272Z,0,DOWNLOADS,1,31
82016,Find & click,jesusfdiaz,2022-12-15T12:10:16.071Z,0,SEARCH:NAVIGATION:KEYBOARD SHORTCUTS,4,59
82019,Translation pop-up window incorrect snapping issue,xarthurx,2022-12-15T13:07:19.027Z,0,USER INTERFACE:ADDRESS BAR,3,37
81915,Add Kagi to search-engine options,Leisureguy,2022-12-12T22:52:23.314Z,0,SEARCH:PRIVACY &AMP; SECURITY,11,144
81925,Plugins that open many tabs at once  should open Hibernated,Reoxur,2022-12-13T07:57:31.215Z,0,TABS:EXTENSIONS,1,37
81859,Pen Support,SteveHartVi,2022-12-11T19:45:52.027Z,0,USER INTERFACE,1,47
81756,Selective remove links in bin,factory17,2022-12-09T10:36:15.665Z,0,USER INTERFACE,6,51
81706,Reload pinned tabstack when launching Vivaldi,LocutusOfBorg,2022-12-08T15:51:53.556Z,0,TABS:TAB BAR:START PAGE,1,19
81703,"tab to bookmark" auto backup after X days,glx,2022-12-08T15:20:02.679Z,0,TABS:TAB STACKS:SESSIONS:BOOKMARKS:HISTORY,1,41
81690,Typing on startup before open,VeniVidiIloadedVivaldi,2022-12-08T13:15:12.329Z,0,SEARCH:ADDRESS BAR:USER INTERFACE,3,40
81599,Add "repeat last action" to context menu within page,sjetesjete,2022-12-07T10:29:42.872Z,0,PAGE ACTIONS,3,38
81687,separate counter on "Window" panel for each browser profile,glx,2022-12-08T12:42:36.120Z,0,PANELS:TABS:WINDOW,1,29
81583,Option for adding featured search engines,Dancer18,2022-12-07T09:18:18.958Z,0,SETTINGS:SEARCH,6,53
81552,Enable all commands in Toolbar editor,solidsnake,2022-12-06T17:10:30.557Z,0,USER INTERFACE:TOOLBARS:SETTINGS,3,58
81586,Reduce UI bar size,takeva,2022-12-07T09:40:44.102Z,0,USER INTERFACE,3,39
81560,Address bar link opens in new tab,jimfbk55,2022-12-06T19:56:15.609Z,0,ADDRESS BAR,2,35
81476,Save source URL and destination folder for each download,vgerdes,2022-12-04T12:57:28.752Z,0,DOWNLOADS:WEB PAGES:SETTINGS,1,34
81465,Windows on ARM Vivaldi Desktop Client,philliplanos,2022-12-03T23:35:26.971Z,0,DOWNLOADS,1,36
81398,Can we have normal Tab Groups like the other Chromium browsers such as Brave & Chrome?,ADMlNlSTRATOR,2022-12-01T22:52:00.808Z,0,TAB STACKS:TAB BAR:TABS:USER INTERFACE,2,68
81362,Add Overlay Tool,Vivaldiscool,2022-11-30T17:48:46.953Z,0,DEVELOPER TOOLS,2,55
81351,Default ShortCut | --profile-directory,Zalex108,2022-11-30T11:50:46.175Z,0,PROFILES,3,54
43689,Copy/Paste Images Into Notes,Sillvva,2020-01-24T20:24:51.708Z,0,PANELS,7,137
81322,Issue with Custom Margin Resting,pablo2plato,2022-11-29T16:41:02.730Z,0,USER INTERFACE,2,39
81317,Encrypt Notes,heavytc1,2022-11-29T13:10:11.349Z,0,SYNC:NOTES:PRIVACY &AMP; SECURITY,4,60
81266,Request: Profiles Dialog - Save Window Size for Next Time,dalinar,2022-11-27T20:43:25.315Z,0,,1,29
81076,Reading List: Option to Not Automatically Mark Items as Read,Geniusak,2022-11-20T19:40:23.904Z,0,READING LIST,1,38
80966,Suggest open tabs on Speed Dial's add dialog,sjetesjete,2022-11-16T07:25:20.266Z,0,SPEED DIAL:PAGE ACTIONS:BOOKMARKS:ADDRESS BAR:QUICK COMMANDS,2,59
80843,Privacy: I want a browser that doesn't make any automatic network connections without my initiating it,shabeer,2022-11-10T02:53:56.110Z,0,SETTINGS:PRIVACY &AMP; SECURITY,24,503
80884,Tab preview customization,droidev,2022-11-11T20:46:02.215Z,0,TABS:TAB STACKS:TAB BAR,5,62
80871,add automatic phonetic transliteration in the LingvaNex translator,avelev,2022-11-11T14:37:44.407Z,0,USER INTERFACE:TRANSLATE:PANELS,1,57
80869,Adding one more download-info,Prvock,2022-11-11T13:08:20.711Z,0,DOWNLOADS,1,47
80847,Column style in Vivaldi,Ericlv13,2022-11-10T10:23:03.060Z,0,BOOKMARKS:THEMES,1,56
80799,name tabstacks,eliardnotneru,2022-11-08T07:26:21.679Z,0,TAB STACKS:TAB BAR:TABS,3,58
80732,Incorporate "I don't care about cookies" functionality,paul1149,2022-11-04T14:01:29.972Z,0,WEB PAGES,22,340
80719,IBA and Google Analytics opt-out extensions installed by default,newscpq,2022-11-04T06:03:03.058Z,0,AD &AMP; TRACKER BLOCKER:EXTENSIONS,3,78
80726,Better signature integration for Vivaldi Mail.,nicktsak,2022-11-04T10:46:04.482Z,0,SETTINGS,2,41
79871,Adress Auto-Complete option to only show bookmarks,revers,2022-10-05T22:26:56.153Z,0,BOOKMARKS,5,98
80564,Toggle/button/shortCut/context menue entry to *easily* make really broad the scrollbar,michaa7,2022-10-28T12:35:06.083Z,0,USER INTERFACE:WEB PAGES,1,34
80552,Sync Task to do list across multiple devices,tienthebros,2022-10-27T16:01:45.186Z,0,SYNC:UPDATES:TOOLBARS,2,60
80522,[[topic:topic_is_deleted]],swiggi,2022-10-26T13:01:44.786Z,0,,0,111
80509,Auto-translate selected text on pdf,DeerWhale,2022-10-25T19:40:40.551Z,0,TRANSLATE,1,29
80472,Show synced tabs in Tabbar,knobi,2022-10-24T18:29:37.964Z,0,TABS:SYNC:TAB BAR,3,48
80453,CMD + Reload should open a new tab,msueldo,2022-10-23T19:16:23.294Z,0,TABS:WEB PAGES,2,49
80455,"freeze wallpaper animation outside the start page/speed dial" option,diinyoron,2022-10-23T20:37:58.921Z,0,WEB PAGES:THEMES:TAB BAR:START PAGE:SPEED DIAL,1,46
80413,Bookmark searches and NOT altering the results,CADutchman,2022-10-22T05:24:54.503Z,0,BOOKMARKS,1,39
80377,Extension windows appearing out of bounds,andi90,2022-10-20T21:37:11.609Z,0,EXTENSIONS,1,79
80369,Fine-grained autocomplete settings,SharpBlade,2022-10-20T15:42:43.239Z,0,SEARCH:NAVIGATION:ADDRESS BAR,1,67
70139,x11 cut and paste,tim9,2021-12-19T09:52:29.517Z,0,SETTINGS,10,240
79993,Add a clickable utton for exiting fullscreen mode,alexvis2020,2022-10-08T18:35:46.532Z,0,USER INTERFACE:QUICK COMMANDS:NAVIGATION,7,90
80250,Add floating button for fullscreen toggle,anaskhan,2022-10-15T15:41:18.255Z,0,USER INTERFACE:COMMAND CHAINS,11,112
80147,Save cookies on exit only for certain sites,iateyourgranny,2022-10-12T20:53:22.870Z,0,PRIVACY &AMP; SECURITY:COOKIES,1,55
80127,Add night mode like in Maxthon browser  with slider included,blakotast,2022-10-12T10:07:36.073Z,0,THEMES,1,60
80100,Add "Move" in Notes Context Menu,janrif,2022-10-11T15:36:48.133Z,0,USER INTERFACE:NOTES:MENUS,3,62
80060,Drag and Dropping URL to Tab Stack Bug,MuratL,2022-10-10T16:34:29.571Z,0,TABS:TAB STACKS,4,62
79981,Memorize zoom for installed vialdi://apps,XeiDaMoKa,2022-10-08T14:48:37.693Z,0,ZOOM:WINDOW:USER INTERFACE:EXTENSIONS,8,117
80038,[Commands][Tabs] Add left/right tab without wrap around,eugenesv,2022-10-10T06:08:09.301Z,0,TABS:TAB BAR,1,31
79965,Hide address bar & status bar when watching pinned tabs,lilacKaZ,2022-10-08T07:06:23.018Z,0,USER INTERFACE:TOOLBARS:STATUS BAR:ADDRESS BAR,1,34
75293,Downloads window - please show location of folder where downloads are being saved,nickoo,2022-05-13T07:43:36.246Z,0,,7,66
78634,Search themes?,eddjasfreeman,2022-08-21T12:56:10.129Z,0,THEMES,3,93
77187,Vivaldi OS based on chromium OS.,Jknapp1208,2022-06-30T00:32:14.858Z,0,,1,94
79714,Some amazing new features in devtools of Chrome 106,martinspire,2022-09-28T19:04:28.218Z,0,DEVELOPER TOOLS,4,103
79699,Sessions,Misery,2022-09-28T10:27:10.188Z,0,TABS:TAB STACKS:SESSIONS,1,58
79674,Dark mode in "view-source",karly,2022-09-27T10:15:42.482Z,0,THEMES:USER INTERFACE:DEVELOPER TOOLS,6,79
79628,Make "Untile selection" work within tab stacks,sirien.neiris,2022-09-25T14:29:22.433Z,0,USER INTERFACE:TABS:TAB STACKS:COMMAND:MENUS,1,52
79601,GDI rendering mode option,tsa-work,2022-09-24T08:25:23.630Z,0,SETTINGS:USER INTERFACE,2,34
79506,Allow PDF viewer text writing  drawing and signature.,lostscene,2022-09-21T05:45:50.635Z,0,USER INTERFACE:MEDIA,3,81
79449,Command Chain Command to Set Any Setting,rziiil,2022-09-19T04:19:57.548Z,0,SETTINGS,6,63
79030,Option to set geolocation manually,modifier,2022-09-02T19:33:02.296Z,0,SETTINGS,3,65
79354,[MacOS] Video Streaming full screen,Energizzer,2022-09-15T14:33:28.934Z,0,,1,26
79293,Add the ability to add Date to Folder name when bookmarking tab group,hasselk,2022-09-13T08:44:57.903Z,0,BOOKMARKS,2,30
79256,Page scrolls while jumping to search items,dteiml,2022-09-11T15:50:38.061Z,0,,2,43
78706,Add "Open in New Background Tab" in Quick Commands menu,theericbeaty,2022-08-24T04:59:24.596Z,0,TABS,3,63
79226,Add `Stack Tabs only from the command parameter` in command chain,sbv95,2022-09-10T08:48:21.097Z,0,TABS,2,26
79182,Keyboard Shortcut or Command to Change Panel Position,moshemo,2022-09-08T09:39:33.149Z,0,PANELS,1,27
79178,batch import speed dial thumbnails,JPlissken,2022-09-08T06:27:48.815Z,0,BOOKMARKS,1,31
79167,Show visual cue when Vivaldi's Address Field Drop-Down Menu is being populated,williamscaleba,2022-09-07T18:01:36.183Z,0,ADDRESS BAR,1,37
79127,Allow users to set custom proxy settings in incognito mode.,Jknapp1208,2022-09-05T21:45:18.395Z,0,SETTINGS,1,44
79023,Confirm dialog for merging tab stacks,RadekPilich,2022-09-02T15:17:38.977Z,0,,4,46
55110,Parental controls for changing settings  extensions  favorites,toroned,2021-01-03T15:07:44.719Z,0,SETTINGS,5,76
78987,Migrate from Seamonkey  import a whole profile incl. email,LigH,2022-09-01T13:54:36.311Z,0,,5,56
66427,Option to disable system tray icons,mystrdat,2021-09-17T10:54:14.753Z,0,,5,127
78914,Ability to switch between images (slide show) with Start Page background,savidge,2022-08-29T20:54:32.858Z,0,THEMES,2,51
78781,Prioritise specific bookmarks for address bar/autocomplete,JustABrowser58,2022-08-26T04:17:21.017Z,0,BOOKMARKS,3,67
78807,Option to remove speed dial entries from taskbar context menu,Malebolge,2022-08-26T16:50:22.401Z,0,,7,74
78789,Multifunctional bookmarks as in Raindrop .io,kirill1996,2022-08-26T09:22:38.350Z,0,BOOKMARKS,2,59
78776,Clear the history and bookmark panels' "search" field after the panel closes,Aelius,2022-08-26T02:04:58.405Z,0,PANELS,3,56
78755,Table of Contents/Outline panel,cdrozak,2022-08-25T12:44:32.311Z,0,PANELS,1,38
78711,Keyword for Command Chain,shifte,2022-08-24T08:55:18.705Z,0,,8,115
77670,Back & Forward links in Notes,AbhishekMisra,2022-07-19T09:17:25.133Z,0,,3,55
54251,New feature: New Tab from Link Opens in Background Needs Refinement,shadowxt,2020-12-11T09:02:16.392Z,0,,3,94
78676,Make Picture-in-picture window rounder,SARRAF,2022-08-23T04:10:43.092Z,0,PIC-IN-PIC,1,75
78645,Menu dropdown in fullscreen,randoomdude,2022-08-21T23:06:28.438Z,0,,2,40
78629,[Start Up] Restore Last session in "Inactive" Background tab,Lamaro,2022-08-21T06:20:40.289Z,0,,3,48
78492,Vivaldi Blue – the safe browser,PawelPoland,2022-08-17T02:19:04.257Z,0,,33,531
78463,Support playready (DRM),Residentcl,2022-08-16T01:20:37.739Z,0,,5,90
75445,Want Cmd+` to cycle through windows,joefilmmaker,2022-05-17T18:49:32.113Z,0,MACOS,7,187
78472,Allow toggling all types of Quick Command Item,anaskhan,2022-08-16T08:33:27.366Z,0,QUICK COMMANDS:SETTINGS,4,87
78471,Speed dial fit thumbnails to row,anaskhan,2022-08-16T08:21:32.174Z,0,SPEED DIAL,1,71
78350,Always Show HTML5 Video Controls,kaundere,2022-08-12T20:31:35.675Z,0,SETTINGS,1,68
78227,Page action to darken fonts,Andrew111,2022-08-10T15:25:17.240Z,0,,12,85
78235,Request: Update Pop-up thumbnails when navigating away from tab,nih1,2022-08-10T16:56:29.821Z,0,TABS,3,40
78237,Charts and diagrams in notes,molex,2022-08-10T17:51:34.976Z,0,,3,44
78096,Improve UX on MacOS by opening Vivaldi  in "full-screen" mode,vitalii1k,2022-08-06T07:02:44.523Z,0,,1,149
78058,Session selection from Vivaldi app's task bar context menu,ZlaD,2022-08-04T12:43:02.499Z,0,,1,33
78047,Resize tab icon when tabs are on the side,zarte13,2022-08-04T01:55:23.664Z,0,TABS,1,23
78008,Feature suggestion - Floating side webpanel,DaniloAsanin,2022-08-02T11:14:01.991Z,0,PANELS,1,86
77886,Swipe Down Mouse Gesture open links,XeiDaMoKa,2022-07-27T14:09:48.579Z,0,SETTINGS,4,42
77846,Settings Web-Panel,Sendekomplex,2022-07-26T08:48:55.923Z,0,BOOKMARKS,3,81
77830,Exclude search nickname in search suggestions,shifte,2022-07-25T11:58:28.922Z,0,,6,89
77782,save sessions into speed dial,bdkdavid,2022-07-23T12:47:22.909Z,0,BOOKMARKS,1,45
77649,Vivaldi Start Page In Web Panel,TeroBauKoChack,2022-07-18T13:51:52.519Z,0,PANELS,2,77
77624,hit counter on the start page/bookmarks,nkateko,2022-07-17T04:02:15.468Z,0,BOOKMARKS,1,32
77616,Extension Sets,brenji,2022-07-16T18:55:02.903Z,0,PANELS,3,103
77585,Support in-document links in MHTML,MVV_,2022-07-15T09:55:16.000Z,0,,2,37
77245,Option to Pass Referrals in HTTPS Modes,btabke,2022-07-01T21:55:53.137Z,0,,5,102
61071,Add Audio Icon in Menu,tbussmann,2021-05-14T10:36:30.956Z,0,TABS,2,62
77511,🌟 Trim Stack-Tabs 🌟,bx376,2022-07-12T14:06:38.814Z,0,TABS,5,352
77528,Profile Shortcuts on Linux (Ubuntu),rued,2022-07-13T09:45:56.068Z,0,,4,48
77527,Show title of the tab stack in the description pop-up,RadekPilich,2022-07-13T08:11:47.632Z,0,TAB STACKS:TABS,1,61
38358,Add Support for More Interface Languages,Pesala,2019-06-23T04:34:27.801Z,0,SETTINGS,10,245
77494,Shortcut File to start Command Chains,legobuilder26,2022-07-11T22:03:06.856Z,0,,1,33
77465,Is it possible to have vivaldi settings as web panel?,Dancer18,2022-07-10T14:23:43.227Z,0,PANELS,12,171
77454,Option to remove items automatically from a panel when opened/,irish66,2022-07-09T21:13:59.103Z,0,PANELS,3,72
77436,Search on page with current search engine words,irata,2022-07-09T08:10:42.421Z,0,ADDRESS BAR,2,50
77419,A snapshot from a video that is being watched on YouTube,Avangard,2022-07-08T14:30:15.036Z,0,,2,50
77407,Show warning when Content Blocker blocked resources from main domain,dude99,2022-07-08T07:08:12.215Z,0,,1,40
77246,Default download location based on filter,Teiem,2022-07-02T00:04:49.650Z,0,SETTINGS,2,40
77174,Web Panel toolbar customisation,spanakop,2022-06-29T10:58:10.742Z,0,PANELS,1,68
77154,Automatically sort tabs into existing stacks by host,Essem,2022-06-28T20:52:07.280Z,0,TABS,3,59
77152,reading mode color not with theme connected,user2303,2022-06-28T19:42:36.628Z,0,THEMES,1,49
77000,Ramdisk and Vivaldi,drradic,2022-06-24T14:30:48.759Z,0,,13,218
77037,Boost Vivaldi in comparative privacy tests,Hersir,2022-06-25T15:20:12.908Z,0,,2,69
77024,Mozilla has launched an extension that can translate pages without the need for a 3rd party service  when will Vivaldi do the same thing.,Jknapp1208,2022-06-25T01:20:30.883Z,0,SETTINGS,1,58
77010,Rollbacks  please,TheRealJRogers,2022-06-24T16:41:51.517Z,0,,3,66
77019,Interrupted reload doesn't remove information.,BanisterJH,2022-06-24T22:19:32.205Z,0,PANELS,1,32
76997,macOS : no history navigation when scrolling tab bar,latinus31,2022-06-24T10:50:19.803Z,0,TABS,1,30
76967,Compress tab name on vertical tabs (like edge),kzhe,2022-06-23T14:09:46.152Z,0,TABS,1,45
76966,An option for Firefox-style MRU,Ineu,2022-06-23T11:47:45.252Z,0,TABS,1,47
76960,Add You.com search engine,meowmixes98,2022-06-23T03:21:49.778Z,0,,2,55
76895,Bookmarks in new tab not working,davidgarciasantes,2022-06-21T08:56:13.682Z,0,BOOKMARKS,3,47
76859,Automatically set cookie policy for browsers,quartchug,2022-06-19T18:30:02.760Z,0,SETTINGS,2,37
73684,Behaviour akin to #account-consistency,pleasesendhelp,2022-04-02T19:31:55.209Z,0,SETTINGS,4,95
76768,View -> Second Tab Level,KSB,2022-06-17T00:30:10.511Z,0,SETTINGS,3,61
76132,Show popup thumbnails only for tabs  NOT for stacks,AzDayton,2022-06-05T02:51:29.983Z,0,TABS,8,66
76760,Translator Request - multiple options how single words (or specific phrases) can be translated,VivaldiFan137,2022-06-16T18:46:14.041Z,0,,1,16
76714,Prevent screenshot from opening Screenshot folder,H4M5TER,2022-06-15T17:19:21.548Z,0,SETTINGS,2,42
76700,Option to disable using search engine nicknames,Gregor,2022-06-15T14:04:29.814Z,0,ADDRESS BAR,6,95
76708,Thumbnails delayed refresh,Gregor,2022-06-15T15:13:25.516Z,0,,3,31
76669,Refresh display,jesus2099,2022-06-14T18:23:05.538Z,0,,3,50
76680,Pin tabs to the left of other pinned tabs...,TsunamiZ,2022-06-15T05:19:48.730Z,0,,1,21
76651,Increase localStorage quota for websites,CorruptComputer,2022-06-14T13:48:51.597Z,0,SETTINGS,4,84
76643,"Select All" on the Right-Click Menu,mccpry,2022-06-14T12:21:30.351Z,0,,4,41
75487,Time To Live for Cookies,mikestone,2022-05-18T18:47:23.068Z,0,SETTINGS,2,35
76438,Command for "Search with selection" that shows the search menu,killchain,2022-06-10T10:05:37.743Z,0,,10,113
70958,move Estimated time left for download,urfausto,2022-01-16T18:18:16.002Z,0,,15,128
73999,Disable lifting speed dial thumbnails,wiekeinzweiter,2022-04-08T21:06:42.349Z,0,THEMES,12,263
76266,Add selected tabs to reading list,bstumpf,2022-06-07T18:38:29.983Z,0,TABS,2,19
76237,Password for starting up browser when syncronisation is enabled,andersholt,2022-06-07T09:33:34.812Z,0,,1,23
76224,Open a new tab on the screen where I clicked to open the new tab (two monitors),JotaOdiceu,2022-06-06T23:30:02.600Z,0,TABS,2,19
76223,News,frkylmz420,2022-06-06T22:46:50.933Z,0,BOOKMARKS,1,37
76148,Ability to press Alt key within Linux Mint Web Apps,thecloughnetwork,2022-06-05T14:30:22.924Z,0,,1,19
75908,Pinned Tab needs to be of right size,dericka,2022-06-02T09:00:25.649Z,0,TABS,2,27
73166,Scroll tabs when opening tabs in the background,krusion,2022-03-18T02:29:58.044Z,0,SCROLLABLE TABS:TABS,6,169
75800,no spaces in file names,zedaardv,2022-05-31T08:04:58.729Z,0,SETTINGS,1,25
75694,Choose location for first- & second-row tabs individually,MourningStar,2022-05-26T15:28:10.936Z,0,TABS,1,19
75687,Fix keyboard focus in PDF view,garneticaciddos,2022-05-26T12:37:24.162Z,0,TABS,6,32
75624,New vivaldi luxurious style,juanitofut6,2022-05-23T17:43:55.826Z,0,THEMES,4,124
75599,In the Download dialog  add a "Copy URL" button,GreetingMarsupial,2022-05-22T17:10:34.880Z,0,ADDRESS BAR,7,100
75311,change tab bar position easier by a click with two fingers,lillianli,2022-05-13T14:30:58.784Z,0,TABS,6,80
75557,Option to use POST search method in private windows only,Thescorb0,2022-05-21T02:33:54.576Z,0,SETTINGS,3,30
75558,Advanced Search Queries,adax64,2022-05-21T03:11:15.491Z,0,SETTINGS,1,31
75504,Panels shouldn't autohide while something is being dragged,homatyano,2022-05-19T09:21:37.707Z,0,PANELS,1,45
73861,Make text on Speed Dial items centered,jxst991059,2022-04-07T01:02:59.124Z,0,SPEED DIAL,5,186
75479,Separate themes for Mail/RSS and the rest of UI,cassandrawilliams,2022-05-18T15:21:30.584Z,0,THEMES,1,54
75469,ORDER IN IMAGE CAPTURE IN NOTES,diversiondiferente,2022-05-18T11:34:19.488Z,0,,3,51
75434,Grid of buttons in context menu - Extension API,lukaszpolowczyk,2022-05-17T13:35:28.396Z,0,,4,50
75408,Split same tab  same login  same typing  same clicks  same session,donac64,2022-05-16T15:34:38.007Z,0,TABS,2,32
75384,In-app timer notifications,MoosMas,2022-05-16T07:03:21.835Z,0,,1,29
75331,"Bare" window - not full screen,JohnBarton,2022-05-14T01:23:46.122Z,0,,6,53
75359,Window size in status info when resizing window,Thescorb0,2022-05-15T00:26:43.101Z,0,,2,25
74691,Allow space characters in nickname of search engines,Xium,2022-04-24T05:14:52.573Z,0,SETTINGS,29,270
74899,Allow Spatial Navigation with scroll wheel,naveisland,2022-05-01T00:52:19.918Z,0,,4,59
74778,Allow browser to export its menu bar for users with a global menu bar,NewAgeDerpDerp,2022-04-26T20:03:38.618Z,0,LINUX,2,139
74721,Proper option to address BGR subpixel monitors,teglicha,2022-04-25T09:32:40.706Z,0,,1,35
70755,Open a URL from the address with the mouse,ryukusu,2022-01-10T19:12:58.500Z,0,ADDRESS BAR,9,266
74510,Request: Shift Click Clear Icon in Downloads SideBar to Clear AND close the sidebar,dalinar,2022-04-18T21:51:56.905Z,0,PANELS,4,55
74507,Limiting browser framerate,rinrinrinrinrin,2022-04-18T20:26:25.734Z,0,SETTINGS,1,93
74496,PDF Viewer Options,bdecker,2022-04-18T14:59:12.868Z,0,SETTINGS,1,57
74438,Container tabs?,zstg,2022-04-17T03:48:40.357Z,0,TABS,2,332
74295,Org Support for Notes (in addition to markdown),robertmcatee,2022-04-13T21:40:46.546Z,0,,1,46
74151,Translate Panel: make text boxes taller,valiowk,2022-04-12T04:21:02.131Z,0,PANELS,5,56
74137,Notification notification dots now uses accent colors,basseX,2022-04-11T19:45:11.136Z,0,THEMES,1,56
74123,Color code Bookmarks,FLTR,2022-04-11T12:49:53.909Z,0,BOOKMARKS,1,59
74112,Ability to search menu content at Appearance => Menu section in Settings,Dobypeti,2022-04-11T06:29:53.622Z,0,SETTINGS,1,33
