ID,Title,Author,Date,Votes,Tags,Posts,Views
60318,Open a bookmark in the current tab stack,wuerth.peter,2021-04-30T06:52:35.891Z,5,BOOKMARKS,2,67
39454,In Quick Commands panel  sort Tabs section from MRU to LRU,arnaudm,2019-08-16T03:35:52.289Z,5,QUICK COMMANDS:TABS,2,173
38064,Nicknamed search engines for Vivaldi features (browser history  open tabs  etc),tanamraam3714,2019-06-11T20:58:35.483Z,5,NICKNAMES:QUICK COMMANDS:ADDRESS BAR:SEARCH ENGINES,3,422
24320,Links opened in a new tab should inherit the zoom setting of the parent,ghpy,2018-01-31T19:55:00.913Z,5,ZOOM:TAB ZOOM:TABS,13,1072
54707,Generate QR code from link,DarkWiiPlayer,2020-12-20T10:51:37.960Z,5,CONTEXT MENU:QR CODES,4,204
56810,Search in notes content from the panel,Hadden89,2021-02-11T06:49:15.216Z,5,PANELS,9,106
56710,New Layered Tabs needs to add a visible attribute to the body class,drannex42,2021-02-09T08:09:55.341Z,5,TABS,4,172
35504,Disable thumbnail reload in Start Page,Danil1404,2019-03-15T13:52:16.408Z,5,START PAGE:KEYBOARD:DONE:SETTINGS,4,288
55272,Hibernate Background Tabs button should be inside the Tab bar,dude99,2021-01-08T14:15:19.053Z,5,,1,68
54731,Supported ARM64 build,syklist,2020-12-21T08:09:26.044Z,5,,1,286
53988,Make parent bookmarks bold when choosing a bookmark location,matt101,2020-12-07T12:05:31.995Z,5,BOOKMARKS,3,46
53874,Context-sensitive shortcuts and mouse gestures,jumpsq,2020-12-04T09:58:32.842Z,5,,3,46
26414,Do not Stop Playback when a Web Panel is Closed,papykpy,2018-04-02T20:57:11.741Z,5,WEB PANEL:MEDIA:PLAYBACK,7,1495
36122,Bookmarks bar right click menu  command to "sort alphabetically once"...,TsunamiZ,2019-04-02T09:02:38.681Z,5,BOOKMARKS:SORT,2,257
51598,petition to add a website time tracker,mizouniihichem,2020-10-13T21:37:13.419Z,5,,5,127
37478,Open bookmark folders with a single click instead of a double click,Crayon,2019-05-18T08:19:16.814Z,5,BOOKMARKS:BOOKMARK FOLDER,9,497
51319,Auto PiP on scrolling,komga,2020-10-02T21:45:54.913Z,5,PIC-IN-PIC,1,99
45992,backward/forward 5sec in PIP,matiasmovie,2020-04-22T17:01:04.748Z,5,PIC-IN-PIC,3,79
50736,Trigger Break Mode when Vivaldi Timer runs out,zeitsparen,2020-09-14T17:21:40.059Z,5,SETTINGS,6,52
49936,Extension can only be enabled on specific websites,Poto,2020-08-22T13:17:34.898Z,5,,11,150
33553,Add a Command for Override Scroll is Pan,Pesala,2019-01-02T20:08:13.714Z,5,MOUSE GESTURES:SHORTCUTS:SCROLLING:SETTINGS,4,577
48896,Can Vivaldi History be sorted by date the tab was closed?,mpierce,2020-07-10T22:53:38.398Z,5,PANELS,5,45
48639,Remember last used theme,Hadden89,2020-06-30T07:05:34.659Z,5,THEMES,3,63
24195,More Space Above Tabs if not Maximized,Pesala,2018-01-31T09:55:17.289Z,5,GUI:TABS:TITLE BAR:WINDOW,4,717
47632,PDF reader can directly copy selected content to note,davidmakeanewlife,2020-06-04T10:29:46.882Z,5,,1,36
46729,Monochrome Icons,otto,2020-05-07T00:24:26.503Z,5,PANELS,4,90
25108,Extensions to Speed Dial,mentat,2018-02-15T14:39:50.080Z,5,SPEED DIAL:EXTENSION:BOOKMARKS,3,602
47205,Vivaldi 'Dashboard',Foxglove,2020-05-20T16:54:21.572Z,5,,3,120
36984,Auto paste highlighted text into Quick command like Find in page,dude99,2019-05-03T07:44:30.965Z,5,QUICK COMMANDS,2,272
24527,Emoji keyboard,dominicw2,2018-02-02T10:46:19.671Z,5,KEYBOARD,26,3564
46584,Search by Image,matiasmovie,2020-05-03T02:13:54.273Z,5,,1,98
46006,Option to make the clock bigger,vivaldiadmin,2020-04-22T19:22:37.744Z,5,SETTINGS,5,68
45636,PIP window can use the arrow keys Forward / Backward,Poto,2020-04-11T10:26:27.261Z,5,PIC-IN-PIC,1,63
27977,Easier way to Reopen Closed Window from Trashcan,dude99,2018-06-13T10:09:32.593Z,5,TRASHCAN,5,1116
44889,Access the Clock features even when Vivaldi is minimized,Ornorm,2020-03-13T20:24:16.714Z,5,,5,51
26393,Add folder option to Bookmark Panel/Manager items,ozoratsubasa,2018-04-02T00:17:40.083Z,5,BOOKMARKS,10,1344
42003,Keyboard command for invert filter,Catweazle,2019-11-08T10:42:53.372Z,5,,7,95
41696,Sync Keyboard shortcut or Gesture,myehia,2019-10-28T19:24:30.402Z,5,SHORTCUTS,2,303
41114,Disable all extensions,stardepp,2019-10-03T09:55:13.221Z,5,,11,898
41104,Allow changing checkbox state in a note when in view mode,[[global:former_user]],2019-10-02T20:35:53.192Z,5,PANELS,1,37
40133,Find in page: visual highlighting,webaschtl,2019-09-10T14:55:05.312Z,5,FIND IN PAGE,8,313
30263,Smart text selection by word...,TsunamiZ,2018-09-23T13:11:48.076Z,5,,14,938
18487,Filters for Visual Impairment,pettrer,2017-07-06T06:34:40.712Z,5,PAGE ACTIONS,3,1283
39217,Open tab after current tab stack,Hadden89,2019-08-03T01:06:25.497Z,5,TAB STACKS:TABS,5,266
39190,Switch profiles from Quick Commands,Llamanerds,2019-08-01T20:49:16.158Z,5,PROFILES:QUICK COMMANDS:SETTINGS,1,172
38684,Add new bookmark to bottom of folder instead of top when drag & dropping,amasokin,2019-07-06T22:21:40.706Z,5,BOOKMARKS:BOOKMARK FOLDER,3,337
31221,Command to Open a Link in a New Window,kusokuzeshiki,2018-10-14T12:07:18.273Z,5,LINKS:SHORTCUTS:NEW WINDOW,5,652
38270,Add otpion for user data encryption (especially notes / bookmarks) instead of keeping them as plain text,ROTFL,2019-06-20T12:59:33.797Z,5,SECURITY:ENCRYPTION:NOTES:BOOKMARKS,1,224
34377,Image viewer enhancements,Nekomajin,2019-02-06T19:31:55.289Z,5,ZOOM,7,699
33936,Close/pin/unpin/move remote tabs,alexander.gorbovets,2019-01-19T09:30:22.430Z,5,TABS,2,208
36902,Please stop pulling focus from main window to panel on notification,flooners,2019-04-29T18:43:15.308Z,5,WEB PANELS:FOCUS:BUG:ADDRESS BAR:PANELS,6,562
37580,History of Recently Saved Bookmark Locations,bullibulli,2019-05-21T23:51:29.925Z,5,BOOKMARKS,2,157
37328,Show hovering zoom percentage if status bar is set to hover,cst0827,2019-05-13T07:51:07.309Z,5,GUI:STATUS BAR:HOVER,1,256
36643,Option to open all bookmarks in a folder in the bookmark menu,Blubbeh,2019-04-17T21:39:52.070Z,5,BOOKMARKS:MENU,10,826
36254,Browser Robotization & Automation,dies_felices,2019-04-05T00:36:51.949Z,5,PROFILES,12,1500
36368,Open new link outside of tab stack,terrdavis,2019-04-08T21:12:32.177Z,5,TAB STACKS:SHORTCUTS:TABS,4,523
36351,Show Title & URL when mouseover on Rewind/FastForward buttons,dude99,2019-04-08T08:39:33.204Z,5,TOOLBAR:TOOLTIPS,2,315
36097,Paste as plain text by default,Gregor,2019-04-01T17:10:08.098Z,5,SHORTCUTS:SETTINGS,6,262
33796,Apply Speed Dial Background Image with Drag 'n Drop,Hadden89,2019-01-13T15:45:05.050Z,5,BOOKMARKS:DRAGANDDROP:BACKGROUND:START PAGE,4,532
35037,Search in history searches PAGE CONTENT of cached pages.,dskfjl3jlrjl,2019-02-27T16:40:50.075Z,5,HISTORY:HISTORY SEARCH,3,410
34455,Tab stack list preview,mivanit,2019-02-08T04:11:04.318Z,5,TAB STACKS:TABS,3,373
34478,Option to Auto Expand New Tab Stacks in the Window Panel,stewshka,2019-02-08T16:05:12.879Z,5,SETTINGS:TAB STACKS,2,254
34028,Make Tab Sound Icon more Noticeable and less Obstructive,chegr,2019-01-23T00:59:45.291Z,5,AUDIO:SOUND:MEDIA:PLAYBACK:TABS:ANIMATIONS,8,873
34189,Marquee scroll for tabs playing media,LonM,2019-01-29T14:51:05.165Z,5,TABS:AUDIO:ANIMATIONS,3,394
32952,Show Extender Menu if Tabs do not Fit the Tab Bar,Gregor,2018-12-11T21:39:19.418Z,5,TAB BAR:BUTTON:TABS,6,468
32846,Allow Different Color for Active Tab,Vivipop,2018-12-08T16:50:21.863Z,5,THEMES:ACTIVE TABS,3,432
32522,Keep Bookmark Folder Expanded after Using Find in Bookmarks Panel,BerndS,2018-11-25T11:57:03.085Z,5,PANELS:BOOKMARKS PANEL:BOOKMARK FOLDER:SEARCH,5,769
31151,Separate Typed History from History,lamantin,2018-10-12T11:44:22.362Z,5,TYPED HISTORY:BROWSER HISTORY:SETTINGS,1,323
30296,Option to Use Accent Color from Each Page,chanon,2018-09-24T10:03:10.202Z,5,THEMES:TABS,1,274
29917,(Optional) Widgets bar,Ornorm,2018-09-09T18:43:32.707Z,5,TOOLBARS,22,2084
29609,Theme Vivaldi Through Configuration File,KnobBlob,2018-08-25T23:25:56.018Z,5,THEMES:CONFIGURATION,2,581
30086,Hide Scheme (http/https) based on displaying the full address,hentioe,2018-09-16T06:39:06.835Z,5,ADDRESS BAR,2,530
29690,Customize default Wikipedia search depending on installation language,ROTFL,2018-08-30T08:02:29.740Z,5,SEARCH ENGINES:LANGUAGE,9,918
29879,Detach Panel in its own Window and Pin it on Top,peefy,2018-09-08T00:53:00.688Z,5,PANELS,3,666
29709,Add Tab Context Menu Entry "Close Tabs by Host",npro,2018-08-31T10:52:41.817Z,5,CLOSE TABS:TABS,4,456
27316,Large Tab Previews,mariospilot01,2018-05-10T12:50:14.596Z,5,THUMBNAILS:TAB BAR:PREVIEW:TABS,12,2409
28357,More Customization for Reader View,drynov,2018-07-03T15:14:46.972Z,5,READER VIEW,2,737
27367,Different Web Page Zoom Settings for Different Monitors,fyhn,2018-05-13T09:01:42.637Z,5,ZOOM,2,740
27564,Treat Tab Stacks as One Tab when Scrolling,n.i.c.k,2018-05-21T22:31:31.011Z,5,SCROLLING:TAB STACKS:SHORTCUTS:TABS,6,1121
27435,Web Panel Search with Results Opening in a Tab,mypointofview,2018-05-15T22:54:16.474Z,5,PANELS:SEARCH:NEW TAB,3,1147
27358,Save Selected Windows as a Session,digitrance,2018-05-12T19:15:54.421Z,5,SESSIONS:WINDOWS,2,782
25616,Next/Previous Arrows in Speed Dial,solidsnake,2018-03-03T16:59:41.012Z,5,SPEED DIAL:NAVIGATION:BOOKMARKS,2,774
25398,Option to Open a Page Automatically in Incognito Mode,ric54321,2018-02-23T17:03:48.946Z,5,PRIVACY,1,513
25240,Enable JSON export and import of bookmarks  ability to overwrite existing,RBV,2018-02-19T17:20:06.323Z,5,IMPORT:EXPORT:BOOKMARKS,1,566
25195,Delete button for the list on trash,CheVe11e_191,2018-02-18T10:55:33.213Z,5,,1,653
24410,Save and Restore Size and Position of Every Window in Saved Sessions,viava,2018-02-01T12:22:25.674Z,5,SESSIONS:WINDOWS,3,1269
25106,Greyscale Theme for All Extension Icons,yes.aravind,2018-02-15T14:04:05.058Z,5,THEMES:ICONS:EXTENSION,3,855
24711,A new kind of bookmark that actively saves your place in browsing,TyrianMollusk,2018-02-05T12:20:56.358Z,5,BOOKMARKS,3,477
24496,Easy removal of remembered form logins / passwords / inputs,ROTFL,2018-02-02T00:17:34.556Z,5,AUTOCOMPLETE:CLEAR:FORM FILLING,2,541
71367,"Synchronize now" button,jhonca,2022-01-28T12:16:43.606Z,4,,4,132
36565,Option to start browser in fullscreen,Vincent500,2019-04-14T19:58:18.215Z,4,STARTUP:SETTINGS:FULLSCREEN,12,1718
65137,We need animated GIF/image marker when animation looping is disabled/limited to once,dude99,2021-08-11T08:06:27.139Z,4,,4,100
82281,Export single bookmark folder,JohnnyJohnny,2022-12-22T11:22:52.091Z,4,BOOKMARKS,4,57
52501,File chooser,chuang1313,2020-11-02T21:34:05.073Z,4,,5,247
48057,Typed history checkbox to Delete Browsing Data,lamantin,2020-06-14T11:28:20.473Z,4,ADDRESS BAR,3,104
80554,🛡️Export Ad Blocker and Track Blocker Sources 🛡️,stardepp,2022-10-27T19:59:23.585Z,4,AD &AMP; TRACKER BLOCKER:PRIVACY &AMP; SECURITY,1,48
79968,Make Simple Popup Window PLEASE,BlokZinciri,2022-10-08T07:45:58.214Z,4,WINDOW:THEMES:PANELS:PAGE ACTIONS:USER INTERFACE,6,145
45322,Picture in Picture (PiP) Mode for Tabs,MKluge,2020-03-30T11:59:52.851Z,4,PIC-IN-PIC:TABS,6,109
77530,Mouse Gestures for "Copy link under mouse pointer",windymelt,2022-07-13T11:17:13.539Z,4,SETTINGS,3,87
64758,Simple feature request: command line help,dedeco,2021-08-02T23:26:57.644Z,4,,2,59
79427,USENET newsreader for Vivaldi,Jknapp1208,2022-09-18T01:06:28.600Z,4,,0,35
79345,Support AVIF formatted images in themes,AltCode,2022-09-15T10:56:27.229Z,4,THEMES,6,88
66997,Extend "Add Bookmarks",Taiseibust,2021-10-01T18:02:29.720Z,4,BOOKMARKS,9,146
76952,Support Firefox Extensions,AltCode,2022-06-22T16:49:08.390Z,4,WILL NOT DO,12,554
78423,Stop the find bar (ctrl+f) from moving page content,Aelius,2022-08-15T00:13:07.655Z,4,,11,102
78192,Search engine panel you can send selected text to,rajpalan,2022-08-09T22:30:19.990Z,4,PANELS,8,118
77685,Accordion Tab Stack Title while expanded,steve8track,2022-07-19T21:42:20.010Z,4,TABS,12,173
78211,Move always use HTTPS setting to security section,Ericlv13,2022-08-10T10:02:59.610Z,4,SETTINGS,2,50
77663,Add icon color picker to the standalone installer.,adriant,2022-07-19T05:19:27.217Z,4,,2,54
68329,Omnibox api support,vincerv,2021-11-06T08:32:44.473Z,4,ADDRESS BAR,6,198
58141,Privacy Settings Master Switch,twoksdev,2021-03-15T11:27:02.380Z,4,SETTINGS,2,65
77452,Create note from selection -> use highlighter links,WildEnte,2022-07-09T18:23:43.079Z,4,,4,75
63232,Option "None" for saving History settings,xtech,2021-06-27T13:48:20.686Z,4,SETTINGS,15,245
66592,A fallback default language for the translator,RammsteinAM,2021-09-21T08:24:40.246Z,4,,2,57
56594,Move Stacked Tabs to New Stack,bkonia,2021-02-06T22:13:18.335Z,4,TABS,6,110
65839,Open Bookmark in Another Profile,glassich,2021-08-31T23:21:34.643Z,4,BOOKMARKS,2,86
76322,Permanent 'Find on page' search field  available on toolbar.,ChocoMilkFPS,2022-06-09T00:28:48.045Z,4,TOOLBAR EDITOR:FIND IN PAGE,1,88
76228,Reading List "Add Current Page" Button Position,Frunk,2022-06-07T07:03:25.702Z,4,SETTINGS,3,34
76075,Privacy panel,WildEnte,2022-06-04T10:34:42.374Z,4,PANELS,3,104
75878,Button containers/folders,AltCode,2022-06-01T18:09:05.448Z,4,TOOLBARS,3,92
73105,Preserve the order of windows in the taskbar,Agych,2022-03-16T16:17:54.839Z,4,,5,115
74087,New mouse gesture: Open Images in background,OctalVolt,2022-04-10T15:58:08.508Z,4,SETTINGS,1,28
70106,Protect cookies from removal,Grabol,2021-12-18T10:22:12.310Z,4,SETTINGS,13,227
57744,A Quick History on mouse ! (a floating history),Seasonly,2021-03-04T15:04:14.871Z,4,,2,124
61055,Ability to pin favicon for tab stack and not change it while switching between tabs inside,mihanentalpo,2021-05-14T04:01:24.067Z,4,TABS,2,110
71488,Allow changing theme from Quick Settings panel for Start Page,juanvase,2022-02-01T03:06:29.978Z,4,SETTINGS,3,61
72795,Close Tab Activation > Always Activate Tab in Current Tab Stack,RadekPilich,2022-03-06T10:32:33.713Z,4,TABS,2,80
39962,Choose what settings to opt out of sync,azohc,2019-09-06T19:29:38.683Z,4,SETTINGS,10,166
67364,Opening from history in new tab by default,Gregor,2021-10-10T11:08:11.938Z,4,PANELS,11,192
53723,vivaldistatus.com as additional panel together with installation,derDay,2020-12-01T09:07:46.314Z,4,PANELS,4,65
68051,Pause Periodic Reload on Active Tab,JohnGeldreich,2021-10-28T14:59:32.173Z,4,TABS,8,97
72596,Add Reading List to the Start Page,Komposten,2022-03-01T10:40:17.538Z,4,READING LIST:START PAGE,1,91
39725,Better distinction of headlines in the www and history panel,Gregor,2019-08-27T20:57:49.077Z,4,HISTORY:HISTORY PANEL:PANELS,8,364
71358,Open/Close Tab Animation,madix,2022-01-28T08:35:48.689Z,4,TABS,3,107
67371,Icon for detected PWA support,Maste,2021-10-10T15:02:49.796Z,4,TABS,2,52
71870,Infinite Tab Stacking,EFA2021,2022-02-11T12:29:12.467Z,4,TABS,4,54
71859,Please import all Horizontal scrollbar new improvement to Vertical tabbar,dude99,2022-02-11T07:36:53.369Z,4,TABS,1,49
71597,'Send to Your Devices' history,MoosMas,2022-02-04T15:38:39.018Z,4,,1,72
44879,Two-step accept address autocomplete,matiasmovie,2020-03-13T16:45:42.470Z,4,,3,96
70636,Notes: Add "Sort by Date Modified" option,wtee,2022-01-06T16:51:20.286Z,4,,1,19
70525,Show detected language with automatic detection,Thescorb0,2022-01-02T03:41:04.636Z,4,,1,35
42376,Different language for each profile,VVivid,2019-11-26T09:51:33.749Z,4,,6,95
36612,Expose extension commands in Keyboard and Mouse config,zakius,2019-04-16T18:21:18.791Z,4,SHORTCUTS:EXTENSION,12,721
69788,Continued MV2 Extension support,hackwizard,2021-12-11T04:12:37.665Z,4,,1,89
69209,Translate option,ssg.agp,2021-12-02T16:40:07.889Z,4,ADDRESS BAR,8,113
69441,[[topic:topic_is_deleted]],MoosMas,2021-12-05T12:57:53.087Z,4,,0,109
69182,Put estimated time for download completion near the graph for downloading speed (otherwise it's not visible in popup window),ultrapoci,2021-12-02T11:38:48.644Z,4,PANELS,1,37
48209,Pinch Zooming feature to be enabled via Touchpad,Jawadd1,2020-06-17T18:56:02.034Z,4,,11,993
48611,Remove or allow for configurable minimum window width.,caiden,2020-06-29T07:06:33.481Z,4,,9,435
62283,Add transparency feature to title bar,Mohammad2021,2021-06-10T23:08:40.266Z,4,THEMES,3,196
65278,Customise keys for scrolling up or down with keyboard,mouravieffantiableism,2021-08-15T00:50:11.207Z,4,SETTINGS,16,903
67363,Remembering the position of scrolling notes,Gregor,2021-10-10T11:01:11.971Z,4,PANELS,1,26
67313,Add shortcut to vivaldi://translate-internals/ in Settings,dude99,2021-10-09T06:40:03.494Z,4,SETTINGS,1,50
66376,Tab Stacking Compact,m0nk3y,2021-09-16T11:55:09.182Z,4,TABS,7,120
66854,Improve the "anti-adblock" detection in the built-in adblocker,Omnimaxus,2021-09-27T20:32:28.393Z,4,AD BLOCKER:SETTINGS,2,246
66780,Make labels global,WildEnte,2021-09-25T15:38:22.772Z,4,,4,69
65991,Domain based Accent color for Stack tabs by Host,dude99,2021-09-06T07:12:09.557Z,4,TABS,2,95
51662,Configurable action for middle click on empty tabbar space,emvaized,2020-10-15T08:12:53.178Z,4,TABS,4,56
64323,Request: Right click extension to disable option,dokhas,2021-07-24T15:16:03.689Z,4,,5,123
64270,Rounded context menu and icons,joaomascarenhas,2021-07-22T20:58:33.628Z,4,,2,121
63788,Find and replace in notes,code3,2021-07-09T14:55:28.638Z,4,,1,44
63760,Change tab closing behavior so that it stays within the same tab stack,mindthebees,2021-07-09T02:17:32.925Z,4,TABS,1,67
63329,Built-in translator in context menu,atxnor86,2021-06-29T11:24:16.447Z,4,,5,109
55619,Max width tabs...,TsunamiZ,2021-01-18T00:25:15.601Z,4,TABS,2,94
63172,Block sites to improve productivity,pq4u,2021-06-25T19:59:48.435Z,4,,4,93
45507,Option for right-to-left languages in reader mode,petol777,2020-04-06T12:35:19.451Z,4,SETTINGS,6,109
45441,Always open links in new tab from speed dial,Hadden89,2020-04-03T16:59:53.711Z,4,BOOKMARKS,4,138
63028,SpeedDial | [Option] Reflow Labels in two (or more) rows,Hadden89,2021-06-22T14:41:55.171Z,4,BOOKMARKS,1,57
63008,Allow highlight of bookmark folder by keyboard,ejiwl,2021-06-22T06:46:44.738Z,4,BOOKMARKS,4,59
61259,Options in settings for where bookmarks go by default,FLInfinite,2021-05-18T18:45:51.721Z,4,BOOKMARKS,5,146
62310,It would be nice to have on status bar the current internet speed,josefermin,2021-06-11T06:52:54.750Z,4,,7,115
62287,Add Zoom text only to Vivaldi,Mohammad2021,2021-06-10T23:45:17.687Z,4,SETTINGS,1,73
61396,Option to hover over a translated sentence and see original sentence,valiowk,2021-05-21T21:01:04.114Z,4,,3,48
60981,Quick Commands in Address Box,zhangdl,2021-05-12T14:51:03.697Z,4,ADDRESS BAR:QUICK COMMANDS:SETTINGS,3,115
60928,Dark mode for error pages and chrome:// setting pages,c933103,2021-05-11T13:55:35.286Z,4,THEMES,6,256
60930,Ability to add custom name for Image Capture,NedAb,2021-05-11T14:41:20.260Z,4,CAPTURE,1,89
60544,Some Google parts needs to be removed from Vivaldi.,Luxuri,2021-05-03T14:09:17.951Z,4,ADDRESS BAR,10,269
60209,Display Title Before URL in Dropdown,Geniusak,2021-04-28T18:08:17.380Z,4,ADDRESS BAR,2,72
60156,Support $removeparam for adblocker,tverye,2021-04-27T14:38:36.262Z,4,,3,374
56364,Keyboard Shortcuts for moving tab in tab stack,legobuilder26,2021-02-02T22:06:52.597Z,4,TABS,2,54
45715,Ability to drag and drop an URL into the Bookmark Bar folders and subfolders,Daladdine,2020-04-15T00:29:06.118Z,4,BOOKMARKS BAR:BOOKMARKS,19,964
43918,Reload Tab Stack option,JustinsaneS222,2020-02-04T03:32:49.244Z,4,TABS,6,160
58935,A simple option to close a tab and clear it's cookies,ammoniumcyanide,2021-03-29T04:16:45.494Z,4,,3,34
58875,Configurable notification sound per tab/domain,VoodooPriest,2021-03-27T18:19:42.443Z,4,TABS,1,30
58500,Desktop "Web Apps',gloruiousfly,2021-03-20T21:23:44.142Z,4,TABS,4,119
57572,group tabs to be horizontal and the second row tabs to be vertical.,molio,2021-02-27T07:40:40.940Z,4,TABS,19,200
57114,Add RAM/CPU usage to status bar,Odyssey346,2021-02-16T15:49:10.996Z,4,,7,86
56140,Full Width Address Field Drop-Down,debiedowner,2021-01-30T02:00:39.178Z,4,ADDRESS BAR,9,102
56953,Force internal PDF viewer,ryofurue,2021-02-14T06:36:11.677Z,4,,1,42
39175,A command to reverse the sort order on a selection of tabs...,TsunamiZ,2019-07-31T23:14:12.005Z,4,,8,256
56274,Keyboard shortcut to Copy as Plain Text,debiedowner,2021-02-01T11:50:59.406Z,4,,1,68
49197,Show keyboard shortcut in button tooltip,janrifkinson,2020-07-25T17:09:51.432Z,4,,11,151
55452,Up/down arrow keys to be used for finding previous/next when the "find in page" text field is focussed...,TsunamiZ,2021-01-13T18:47:20.454Z,4,,1,35
55279,New tab position - As first tab,pepitosbesseguti,2021-01-08T18:34:01.579Z,4,TABS,1,38
54599,Panel custom icons / bigger icons,dehyde,2020-12-17T19:12:53.990Z,4,PANELS,3,200
54527,🔎 Extended Search engines drop down list 🔍,stardepp,2020-12-16T09:31:05.814Z,4,ADDRESS BAR,5,105
53333,Blinking cursor (caret),invexx,2020-11-24T18:24:49.955Z,4,A11Y:ACCESSIBILITY,2,124
52812,💻 Bookmarks | Parent Sign,Zalex108,2020-11-09T12:12:15.101Z,4,BOOKMARKS,1,45
52551,Borders around the active tab and frame,gabevilela,2020-11-03T21:37:22.896Z,4,THEMES,7,345
51994,Markdown full page previewer [Split mode],Hadden89,2020-10-21T06:43:20.794Z,4,PANELS,6,69
51860,Highlight modified shortcuts in the Keyboard Settings,Stardust,2020-10-18T01:12:00.963Z,4,SETTINGS,1,17
51766,Global Hibernate ALL Background Tabs & Windows,dude99,2020-10-16T06:18:38.154Z,4,,1,62
51626,Don't replace content of address bar when writing on it,hprmedina,2020-10-14T13:24:47.226Z,4,ADDRESS BAR,2,38
51302,Focus mode,Dumbleporte,2020-10-02T08:21:49.090Z,4,,3,272
36301,Media Keyboard Keys Compatibility,KSB,2019-04-05T23:15:18.995Z,4,KEYBOARD:SHORTCUTS:SETTINGS,12,752
51083,Media keys received in panels,gmetais,2020-09-25T07:56:14.743Z,4,PANELS,1,27
50920,CSS Theme Downloader/Manager,Pliex,2020-09-20T12:20:46.835Z,4,THEMES,6,220
49477,Vivaldi settings and configuration,jjsanchez46,2020-08-05T21:39:19.810Z,4,SETTINGS,4,155
48143,Possibility to force save all settings,[[global:former_user]],2020-06-16T08:56:53.765Z,4,SETTINGS,1,25
48028,Indicator/Icon for "you have a note on this website/page",Jawadd1,2020-06-13T16:39:09.074Z,4,,1,28
48021,[[topic:topic_is_deleted]],Nekomajin,2020-06-13T10:34:20.834Z,4,,0,196
47180,Move items from the status bar to a web panel,izacks,2020-05-20T05:02:42.184Z,4,PANELS,10,162
39276,Arrow keys in Search Box,mikiqex,2019-08-07T05:52:48.698Z,4,SEARCH ENGINES:SEARCH BAR:SHORTCUTS:ADDRESS BAR,6,698
46575,Indicator for download state,jumpsq,2020-05-02T18:19:14.554Z,4,,2,105
46450,display name of the day in the clock utility,mizouniihichem,2020-04-29T18:09:15.184Z,4,,1,22
39518,Context menu item to download a link straight away to the default download location,felagund,2019-08-20T09:07:44.034Z,4,DOWNLOADS:CONTEXT MENU:LINKS,3,198
45212,Option to replace the start page search box with the address bar,ninokadic,2020-03-25T15:50:36.745Z,4,ADDRESS BAR,7,84
45515,Alarm clock pop-up with sound,matvey-nt,2020-04-06T15:43:31.755Z,4,PANELS,1,49
35179,Hide the CLOSE button on background tabs,v25,2019-03-04T15:42:58.859Z,4,TABS:CLOSE TABS,6,498
42730,Suggestion: opera like bookmark manager,ManavJain,2019-12-14T08:09:35.202Z,4,BOOKMARKS,6,185
43172,Enhance reader for PDF  epub  and other book formats,skyafs,2019-12-31T18:55:06.083Z,4,,5,166
42485,Sync: separate download and upload options,paul1149,2019-12-02T14:45:55.585Z,4,SETTINGS,1,42
42445,Having a refined clean categorized download tab as an option.,benn83,2019-11-29T21:39:58.770Z,4,,1,40
42316,Auto copy selected text in clipboard,Fighter4Freedom,2019-11-22T12:26:26.717Z,4,SETTINGS,6,226
42310,Improve spatial navigation,jumpsq,2019-11-22T00:35:53.978Z,4,,4,122
42246,"Stack by host" should put the tabs inside already existing host stack (if present).,mariomatteis,2019-11-19T09:07:44.042Z,4,TABS,2,42
41751,Auto-close floating panel after a set period of time,AltCode,2019-10-31T14:06:47.188Z,4,PANELS,1,51
40683,Vivaldi titlebar should become paler when window no longer has focus,Montiverdi,2019-09-21T03:22:55.735Z,4,THEMES,4,117
40250,"Remote tabs" panel,ROTFL,2019-09-12T09:20:08.715Z,4,PANELS:SYNC,1,132
38848,Readaloud,spillaip,2019-07-15T16:14:18.814Z,4,ACCESSIBILITY:VOICE:READING,5,754
37588,Speech recognition software support,XyZed,2019-05-22T10:10:41.378Z,4,ACCESSIBILITY,4,465
38493,Better hints for gesture recording,idgor,2019-06-27T08:54:48.027Z,4,MOUSE GESTURES:SETTINGS,2,213
38222,Vivaldi Updater: Keep Last Session,sirfredrick,2019-06-18T23:55:35.207Z,4,,4,190
37555,Logitech Color Matching?,KSB,2019-05-20T23:11:29.118Z,4,INTEGRATION:THEMES,5,355
37506,Choose location of new bookmark via autocomplete,kacl780tr,2019-05-19T06:56:48.686Z,4,BOOKMARKS:ADDRESS BAR,2,167
37409,Detect and Remove Duplicate URLs,jeronymite,2019-05-16T00:05:12.090Z,4,HISTORY:DUPLICATE,2,300
37273,Firefox-style Page Info,Trentie,2019-05-11T12:14:52.280Z,4,,8,570
36731,Make the sidebar not pop up when pressing keybinds,dannyswift,2019-04-21T13:14:03.631Z,4,PANELS:SHORTCUTS,2,241
36702,Mark hibernated tabs with a ZZZ icon overlay...,TsunamiZ,2019-04-20T07:37:19.922Z,4,TABS,3,253
36542,Auto-hide overlay panel after mouse-out X time pass,dude99,2019-04-13T18:49:18.062Z,4,PANEL:AUTO-HIDE,2,437
35883,Adjust font size of tab titles,david.cortes,2019-03-27T20:27:43.923Z,4,GUI:FONT SIZE:TAB BAR:TABS,1,352
35587,Collapse menu on click when menu is expanded,fuller1754,2019-03-18T20:57:26.808Z,4,MENU BAR:ADDRESS BAR,1,220
35395,Make modal password boxes modal to only the tab that request them.,tiva,2019-03-11T13:24:59.561Z,4,POPUP:TABS,2,278
83513,Reading list in Home Screen?,mcastel,2023-02-04T12:44:58.920Z,3,USER INTERFACE:START PAGE:READING LIST,2,46
82325,More image formats supported when copying image to Clipboard,greasebr2,2022-12-23T16:50:09.093Z,3,USER INTERFACE:MEDIA:DOWNLOADS:MENUS,11,205
58719,Jump to active tab in window panel,jonahvenglarcik,2021-03-25T00:37:07.046Z,3,PANELS,5,63
83018,Command line support,hideli,2023-01-19T00:04:20.508Z,3,USER INTERFACE:SETTINGS,6,142
66940,Allow to change Vivaldi icon,takaken930,2021-09-30T00:30:56.159Z,3,SETTINGS,5,239
