ID,Title,Author,Date,Votes,Tags,Posts,Views
25296,Add a nice calendar,jumpsq,2018-02-21T06:57:37.295Z,11,IN PROGRESS:CALDAV:CALENDAR,14,1322
25698,Add Calendar Panel,CheVe11e_191,2018-03-06T13:45:06.261Z,8,PANELS:IN PROGRESS:CALENDAR,6,1049
53423,Day Names (Sat  Sun  etc),heronheart,2020-11-25T23:36:47.600Z,8,,2,39
53299,Microsoft Calendar Sync support,LonM,2020-11-24T13:51:40.750Z,5,,6,79
53400,Printable monthly view,summoner,2020-11-25T17:45:36.680Z,1,,1,23
53946,Alert When Event is Over,legobuilder26,2020-12-05T22:09:52.352Z,1,,2,28
53367,Fix Width for week view and panel,jumpsq,2020-11-25T09:49:58.080Z,0,,4,35
54039,Better support for tasks in Calendar panel,valiowk,2020-12-08T10:05:56.387Z,0,,1,5
