ID,Title,Author,Date,Votes,Tags
27922,Open Startpage/History/Bookmarks Tabs in First or Last Position,Hadden89,2018-06-10T08:38:47.221Z,4,TABS:START PAGE
27913,Effective Infinite Popup Spamming Counter-measures,dude99,2018-06-09T19:43:14.239Z,0,POPUP:BLOCK
26843,Read Command-Line Arguments from a File on Startup,burnout426,2018-04-21T17:23:31.144Z,3,COMMANDLINE
27872,Separate font setting for Reader View,CheVe11e_191,2018-06-06T15:23:14.344Z,12,READER VIEW:FONTS:FONT
26784,Return to Previous Position after Scroll to Top,talkaboom,2018-04-19T07:15:50.997Z,11,NAVIGATION
24219,Additional Features for the Extension Icon Container,luetage,2018-01-31T10:41:44.247Z,37,EXTENSIONS:GUI:CUSTOMIZE:TOOLBAR
27837,Exception List for "Block Third-Party Cookies",Agych,2018-06-04T12:00:22.008Z,1,COOKIES:BLOCK:THIRD-PARTY
27834,Separate Closed Windows from Closed tab list,dude99,2018-06-04T07:41:03.884Z,2,CLOSED TABS:WINDOWS PANEL
27024,Option to Not Shrink Pinned Tabs,alexander.gorbovets,2018-04-28T07:39:23.033Z,5,PINNED TABS
27757,Ephemeral Tabs - Close Tabs not Used in a While,rojaviv,2018-05-30T19:31:34.240Z,1,CLOSE TABS
27778,Automatically Decompress Downloads and Discard Archive,Ouroboros4545,2018-05-31T19:34:32.844Z,1,DOWNLOADS
27734,Scroll to Top / Bottom Buttons,bebotette,2018-05-30T07:20:00.140Z,0,GUI:SCROLLING:BUTTONS
27656,Image View Alignment Settings,scypion,2018-05-26T06:26:02.688Z,0,IMAGE
27458,Data upload/download stats on address bar upgrade,bebotette,2018-05-17T03:21:41.655Z,2,DOWNLOADS:STATUS BAR:UPLOADS
24248,Option to delete items from disk inside the download panel,krabbel,2018-01-31T11:37:55.472Z,70,DOWNLOADS:PIPELINE:DELETE
27612,Remove Close  Minimise and/or Maximise Buttons,Radwulf,2018-05-24T00:53:01.136Z,0,GUI:CUSTOMIZE:LINUX:GTK
27588,Virtual Reality Support for Vivaldi as Chrome Canary,jordicg,2018-05-23T00:33:10.771Z,0,VIRTUAL REALITY
27501,Improve Efficiency of "Paste and go",svtjase,2018-05-19T09:43:18.922Z,2,CONTEXT MENU:PASTE AND GO
25564,Allow Third-party Cookies for Specific Websites,macsmister,2018-03-01T14:15:26.504Z,5,COOKIES:SITE SETTINGS:THIRD-PARTY
27556,Ability to Sign in to Chrome Account,DestructiveBurn,2018-05-21T16:21:37.461Z,0,RESOLVED:SYNC
25943,Multiple %s Placeholders in Search Engines,lstusr,2018-03-16T12:32:05.642Z,2,SEARCH ENGINES
27511,Option to Auto-restart Crashed Extensions After 3 secs.,dude99,2018-05-19T13:40:18.785Z,0,EXTENSIONS
27527,Use Native GTK Scroll Bar on Linux,david.cortes,2018-05-19T20:55:04.580Z,1,LINUX:SCROLLBAR:GTK
27516,Auto-group Tabs,rojaviv,2018-05-19T15:42:20.362Z,1,TAB STACKS
26605,Add a Link from About Page to Vivaldi.com,phoenix.fox,2018-04-11T01:08:48.095Z,4,ABOUT VIVALDI:VIVALDI UPDATE
27436,Image/Media/Documents Viewer,bebotette,2018-05-16T00:41:36.783Z,3,VIDEO:IMAGE:DRAGANDDROP
27449,'Minimap' Scrollbar from Sublime Text,Ouroboros4545,2018-05-16T14:09:12.972Z,1,WEBPAGES:SCROLLBAR
24621,Fields for Individual Search Engines in the Bookmarks Bar,GMayr,2018-02-03T09:19:05.123Z,7,SEARCH ENGINES:BOOKMARKS BAR
24529,Graphic Tools in Screenshot Feature,dominicw2,2018-02-02T10:54:33.741Z,21,SCREENSHOT:SCREEN CAPTURE:EDIT:TOOLS
27401,Add Current Save Directory to the Download Popup,Marko Indaco,2018-05-14T21:15:24.619Z,4,GUI:DOWNLOADS
27392,Keyboard Shortcut to Create a New Note,Strathos,2018-05-14T14:13:47.289Z,3,SHORTCUTS:NOTES
27388,Pin to overflow (for extensions),danielson,2018-05-14T13:32:38.157Z,2,EXTENSIONS
27360,Option to Use Vivaldi Launch Parameters from .ini File,Agych,2018-05-12T22:56:11.217Z,0,LAUNCH:PARAMETERS
27358,Save Selected Windows as a Session,digitrance,2018-05-12T19:15:54.421Z,3,SESSIONS:WINDOWS
26972,Links Manager Dialogue Like Opera 12.18,BOUSILLOR,2018-04-26T15:50:25.917Z,6,LINKS MANAGER
27100,Do not Restore Session with Last window Closed,rojaviv,2018-05-01T15:22:06.562Z,4,SESSION RESTORE
26317,Option to Block Extension Updates,terere,2018-03-30T09:59:48.587Z,12,EXTENSIONS:BLOCK
25193,Nicknames match on Sessions,CheVe11e_191,2018-02-18T10:39:44.419Z,6,SESSIONS:QUICK COMMANDS:NICKNAMES
27023,Save High Score from Network Error Game,LonM,2018-04-28T07:26:23.600Z,8,EASTER EGG
27253,Scan in VirusTotal for Hyperlinks  Downloads and Address bar,jhae,2018-05-07T17:55:15.106Z,0,SECURITY
27294,Full Page Zoom Combined with Text Zoom,dude99,2018-05-09T13:26:59.030Z,3,ZOOM:WEBPAGES:TEXT
27284,Non-linear tab history,ROTFL,2018-05-09T07:41:07.280Z,2,GUI:HISTORY
27203,Offline Mode,ozoratsubasa,2018-05-05T10:27:22.349Z,10,OFFLINE
27261,Context Menu Options for Background Images,LonM,2018-05-08T08:41:24.950Z,7,CONTEXT MENU:IMAGE:BACKGROUND
27260,Support for Touch Screen Scrolling in Vivaldi via RDP,pleiades,2018-05-08T06:04:29.815Z,1,TOUCH SCREEN
27005,Save Vivaldi Configuration  Notes  etc.  in the Cloud,jacquesh,2018-04-27T20:05:45.311Z,0,SYNC:IN PROGRESS
27201,Option to choose PNG for "Copy to Note" and screen-capturing for notes,CheVe11e_191,2018-05-05T05:04:00.416Z,3,NOTES:SCREENSHOT:SCREEN CAPTURE
27171,Reorder toolbar in History page to make it more user-friendly,ROTFL,2018-05-04T06:29:49.794Z,3,GUI:HISTORY
27104,Show Last Active Tab when we Pin a Tab,rojaviv,2018-05-01T18:03:33.597Z,0,PINNED TABS
27093,Accessibility Font Options: Built-in Live CSS Editing,Leeteq,2018-05-01T11:22:04.455Z,2,FONT SIZE:USER-CSS
24448,Missing Indicator of Completed Downloads,CheVe11e_191,2018-02-01T20:11:55.332Z,18,DOWNLOADS
26630,Independent Snapshot Version Profile on MacOS,GBB,2018-04-12T01:11:57.175Z,1,MACOS:PROFILES
24611,Save and Apply Changes to Source Code,Pesala,2018-02-03T06:15:56.743Z,11,SOURCE
27058,Skip Hibernated Tabs when Cycling until Click Activation,LonM,2018-04-29T17:28:08.126Z,6,HIBERNATION:TAB CYCLING
27021,Preload Startpage Background Image,neltherion,2018-04-28T06:38:05.319Z,5,START PAGE:BACKGROUND
26717,Close Current Tab and Focus Left/Right Tab by Gestures,isynceo,2018-04-16T04:49:24.115Z,4,MOUSE GESTURES:CLOSE TABS
26995,Add an Assignable Key Binding for Scrolling Line-by-line,brianok,2018-04-27T11:54:24.974Z,4,SHORTCUTS:NAVIGATION
26971,Reader View to Notes integration (clipping),raz,2018-04-26T15:41:43.471Z,1,NOTES:READER VIEW
26968,Keep UI Elements Enabled on Exit Fullscreen,speedy_von_gofast,2018-04-26T14:54:11.814Z,0,PANELS:TOOLBAR:FULLSCREEN
26850,Separate Session Context per Private Window,becm,2018-04-21T21:20:14.398Z,6,PRIVACY:SESSIONS:PRIVATE WINDOW
26904,Show Description in Bookmark Tooltip,glenlee,2018-04-24T22:45:16.432Z,1,BOOKMARKS BAR:TOOLTIPS
26908,Export Search Engines,zdm,2018-04-25T06:46:03.472Z,6,SEARCH ENGINES:EXPORT
26883,Download/Open File with other Application if > x Mbytes,AfsarPasha,2018-04-23T15:07:53.319Z,0,DOWNLOADS:DOWNLOADMANAGER
26873,More visibility into processes in Chrome Task Manager,NemoAnonymous,2018-04-22T23:37:38.312Z,1,TASK MANAGER
26763,Security Features / DNS Encryption / Keystroke Encryption,UpGrade,2018-04-18T09:38:07.533Z,0,SECURITY
26812,A few missing Privacy / Security Options,UpGrade,2018-04-20T14:25:03.823Z,0,PRIVACY:SECURITY
26810,Setting for Always Use Incognito,UpGrade,2018-04-20T14:06:41.429Z,1,PRIVACY
26801,Session Searchbar,ozoratsubasa,2018-04-20T03:21:32.302Z,6,SESSIONS
26785,Reduce the Context Menu Spacing,ozoratsubasa,2018-04-19T07:18:48.573Z,1,CUSTOMIZE:CONTEXT MENU
26718,Set Path to Custom Thumbnails,mib2berlin,2018-04-16T05:08:54.890Z,3,SPEED DIAL:THUMBNAILS
26761,Policy to Disable User Deletion of Browser History,observe,2018-04-18T09:26:21.801Z,0,SECURITY:PRIVACYPOLICY
25332,Title of Notes Should Use First Line Only,rojaviv,2018-02-22T02:38:54.048Z,18,NOTES
26694,Shorten Right Click Menu,sonofcy,2018-04-15T01:47:51.839Z,2,CONTEXT MENU
26691,Option to customize history filter for Quick Commands,nealot,2018-04-15T00:49:19.827Z,0,QUICK COMMANDS:FILTERS
26673,Import Firefox Keywords as Nicknames,Pesala,2018-04-13T20:06:43.716Z,3,IMPORT:FIREFOX:NICKNAMES
26611,Open New Windows on Focused Monitor,Memphiz,2018-04-11T10:42:43.064Z,1,NEW WINDOW:MULTI-MONITOR
26608,Change Initial Focus for Clear Private Data Dialogue,Pesala,2018-04-11T04:54:26.315Z,4,GUI
26599,Set Font-weight in Reader View,7922,2018-04-10T17:57:19.236Z,1,READER VIEW
26300,Lift Bookmarks Bar Character Limit,IdanAdar,2018-03-29T12:34:42.903Z,1,BOOKMARKS BAR
26436,Website Notifications Need to be More User-friendly,dude99,2018-04-03T18:11:50.560Z,2,NOTIFICATIONS:WEBSITE
26450,Tab Cycling Delay,terere,2018-04-04T11:07:18.533Z,3,THUMBNAILS:TAB CYCLING
26441,Move Content in Reader View,Corch,2018-04-04T05:48:13.089Z,0,READER VIEW
26435,Copy Line in View Page Source,Sheepwall,2018-04-03T15:41:44.958Z,1,EDIT:VIEW SOURCE
26418,Extension Popup Menu,mettarefuge,2018-04-03T07:02:43.878Z,10,EXTENSIONS
24665,Resource Sniffer,WislaHD,2018-02-04T04:56:56.172Z,15,RESOURCE
26354,Hide UI Should Hide Window Title Bar,arnaudm,2018-03-31T11:02:48.260Z,0,GUI:WINDOW:TITLE BAR
26227,Use Trash Icon to Show the Clear Private Data Dialog,CantankRus,2018-03-27T08:03:35.448Z,2,PRIVACY:TOOLBAR:BUTTONS
26109,Display Actual Bytes Transferred In Progress Bar,opticyclic,2018-03-22T21:38:35.503Z,9,ADDRESS BAR
24210,Upgrade Vivaldi on Next Restart,luetage,2018-01-31T10:32:26.406Z,70,VIVALDI:PIPELINE:UPDATE:RESTART
26281,Ability to Position a Bookmarks Bar Folder to the Far-right,IdanAdar,2018-03-28T16:14:22.919Z,1,GUI:BOOKMARKS BAR
26285,Restore Previous Session Shortcut,ronyxs,2018-03-28T21:55:48.431Z,0,SHORTCUTS:SESSIONS:SESSION RESTORE
26233,Delay Option on Popup Tab Thumbnails,Hadden89,2018-03-27T12:44:58.275Z,3,THUMBNAILS:POPUP
26211,Disable Confirm Form Resubmission,arbpen,2018-03-26T19:36:23.449Z,0,FORM
26188,Option to lower priority/resources for newly open (unread) background tab,dude99,2018-03-26T05:10:09.172Z,3,BACKGROUND TAB
26160,Notes Manager,CheVe11e_191,2018-03-24T20:26:31.817Z,6,NOTES:EDIT:TOOLS
26115,Integration of Artificial Intelligence,Yogeyaa,2018-03-23T07:33:50.965Z,0,PRIVACY:ANDROID
24444,Add Submenu to Tiling Context Menu,CheVe11e_191,2018-02-01T19:50:20.240Z,6,GUI:TILING:MENUS
25696,Shortcuts for Next / Previous Tab in Stack,Zunhs,2018-03-06T12:01:23.525Z,4,SHORTCUTS:TAB STACKS
26019,Display notes in browsing history,algy,2018-03-20T08:51:52.921Z,1,NOTES:HISTORY
24480,Option to disable launch after installation,ROTFL,2018-02-01T23:04:03.374Z,9,INSTALLER
25949,Placeholders as Commands on Custom Search Engines,aderitobonito,2018-03-16T16:22:22.555Z,7,SEARCH ENGINES
25960,Keyboard shortcut to "Help -> About",ozoratsubasa,2018-03-17T03:18:31.116Z,2,SHORTCUTS
25990,Add easy import of SSL certificates to Vivaldi,Gwen-Dragon,2018-03-19T07:31:26.623Z,5,SSL:CERTIFICATES
24415,Translate Submenu,Pesala,2018-02-01T12:31:59.788Z,7,MENUS:TRANSLATION
25919,Rotate Images and Videos,rabe85,2018-03-15T16:04:15.453Z,3,VIDEO:IMAGE
24361,New "History" mode: "View by Site",Asires,2018-02-01T02:00:08.970Z,21,HISTORY
24214,Highlight Search Results in the Selected Note,RammsteinAM,2018-01-31T10:37:47.183Z,13,SEARCH:NOTES:HIGHLIGHTING
25901,Colors for Progress Bar and Download Button,dude99,2018-03-15T05:36:38.590Z,7,GUI:DOWNLOADS:CUSTOMIZE:ACCESSIBILITY
25879,Show Download Speed / Progression in the Status Bar.,drivas,2018-03-14T13:19:36.556Z,11,DOWNLOADS:STATUS BAR
24758,Settings for websites like in old Chrome,kurevska_registracia,2018-02-06T12:17:33.626Z,9,SITE SETTINGS
24186,File Sharing like Opera Unite,Pesala,2018-01-31T09:48:08.631Z,21,SHARING:PEER-TO-PEER
25833,Ability to Move To...in Bookmarks Manager,rojaviv,2018-03-12T20:42:36.782Z,0,CONTEXT MENU:BOOKMARK FOLDER
24307,Automatic form filler with pre-set information,david.cortes,2018-01-31T19:06:58.697Z,10,FORM FILLING:FORM
24546,Resizable screen capture,bimlas,2018-02-02T11:55:34.372Z,14,SCREENSHOT
24150,Fit Page Width,LonM,2018-01-31T09:34:17.461Z,14,FIT TO WIDTH
25623,Send URL by Email,fofo,2018-03-03T21:30:50.977Z,10,URL:EMAIL
24734,Stop Video/Audio = stop buffering,dude99,2018-02-05T17:48:29.643Z,15,VIDEO:AUDIO:MEDIA:BUFFERING
25393,Do not Rename Video Downloads,if.sergiy,2018-02-23T13:21:41.248Z,1,DOWNLOADS:YOUTUBE
25765,Require Opt-In for Service-Worker Registrations,stephenm,2018-03-09T14:38:49.679Z,7,PRIVACY
25729,Setting to Ignore Invalid/Missing SSL Certificates,rojaviv,2018-03-07T21:13:55.537Z,6,CERTIFICATES
24200,Optional Program Sounds,Pesala,2018-01-31T09:59:11.424Z,6,SETTINGS:SOUND
24137,Open With Context Menu,Pesala,2018-01-31T09:28:31.255Z,35,GUI:MENUS:LAUNCH
24378,Option for "Full page" or "Normal Height" Thumbnails for Notes,neltherion,2018-02-01T07:55:30.423Z,1,THUMBNAILS:NOTES
25668,Option to Hide Scrollbars like in Presto,burbuja,2018-03-05T19:42:04.343Z,3,SCROLLBAR:HIDDEN
25741,Quick Commands Javascript Integration,nealot,2018-03-08T07:57:54.160Z,4,JAVASCRIPT:QUICK COMMANDS
25733,Option to Disable Responsiveness (not in Developer Tools),rojaviv,2018-03-07T22:14:42.798Z,0,RESPONSIVENESS
31752,Setting to Ignore Invalid/Missing SSL Certificates,rojaviv,2018-10-28T22:07:57.509Z,0,SETTINGS:SECURITY:PASSWORDS
25725,Option to show Edit Title on Context Menu Bookmark Link,LonM,2018-03-07T18:34:24.381Z,1,CONTEXT MENU:LINKS:EDIT
25713,Save URL and Context as a Win10 Start Menu Tile,Comfunc,2018-03-07T10:32:09.237Z,5,WINDOWS:WINDOWS 10:APPMODE
25438,Close Window on Double-click,Rimpel,2018-02-25T10:06:22.485Z,1,DOUBLE-CLICK:CLOSE WINDOW
25613,Option for a Border Around Windows,rojaviv,2018-03-03T15:03:06.567Z,7,GUI:CUSTOMIZE:WINDOW:BORDER
25666,Stop the User-Agent string madness :P,ROTFL,2018-03-05T18:51:34.563Z,3,USER AGENT
24830,RealPlayer Should Be Recognized In Vivaldi Windows Browser,mikeolprimesourcandy,2018-02-08T01:03:28.231Z,0,PLUGIN
24181,Download Hash/Checksum Verification,LonM,2018-01-31T09:44:46.573Z,24,DOWNLOADS:CHECKSUM
25631,Chromeless Window Mode for Videos,user35,2018-03-04T08:01:33.720Z,1,GUI:VIDEO:WINDOW
25626,Using DDE to Capture Source URL,LakeInHolland,2018-03-03T22:12:05.387Z,1,URL:SOURCE:COPY ADDRESS
25611,Allow to Exit Capture Area Using the Mouse,andrewz1986,2018-03-03T14:31:00.754Z,3,SCREEN CAPTURE
24187,Optimize Address Bar Suggestions: List Regularly Visited Websites Higher,PlusMinus0,2018-01-31T09:48:34.728Z,10,ADDRESS BAR:SUGGESTIONS
24134,Ctrl+Click on Images to Save Them,Pesala,2018-01-31T09:25:45.619Z,22,SHORTCUTS:IMAGE
25563,Delayed Drawing,Tuexss,2018-03-01T13:46:21.154Z,2,LOADING:RENDERING
25586,Allow word wrap also on source tab (dev tools),Hadden89,2018-03-02T12:09:05.168Z,0,DEVELOPER TOOLS
25572,Vertical Toolbar for Extension Buttons,arbeleg,2018-03-02T02:02:54.118Z,1,PANELS:EXTENSIONS:CUSTOMIZE:TOOLBAR
25557,Page Font Size Resizing,rojaviv,2018-03-01T11:36:22.745Z,0,SITE SETTINGS:FONT SIZE
24488,Embedded QR Code generator,ROTFL,2018-02-01T23:41:53.554Z,12,QR CODES
24931,Force hotkey assignment for keys already in use.,AnrDaemon,2018-02-10T20:51:39.848Z,1,SHORTCUTS:OVERWRITE
25510,Show Vivaldi's menu in application menu bar in Plasma 5,A Former User,2018-02-28T09:40:59.325Z,5,MENUS:KDE:KUBUNTU
25522,Increase onbeforeunload alerts support,LonM,2018-02-28T14:36:46.386Z,1,NOTIFICATIONS:ONBEFOREUNLOAD
24825,Mnemonic Shortcuts,Pesala,2018-02-07T22:47:05.644Z,13,SHORTCUTS
25497,Allow Keyboard Modifiers for Mouse Gestures,Pesala,2018-02-27T20:20:10.756Z,5,SHORTCUTS:MOUSE GESTURES
25486,Redirect "get help" in settings to our guide,Hadden89,2018-02-27T15:43:54.271Z,3,HELP
25394,Option to Disable Hiding of Window Controls,Morg42,2018-02-23T14:18:38.349Z,4,JAVASCRIPT:WINDOW:TOOLBAR
24441,Open-source Vivaldi,Christian.Rauch,2018-02-01T18:36:15.463Z,10,VIVALDI:OPENSOURCE
25452,Save Metadata in Screenshot Files,becm,2018-02-26T15:14:26.234Z,8,SCREENSHOT
25450,Better URL Detection,somebody,2018-02-26T12:16:04.631Z,1,SEARCH:URL
25448,"One-way" Sync,ROTFL,2018-02-26T07:55:54.753Z,19,SYNC
25398,Option to Open a Page Automatically in Incognito Mode,ric54321,2018-02-23T17:03:48.946Z,5,PRIVACY
25391,Mark as "unsupported" flags Vivaldi can't use,Hadden89,2018-02-23T13:10:57.368Z,2,SETTINGS
25387,Allow a Vivaldi tab to "frame" the MobaXterm client,mrfjong,2018-02-23T12:05:27.756Z,0,COMMANDLINE
25367,Set Browser as Topmost Window,perskute,2018-02-22T22:40:03.576Z,0,WINDOW:ALWAYS ON TOP
24650,Make Pinned Tabs Identifiable when using Vertical Tab Bar,qwc,2018-02-03T20:52:10.923Z,10,GUI:PINNED TABS
25372,Windows 10 Notifications (Action Center),Formedras,2018-02-23T03:58:57.633Z,0,NOTIFICATIONS:WINDOWS
25378,Stop Shortcuts From Using/Overwriting "Sessions",KA24DERACER,2018-02-23T07:29:08.514Z,0,SHORTCUTS:SESSIONS
25348,Notification Position Option,SirWill,2018-02-22T12:23:20.170Z,2,NOTIFICATIONS:POSITION
25360,Open Vivaldi URLs in the same tab,AltCode,2018-02-22T19:43:07.812Z,1,
25353,Option for Developer Tools not to Refresh from the Server,rojaviv,2018-02-22T14:16:20.334Z,4,DEVELOPER TOOLS
25356,Add a "Show Password" button/option on masked input fields,aderitobonito,2018-02-22T16:35:44.008Z,6,PASSWORDS
25275,Edit Search Engines from Search Field Context Menu,rojaviv,2018-02-20T14:23:10.230Z,0,SEARCH ENGINES:CONTEXT MENU:SEARCH BAR:EDIT
25347,Audio Output Device Option,SirWill,2018-02-22T12:20:16.275Z,3,AUDIO
25346,Torrents Download Support,Maxrunner,2018-02-22T11:41:09.770Z,6,DOWNLOADS:TORRENTS
25299,Don't Close Extension Page when Updating,LonM,2018-02-21T09:59:35.938Z,1,EXTENSIONS:CLOSED TABS
25137,Saving Web Pages with Links,xcln,2018-02-16T14:10:24.627Z,4,LINKS:SAVING FILES
25282,Open Link in Split Screen,awlincoln,2018-02-20T18:21:17.529Z,10,SHORTCUTS:TILING:LINKS
25268,Headphones Volume Control,emiliano.paladini,2018-02-20T10:17:45.012Z,0,VOLUME
25219,Starting background,csablak,2018-02-19T07:55:34.582Z,9,BACKGROUND
24664,Save and Quit Warning When Closing Vivaldi,matiasmovie,2018-02-04T01:48:01.665Z,11,CLOSE TABS:WARNING
24600,Command for Copy Page Address,Urza,2018-02-03T01:52:32.783Z,4,SHORTCUTS:MOUSE GESTURES:COPY ADDRESS
24922,Turbo / Data Saver / Data Compressor,nearbaskara,2018-02-10T18:10:06.132Z,8,COMPRESSION:TURBO
25239,Enable right-click -> Clear Search History,RBV,2018-02-19T17:17:23.589Z,0,SEARCH:CONTEXT MENU:HISTORY
25110,More Site Settings for Specific Websites,mentat,2018-02-15T15:11:05.735Z,2,SITE SETTINGS:WEBSITE
25216,Cache Filter,Pesala,2018-02-19T07:05:35.743Z,9,CACHE:VIEWER
24443,Add "Vivaldi" to the Window Title,LightGolgot,2018-02-01T19:38:48.363Z,9,VIVALDI:TITLE BAR
24807,Pan Large Images with Left Mouse Button,Pesala,2018-02-07T10:54:36.455Z,17,SCROLLING:IMAGE
25195,Delete button for the list on trash,CheVe11e_191,2018-02-18T10:55:33.213Z,3,BUTTON:TRASHCAN:DELETE:LIST
25191,Show full name when hovering on item,CheVe11e_191,2018-02-18T09:59:50.219Z,5,BOOKMARKS PANEL:HOVER:TOOLTIPS
25187,Word Counter for Notes,CheVe11e_191,2018-02-18T09:39:18.264Z,8,NOTES:WORD COUNT
25171,Lock Interface Layout to Prevent Accidental Resizing etc,Sentynel,2018-02-17T18:11:07.158Z,7,GUI:LOCK:INTERFACE
24410,Save and Restore Size and Position of Every Window in Saved Sessions,viava,2018-02-01T12:22:25.674Z,4,SESSIONS:WINDOWS
24883,Middle-click the Trashcan List to Reopen Closed Tabs in a Background Tab,benjo,2018-02-09T13:40:48.385Z,2,MIDDLE-CLICK:TRASHCAN:BACKGROUND TAB
25087,Save All Images,emiliano.paladini,2018-02-15T11:06:35.594Z,1,IMAGE
25050,Integrated Parental Control,emiliano.paladini,2018-02-14T09:07:01.869Z,0,CONTENTBLOCKING
25085,Import / Export Keyboard Shortcuts and Mouse Gestures,Pesala,2018-02-15T11:00:57.083Z,8,SHORTCUTS:MOUSE GESTURES:IMPORT:EXPORT
25079,Select Background Image for Start Page from Context Menu,Pesala,2018-02-15T09:00:24.544Z,5,START PAGE:BACKGROUND
24991,Double-click on Editable Text to Show Spelling Suggestions.,AfsarPasha,2018-02-12T16:33:13.443Z,3,SPELLCHECK:DOUBLE-CLICK:TEXT FIELD
25043,Hibernation by default,ryofurue,2018-02-14T06:33:32.950Z,6,HIBERNATION
25021,Legacy Chromium Option (Stable / Snapshot),Hadden89,2018-02-13T13:33:42.775Z,2,CHROMIUM:INSTALLER
24958,Drag & Drop Extensions into Trashcan,AfsarPasha,2018-02-11T16:12:36.626Z,0,EXTENSIONS:DRAGANDDROP:TRASHCAN:WILL NOT DO
25033,Integrated URL Shortener,derDay,2018-02-13T18:08:34.020Z,0,URL:COMPRESSION
25015,Highlighter with Tooltips on Scrollbar for Find in Page,dude99,2018-02-13T10:33:12.844Z,2,FIND IN PAGE:SCROLLBAR:TOOLTIPS
25013,Option to Clear Cookies after a Set Period,algy,2018-02-13T10:02:52.711Z,2,COOKIES:CLEAR:SCHEDULED
25004,Find in Page with smooth scrolling to next result,dude99,2018-02-13T04:51:08.445Z,4,FIND IN PAGE:SMOOTHSCROLLING
24999,Automatically Open Certain Domains in Reader View,charlesoblack,2018-02-12T22:26:07.530Z,1,READER VIEW:SITE SETTINGS
25000,Minimum Font Size must be Applied after Page Zoom  not Before.,AnrDaemon,2018-02-12T22:45:46.526Z,0,ZOOM:FONT SIZE
24956,One Click to Start Capture Page,AfsarPasha,2018-02-11T15:11:10.420Z,3,SCREENSHOT:CAPTURE SETTING
24955,Capture Page Elements,AfsarPasha,2018-02-11T14:56:28.514Z,11,SCREENSHOT
24944,Custom Commands and extensions on Status Bar,AfsarPasha,2018-02-11T07:35:18.200Z,0,CUSTOMIZE:JAVASCRIPT:STATUS BAR
24949,Middle-click on Tab Bar to Open Tab with URL or Search Text,Pesala,2018-02-11T12:02:22.655Z,5,SEARCH:NEW TAB:MIDDLE-CLICK:CLIPBOARD
24924,Ability to open and "close/hide" the drop down in menu bar and bookmark folder,nearbaskara,2018-02-10T18:23:03.891Z,1,MENUS:BOOKMARK FOLDER
24929,Meaningful Vertical Reader mode even for latin-alphabet based languages,nfsmaniac,2018-02-10T20:17:41.712Z,1,READER VIEW:VERTICAL:LATIN
24223,Button to Show/Hide Bookmarks Bar,mikelopiccolo,2018-01-31T10:45:41.774Z,2,GUI:BOOKMARKS BAR:BUTTON
24908,Drag & Drop should not Interrupt Mouseover for Browser GUI,dude99,2018-02-10T07:51:32.371Z,1,BUG:DRAGANDDROP
24300,Opera 9.2 Compatible Keyboard Shortcut,david.cortes,2018-01-31T18:47:45.714Z,1,SHORTCUTS:OPERA
24502,Newsfeed for Top News,ngelmat,2018-02-02T03:07:29.528Z,0,NEWSFEED
24902,Diagonal Mouse Gestures,Pesala,2018-02-09T23:15:04.336Z,3,MOUSE GESTURES
24464,Option to Move Trashcan to the Extension Toolbar,Stardust,2018-02-01T21:13:18.384Z,3,CUSTOMIZE:EXTENSION:TOOLBAR:TRASHCAN
24533,Text Only View,dominicw2,2018-02-02T11:02:11.955Z,1,READER VIEW
24613,More Options for Adjusting the Start Page Background,JuniorSilva30,2018-02-03T06:18:40.653Z,2,START PAGE:BACKGROUND
24174,Option to detect mobile touch icons instead of thumbnails,LonM,2018-01-31T09:42:03.293Z,14,SPEED DIAL:ICONS
24876,Change Order of Link Context Menu,michel.schuetz,2018-02-09T10:48:40.691Z,0,CUSTOMIZE:MENUS
24851,Redirect to custom search's homepage when searching with nickname+empty field,thefoxbard,2018-02-08T15:46:27.173Z,1,SEARCH ENGINES:REDIRECTION
24759,Remove "Validate" from context menu,kurevska_registracia,2018-02-06T12:46:01.439Z,3,CUSTOMIZE:MENUS
24823,Combine Synced Tabs and Trashcan,luetage,2018-02-07T20:16:58.067Z,4,SYNC:GUI:TRASHCAN
24802,Assign Shortcuts to Individual Notes,holotaco,2018-02-07T08:55:12.015Z,1,SHORTCUTS:NOTES
24315,Option to generally copy to clipboard without format,ghpy,2018-01-31T19:45:54.739Z,14,COPY:TEXT
24286,Ability to combine domain and keyword filter in vivaldi://history,Guilimote,2018-01-31T16:23:43.893Z,6,HISTORY
1150,Proxy and Kerberos,saigkill,2015-02-01T08:55:01.000Z,2,PROXY
24450,Don't Hibernate Pinned Tabs,CheVe11e_191,2018-02-01T20:18:12.910Z,8,PINNED TABS:HIBERNATION
24775,On Private: Open link in normal window,yes.aravind,2018-02-06T15:50:59.067Z,1,LINKS:PRIVATE WINDOW
24700,Keyboard equivalent for mouse gestures,Fendar,2018-02-05T08:43:57.597Z,2,SHORTCUTS:MOUSE GESTURES:KEYBOARD
24324,Move site settings to right click menu,david.cortes,2018-01-31T20:07:43.795Z,3,GUI:MENUS:SITE SETTINGS
24172,Searching should alert when the first match (where the search began) reached again,bimlas,2018-01-31T09:40:47.048Z,25,FIND IN PAGE
24742,Threaded Browser GUI  Keyboard & Mouse Input Events,dude99,2018-02-05T22:06:32.122Z,4,MULTITHREADING
24382,Drag and Drop Tiled Tabs,Pesala,2018-02-01T08:23:44.681Z,17,TILING:DRAGANDDROP
24322,Option to switch off certain javascript options,ghpy,2018-01-31T20:00:58.418Z,13,JAVASCRIPT:SITE SETTINGS
24179,Bubble context controls,LonM,2018-01-31T09:44:30.131Z,4,VIDEO:MEDIA:PLAYER:CONTROLS
24729,Choose and order top items in context menus  tab menu especially,TyrianMollusk,2018-02-05T15:37:22.692Z,0,GUI:CUSTOMIZE:MENUS
24626,Typo Suggestions Should always be Available from the Context Menu,Dantesoft,2018-02-03T12:39:47.706Z,9,MENU:SPELLCHECK
24585,Advanced "Find in page",ROTFL,2018-02-02T18:48:14.996Z,17,FIND IN PAGE
24216,Lightspeed Navigation Mode,mikelopiccolo,2018-01-31T10:40:42.765Z,6,NAVIGATION
24515,A button for installing extension from disk,MVV_,2018-02-02T06:13:27.177Z,2,EXTENSIONS:INSTALLER
24692,Scroll Bar on the Left for Left-handed Users,kenny_n,2018-02-05T03:26:45.602Z,6,GUI:SCROLLBAR:LEFT-HANDED
24683,Vivaldi application icon color choice,luetage,2018-02-04T20:19:47.904Z,5,VIVALDI:ICONS
24652,Cloud Synchronization of Multiple Vivaldi Instances,qwc,2018-02-03T21:15:51.199Z,13,SYNC
24651,Organising Downloads: Quickly Choose Folders for Saving,qwc,2018-02-03T21:04:43.830Z,0,DOWNLOADS:SAVING FILES
24677,Clear Current Typed Search Term,vongalin,2018-02-04T15:24:36.524Z,2,PRIVACY:CLEAR
24644,Bookmark Manager like Opera 12 or Classic Chrome,bionioncle,2018-02-03T18:19:33.099Z,1,MANAGEBOOKMARKS
24639,Option to Show Site Info Text on Hovering over the Padlock,Hadden89,2018-02-03T14:43:48.547Z,3,GUI:SITE SETTINGS
24628,Middle-click on Bookmark Bar Subfolders to Open All,eXzentrik,2018-02-03T13:13:10.015Z,5,BOOKMARKS BAR:MIDDLE-CLICK
24625,Pin widgets to taskbar,awking,2018-02-03T12:17:19.295Z,1,TASKBAR:PIN
24607,Copy Page Address on Tab Context Menu,Pesala,2018-02-03T05:03:37.240Z,8,MENUS:COPY ADDRESS
24507,Themes from Chrome  Firefox  or Other Sources,wantluckman,2018-02-02T03:52:06.334Z,2,WILL NOT DO
24528,Better Windows 10 tile,dominicw2,2018-02-02T10:52:54.231Z,19,ICONS:WINDOWS 10
24588,Webpage "harvester" for saving a batch of websites,ROTFL,2018-02-02T19:17:05.899Z,2,DOWNLOADS:BATCH DOWNLOAD
24131,Show Icons in Search with.. Menu,Pesala,2018-01-31T09:22:57.513Z,51,GUI:ICONS:MENUS
24582,Save Webpage as PDF,Artex,2018-02-02T17:43:37.835Z,17,PDF:PAGE
