ID,Title,Author,Date,Votes,Tags
33078,BIXBY Integration + Vivaldi Quick Commands,cellyforever,2018-12-15T03:51:37.576Z,0,QUICK COMMANDS:VOICE
26034,Find in Page Search Engine,Martin.Storch,2018-03-20T16:18:06.245Z,6,SEARCH ENGINES:FIND IN PAGE
33063,Access Key Indicator,pauloaguia,2018-12-14T18:24:17.394Z,9,IN PROGRESS:ACCESSIBILITY:A11Y
26561,Ctrl+Shift+Enter for *.org Autocomplete in URL,LuisAnton,2018-04-09T11:17:04.229Z,4,SHORTCUTS:AUTOCOMPLETE
25878,Don't Resize Tabs Immediately After Tab Closure,drivas,2018-03-14T13:14:33.805Z,8,CLOSE TABS
33019,Suggest Recent Searches in the Quick Commands Dialog,LiorL,2018-12-13T23:07:26.857Z,0,QUICK COMMANDS:NICKNAMES
24288,Delete Saved Sessions Confirmation,free4eversa,2018-01-31T16:38:39.176Z,13,SESSIONS:DELETE
24379,Shortcut to Paste and Go in a New Tab,neltherion,2018-02-01T07:57:12.536Z,19,SHORTCUTS:NEW TAB:PASTE AND GO
24866,Allow Editing of Passwords and Details in Privacy Settings,aderitobonito,2018-02-09T05:48:44.937Z,15,PRIVACY:PASSWORDS
28691,Subpixel Font Rendering Like Opera 12.17,newillusion,2018-07-15T06:58:24.611Z,4,FONTS:RENDERING
25249,Show Selected Search Engine Icon in the Search Field,brook,2018-02-19T22:29:55.294Z,40,SEARCH ENGINES:ICONS
32887,Open Links/Tabs in Background with Quick Commands,Andre972,2018-12-10T15:22:24.664Z,2,QUICK COMMANDS:BACKGROUND TAB
24549,Different cookies/accounts for same site (Multi-Account Containers),kurevska_registracia,2018-02-02T12:03:20.944Z,36,COOKIES:SITE SETTINGS
25336,Allow AsciiDoc Syntax in Notes,bimlas,2018-02-22T07:04:45.357Z,2,NOTES
32811,Accessibility: Add big overlay scroll Up/Down button on scroll-able list,dude99,2018-12-07T07:56:17.887Z,0,ACCESSIBILITY:A11Y
31657,Save Page Actions for Specific Page  Domain  or Tab,Gelmo,2018-10-26T01:56:27.551Z,6,PAGE ACTIONS
32588,Capture Screenshot of Visible Area of Page,matiasmovie,2018-11-28T15:13:19.145Z,1,IMAGE:SCREENSHOT:CAPTURE
32756,Google Assistant + Vivaldi Quick Commands,cellyforever,2018-12-05T20:45:57.461Z,1,QUICK COMMANDS:GOOGLE:VOICE
32343,Open Saved Session when Vivaldi Starts,matiasmovie,2018-11-19T08:52:08.796Z,0,STARTUP:SESSION
24305,Option to Show Startup Dialog,david.cortes,2018-01-31T18:56:13.308Z,17,VIVALDI:STARTUP
25467,Warn When Closing Multiple Tabs,NovaViper,2018-02-27T09:16:30.051Z,10,CLOSE TABS:WARNING
31299,Reader mode does not display videos and photos from articles,antoine.luboz,2018-10-16T11:09:32.645Z,1,READER VIEW:VIDEOS:PHOTOS
25742,Option to restore closed tabs in private windows,ROTFL,2018-03-08T07:59:30.298Z,11,PRIVATE WINDOW:CLOSED TABS
31738,macOS Full Screen resize problem,AhmadMS1988,2018-10-28T06:51:45.280Z,1,MACOS:FULLSCREEN
32691,Use google account to login to vivaldi,shalom938,2018-12-03T18:36:20.262Z,0,SYNC:GOOGLE:WILL NOT DO
24111,Drop-Down Menu in Speed-Dial,RayAlpha,2018-01-31T08:29:54.576Z,6,SPEED DIAL:MENU:NAVIGATION BAR
32662,Tab title as process name,TheJJJ,2018-12-02T11:52:03.659Z,0,TAB:PROCESS:TASK:THREAD:NAME
24149,Auto-Reload Options,LonM,2018-01-31T09:33:49.949Z,61,PIPELINE:REFRESH PAGE
24257,Make Sessions Editable,NemoAnonymous,2018-01-31T12:39:43.220Z,35,SESSIONS
31116,Menu Button Should Allow Dragging of the Window,lionb,2018-10-11T14:04:49.980Z,1,WINDOW:BUTTON
32459,Adjustable Width & Height for Quick Command Dialog,dude99,2018-11-23T05:18:17.871Z,8,QUICK COMMANDS:SIZE
24475,[Ctrl + Mouse Wheel] Zoom improvements,Stardust,2018-02-01T22:34:47.956Z,4,ZOOM
32418,Quick Commands while DevTools is enabled,metafaniel,2018-11-21T16:51:23.962Z,1,
24294,Option to use External Editor as Source Viewer,TRMarcus,2018-01-31T17:47:45.790Z,17,SOURCE:EXTERNAL VIEWER
32404,History List in Previous and Next Page,indieloser,2018-11-21T07:50:49.671Z,0,TAB:MIDDLE-CLICK:HISTORY LIST:PAGE
32387,Protect Tab Stack or Vivaldi with a Password,fuorviatos,2018-11-20T17:23:14.599Z,1,TAB STACKS:PRIVACY:PASSWORD
32370,Paste and Go Anywhere,ryofurue,2018-11-20T05:03:42.216Z,1,CONTEXT MENU:PASTE AND GO
24310,Option to Temporarily Disable Javascript,david.cortes,2018-01-31T19:27:27.859Z,13,JAVASCRIPT:SITE SETTINGS
24165,Automatically Attempt to Make HTTPS Connections,LonM,2018-01-31T09:39:33.130Z,39,HTTPS REDIRECT
26031,Sync with Cloud Sync Software?,rojaviv,2018-03-20T14:07:27.347Z,3,SYNC
28265,Keyboard+Mouse Shortcuts,Omen_20,2018-06-28T20:53:10.209Z,7,SHORTCUTS:KEYBOARD:MOUSE:MOUSE-WHEEL
32044,Option to show tooltip when holding Modifier key,dude99,2018-11-08T05:53:38.986Z,0,SHORTCUTS:TOOLTIPS:HELP
30954,A Zoom Tool Could Replace the Zoom Slider,Pesala,2018-10-06T16:53:48.547Z,1,ZOOM:BUTTONS
24494,Group / sort synced history by device,ROTFL,2018-02-02T00:09:20.720Z,4,SYNC:HISTORY
31932,Vertical Zoom Slider,Pesala,2018-11-03T17:57:01.984Z,2,ZOOM:STATUS BAR:WEBPAGES
31698,Better Upload Monitor,kleslie,2018-10-27T02:28:21.480Z,4,STATUS BAR:UPLOADS
31799,When opening History  have cursor default to search box,julien419,2018-10-29T23:42:09.649Z,6,SEARCH:HISTORY:FOCUS
31820,Subtitles in Picture in Picture,pauloaguia,2018-10-30T14:13:04.223Z,8,VIDEO:MEDIA:PLAYBACK
31794,Reload button with Forced reload option,Nekomajin,2018-10-29T18:46:31.457Z,0,TOOLBAR:RELOAD
31807,"Collaboration support" in Vivaldi backend / sync,ROTFL,2018-10-30T08:43:00.667Z,0,BOOKMARKS:SYNC:CALENDAR:SHARING:COLLABORATION
31791,Warn me about deleting mods before updating,potmeklecbohdan,2018-10-29T17:20:21.018Z,3,MODDING:UPDATE:WARNING
31789,Extension Tray : Improved by Imitation,yonoume,2018-10-29T16:52:26.648Z,0,EXTENSIONS
27067,Fullscreen Command for Linux,hehe,2018-04-30T12:41:50.635Z,0,LINUX:FULLSCREEN
26769,Roaming Profiles,vivazula,2018-04-18T13:07:25.020Z,1,USER PROFILE
24436,Prompt to Save Passwords on Insecure Sites,Lotzy,2018-02-01T16:20:18.234Z,2,SECURITY:PASSWORDS:CERTIFICATES
27918,Export Saved sessions as HTML,Sparrows,2018-06-10T04:53:22.914Z,7,SESSIONS
27593,Plus/Minus Buttons on the Zoom Slider,margarita,2018-05-23T10:22:45.565Z,11,GUI:ZOOM:BUTTONS
31713,Option to Disable Adding "Vivaldi" to the Window Title,thor84no,2018-10-27T13:32:36.263Z,1,TITLE BAR
31665,Replacing Pure White Backgrounds with Off White,dude99,2018-10-26T06:51:43.442Z,3,NIGHT MODE
26173,Exporting Notes,paulcoholic,2018-03-25T14:31:00.041Z,10,NOTES:EXPORT
31508,Show *.MD files as Markdown  not as Source Text,NNN,2018-10-22T13:29:43.398Z,2,MARKDOWN
31531,Manually Import History from CSV Files,kerbal,2018-10-23T03:58:00.329Z,0,HISTORY:IMPORT
28175,Move Search for "Selected Text" to the Top of Context Menu,bnodya,2018-06-22T12:19:23.220Z,3,SEARCH:CONTEXT MENU:SELECTION
31485,tmux like tiling,TheDonk,2018-10-21T16:59:03.582Z,0,TILING:TILED TABS
28384,Cookies and Local Storage in Separate Categories,ldexterldesign,2018-07-04T12:12:18.053Z,16,COOKIES:PRIVATE DATA:LOCAL STORAGE
31417,Keyboard Cheat Sheet Should be Resizable and Moveable,Pesala,2018-10-19T17:54:09.331Z,4,SHORTCUTS:GUI:CHEAT SHEET
24192,Quick Command for Move Tab to New Window,PlusMinus0,2018-01-31T09:53:07.137Z,7,TABS:WINDOW:QUICK COMMANDS
31392,Option to not set window position in X11,kbrenneman,2018-10-18T20:31:16.660Z,0,LINUX
29160,Option to Bind Scrollwheel to Other Actions,svfn,2018-08-03T14:27:27.176Z,3,SHORTCUTS:SCROLL WHEEL
28001,Finer Increments for Zoom,Pesala,2018-06-14T09:04:05.901Z,11,SHORTCUTS:ZOOM:WEBPAGES
24478,Sync saved sessions,ROTFL,2018-02-01T22:53:24.887Z,19,SYNC:SESSIONS
30357,Quick Selection Bubble for Search Engine and Panel,Seasonly,2018-09-26T10:24:56.792Z,6,PANELS:SEARCH ENGINES:SELECTION
31352,Browsing FTP Listings,burbuja,2018-10-17T20:15:09.651Z,1,NAVIGATION
31343,Make the Vivaldi menu disappear when clicking on the menu button for a second time,Ashtar,2018-10-17T16:20:32.683Z,5,BUTTON:MENU
24284,Native OS Desktop Notifications,Guilimote,2018-01-31T16:21:02.300Z,35,NOTIFICATIONS
31252,Add persistent notifier when browser has been updated  but old version is still running,josephj11,2018-10-15T10:49:10.250Z,1,LINUX:NOTIFICATIONS:UPDATER
26811,Option to Clear Everything on Exit,UpGrade,2018-04-20T14:11:45.417Z,9,PRIVACY
31297,Allow Spatial Navigation with continual arrow press,LonM,2018-10-16T09:52:35.550Z,2,SHORTCUTS:KEYBOARD:NAVIGATION
31042,Modify update location to avoid conflicting with Enterprise policies,KindofSCSI,2018-10-09T12:38:24.067Z,1,UPDATE:INSTALLER:UPDATER:INSTALLATION
31227,Micro-Services Architecture,dies_felices,2018-10-14T15:35:54.875Z,0,MICRO-SERVICES:ARCHITECTURE:STRUCTURE:CONTAINERS:SERVICES
24358,Disable / Enable Extensions from Toolbar,Asires,2018-02-01T01:50:12.320Z,14,EXTENSIONS:TOOLBAR
31221,Command to Open a Link in a New Window,kusokuzeshiki,2018-10-14T12:07:18.273Z,1,SHORTCUTS:LINKS:NEW WINDOW
31223,Remote Admin,dies_felices,2018-10-14T12:38:29.026Z,0,COMMANDLINE:CLOUD:ADMIN:REMOTE
31225,Cloud Editor,dies_felices,2018-10-14T13:14:34.741Z,0,DEVELOPER TOOLS:DEVELOPER:VCS:GIT:TEXTEDITOR
30263,Smart Text Selection by Word,TsunamiZ,2018-09-23T13:11:48.076Z,2,SELECTION
31033,Auto-correct for Edit Boxes,Pesala,2018-10-09T08:02:31.088Z,5,SPELLCHECK:TEXT EDIT:AUTOCORRECT
31100,Button to "Abandon Ship" - export data to the cloud and wipe it from system,ROTFL,2018-10-10T21:14:50.010Z,3,SYNC:SECURITY
24145,Preserve Custom Modifications Across Upgrades,LonM,2018-01-31T09:33:02.161Z,51,CUSTOMIZE:UPGRADE ISSUES
31081,Make default audio/video player wider,zdm,2018-10-10T09:49:24.491Z,5,VIDEO:AUDIO:MEDIA:PLAYBACK:PLAYER
24452,Read Aloud Selected Text,Pesala,2018-02-01T20:21:12.206Z,11,ACCESSIBILITY:VOICE:READING
31007,Gopher protocol support,macadoum,2018-10-08T15:14:23.364Z,3,
31079,Lock certificate for domain,patrik_halfar,2018-10-10T08:27:45.391Z,0,CERTIFICATES:LOCK
26632,Account Syncing Across Different Platforms,bhchen,2018-04-12T02:53:03.560Z,0,SYNC:PIPELINE
31034,Allow Multiple Text Selections,Pesala,2018-10-09T08:09:28.931Z,5,SELECTION:TEXT EDIT
29204,Ghostery for Vivaldi,sknschiap,2018-08-06T02:00:55.661Z,0,EXTENSIONS
24907,Show Keyboard Shortcuts in Menus,Pesala,2018-02-10T06:52:06.000Z,15,SHORTCUTS:MENUS
27678,Custom Buttons,LonM,2018-05-27T18:29:47.930Z,19,CUSTOMIZE:BUTTONS
24178,Optional Minimalist Address Bar,Seasonly,2018-01-31T09:43:29.406Z,2,ADDRESS BAR:GUI:CUSTOMIZE
30939,New Private Window to Remember to open Maximized,TsunamiZ,2018-10-06T11:47:15.277Z,0,PRIVATE WINDOW:MAXIMIZE
30931,Extensions page is too vague for ease of use,dude99,2018-10-06T09:29:26.267Z,1,EXTENSIONS:COLOR
29890,Quick Commands "Alt+Enter" to Open Page in New Tab,ukanuk,2018-09-08T20:48:41.877Z,5,SHORTCUTS:QUICK COMMANDS
30788,Change Window Dimensions to Match Monitor,trendready,2018-10-02T19:40:48.069Z,0,WINDOW:SIZE:MULTI-MONITOR
30779,Option to see the cached page contents when can't connect to a website,sverx,2018-10-02T15:50:27.656Z,3,CACHE:OFFLINE
30749,Show Conflicts when Editing Mouse Gestures,337661259,2018-10-02T03:11:43.683Z,5,MOUSE GESTURES:WARNING
30752,Option to Print Selection Only,waldo,2018-10-02T04:33:52.661Z,2,SELECTION:PRINT
30718,History Back Command should Close Tab at Top of History,ibox0,2018-10-01T16:09:47.861Z,2,SHORTCUTS:MOUSE GESTURES:CLOSE TABS:HISTORY LIST
30715,Lexical sort of full URL in history views,becm,2018-10-01T14:53:33.764Z,2,HISTORY:URL:SORT
30624,Replace Context Menu Back & Forward items with Tab History,dude99,2018-09-29T10:08:58.548Z,1,CONTEXT MENU:HISTORY LIST
30545,Support extension context menus properly,Nekomajin,2018-09-28T10:19:36.158Z,8,EXTENSIONS:CONTEXT MENU
24454,Button to Remove All Deleted Downloads,CheVe11e_191,2018-02-01T20:27:46.124Z,16,GUI:DOWNLOADS:BUTTON:DELETE
27409,Pull-down Menus on Hover,equanimity,2018-05-15T10:52:30.503Z,10,MENU BAR
29698,Enlarge Images on Hover,Ornorm,2018-08-30T18:42:07.338Z,5,ZOOM:IMAGE:HOVER
24127,Download Manager,Pesala,2018-01-31T09:20:41.797Z,68,DOWNLOADS:PIPELINE:DOWNLOADMANAGER
30553,Keyboard Selection of Text,PeterinScotland,2018-09-28T11:34:49.704Z,2,SELECTION:TEXT
30465,Option to Remove/Hide Menu Bar,jarsa,2018-09-27T13:28:21.424Z,0,MENU BAR
30503,Resize Vivaldi Window with Standard OSX Shortcuts,ethantoddharris,2018-09-27T18:12:59.227Z,0,SHORTCUTS:WINDOW:OSX
30483,Community and chat groups in the sidebar,popescu,2018-09-27T15:14:02.638Z,0,
30445,Shortcuts for Mute/Unmute Tabs Should be Toggles,LonM,2018-09-27T09:08:48.590Z,7,SHORTCUTS:MUTE
30471,Consistent link clicking behaviour (Open links the same way everywhere),blackeagle,2018-09-27T13:48:40.329Z,4,LINKS
30440,Shoutcast webradio streaming,infid0,2018-09-27T07:13:58.216Z,2,AUDIO:MEDIA:PLAYBACK:STREAMING
30397,Logging into a Google account through some extensions are impossible,tonyrulez,2018-09-26T17:39:51.202Z,0,EXTENSIONS:GOOGLE
30395,Context menu of the extension icon lacks the extensions own menu items,tonyrulez,2018-09-26T17:33:57.711Z,0,EXTENSIONS:CONTEXT MENU
30382,Copy Hyperlink Text,metafaniel,2018-09-26T16:08:02.105Z,2,LINKS:COPY:COPY ADDRESS
30385,Native (non-Chromium) Extensions page/panel,valiowk,2018-09-26T16:28:40.629Z,5,EXTENSIONS
30312,Cache Files in their Original Format,TsunamiZ,2018-09-24T23:34:31.628Z,3,CACHE
30303,Ability to turn on and run Silverlight,beansandfranks,2018-09-24T15:07:27.037Z,0,PLUGIN
29917,(Optional) Widgets bar,Ornorm,2018-09-09T18:43:32.707Z,6,CUSTOMIZE:PLAYER:RSS:WIDGET
30246,Add a built-in Flash player...,TsunamiZ,2018-09-22T20:12:02.748Z,-1,WILL NOT DO
30236,Export Browser History,jaxdaph30,2018-09-22T09:55:34.814Z,3,HISTORY
24156,Built in Support for Userstyles,LonM,2018-01-31T09:36:22.233Z,32,USERCSS
30027,Better Vivaldi Mascot Design,metafaniel,2018-09-13T15:05:17.138Z,7,DESIGN:TONY
30133,Captive Portals Must Die!,rigo,2018-09-18T06:56:44.201Z,0,REDIRECTION
28266,Lazy Load for Sessions,LonM,2018-06-28T21:17:25.277Z,17,SESSIONS:HIBERNATION:LOADING
25009,Option for Find in Page Toolbar at the Bottom,dude99,2018-02-13T09:45:24.855Z,10,CUSTOMIZE:FIND IN PAGE:POSITION
30068,Press and Hold (long-click) Support for Mouse Gestures,RandomlyFish,2018-09-15T08:24:21.717Z,1,MOUSE GESTURES
30050,Use same gesture for multiple commands  depending on where on the screen you used it,RandomlyFish,2018-09-14T12:11:46.428Z,2,MOUSE GESTURES
30033,Mark / highlight new features after update,ROTFL,2018-09-13T18:52:54.636Z,16,GUI:DISCOVERABILITY
26686,Get rid of the dead birds…,luetage,2018-04-14T18:04:58.507Z,14,CRASH
24226,Built-in content blocker,Nekomajin,2018-01-31T10:51:04.546Z,68,NICE TO HAVE:CONTENTBLOCKING
29690,Customize default Wikipedia search depending on installation language,ROTFL,2018-08-30T08:02:29.740Z,5,SEARCH ENGINES:LANGUAGE
30008,Developers' Version of Vivaldi,trymeout,2018-09-12T18:26:23.445Z,0,DEVELOPER
29992,Hide window buttons while in fullscreen mode (macOS),AltCode,2018-09-11T20:48:42.060Z,0,MAC:MACOS
29935,Underline Access Keys in Link Context Menu,zook,2018-09-10T03:08:14.988Z,2,CONTEXT MENU:ACCESSIBILITY
29911,Vivaldi Bookmarks Preview as Logos,mehmettalhauludag,2018-09-09T12:02:05.543Z,2,BOOKMARKS:PREVIEW
29887,Allow to print selected Note,brook,2018-09-08T19:58:27.670Z,5,NOTES:PRINT
25446,Enable Custom Key Navigation for Quick Command Menu,nealot,2018-02-25T20:08:52.937Z,8,SHORTCUTS:QUICK COMMANDS:NAVIGATION
29409,Epub Support,metafaniel,2018-08-16T15:32:26.917Z,10,EPUB
29863,Import Settings and Bookmarks from More Sources,zakius,2018-09-07T13:24:29.256Z,1,SETTINGS:IMPORT
29852,Support Variable Fonts,Pesala,2018-09-07T05:52:00.462Z,1,FONTS
29822,Support Third-Party Download Managers,dude99,2018-09-06T11:44:48.380Z,3,DOWNLOADMANAGER:THIRD-PARTY
25580,Mouse Gesture Visual Hints,Pesala,2018-03-02T07:39:41.322Z,15,MOUSE GESTURES:CHEAT SHEET
29838,Playback Media Like iTunes,Lumin0,2018-09-06T17:47:07.528Z,1,VIDEO:AUDIO:MEDIA:PLAYBACK:CONTROLS
29815,Assign Mouse Gesture to Open a URL,Artienia,2018-09-05T18:55:47.943Z,2,MOUSE GESTURES
24112,Complete Mouse Gesture Configuration,zakius,2018-01-31T08:30:13.685Z,13,CUSTOMIZE:MOUSE GESTURES
29731,Find in Page in Side Panel,woundrn,2018-09-01T20:56:06.971Z,1,PANELS:FIND IN PAGE
29772,Full Notes synchronization,ROTFL,2018-09-03T19:17:33.096Z,1,SYNC:NOTES
29769,Saving sessions with their content,potmeklecbohdan,2018-09-03T18:30:00.118Z,1,SESSIONS
24732,Shortcut for Parent Directory (go "up" in url),pdray,2018-02-05T16:24:25.656Z,11,SHORTCUTS:GO TO PARENT
27660,Names for Windows,yoxxx,2018-05-26T13:37:21.774Z,16,WINDOWS
29691,Rename "Private Search" to "Default Private Search" / make it possible to disable some search engines in Private windows?,ROTFL,2018-08-30T08:14:41.842Z,4,GUI:SEARCH ENGINES:PRIVATE SEARCH
25339,Copy text to existing note,CheVe11e_191,2018-02-22T09:46:20.869Z,8,NOTES:COPY
29659,Option to remember selected area in Screenshot feature,CheVe11e_191,2018-08-29T05:38:40.795Z,7,SCREEN CAPTURE
29662,Zooming tiled tabs simultaneously,CheVe11e_191,2018-08-29T06:08:53.744Z,5,ZOOM:TILED TABS
27951,Web Form Recovery Manager,bebotette,2018-06-12T04:24:41.390Z,4,FORM FILLING
29559,Capture Layout Elements or Total Visible Area,yashpalgoyal1304,2018-08-23T16:14:07.484Z,3,SCREENSHOT:SCREEN CAPTURE
29546,Option to Keep Page Action Selections when Opening Link in a New Tab,ysul0614,2018-08-23T07:20:05.642Z,1,NEW TAB:PAGE ACTIONS
29422,Ask for password when user increases range of synchronised categories,ROTFL,2018-08-17T08:21:56.080Z,2,SYNC:SECURITY
29504,Downloads: dialog to manually add a download task,tigas,2018-08-21T11:22:01.303Z,1,DOWNLOADS
29463,Universal Search for the Menu,raveenkumar,2018-08-19T09:11:51.608Z,0,SEARCH:MENU:SEARCH BAR
29288,In-place Help,Nekomajin,2018-08-10T19:28:03.351Z,7,HELP
28036,Enable Cookie Editing  Export and Import,Losers,2018-06-15T22:18:33.815Z,1,COOKIES
29433,Show Tab preview thumbnail from related list on mouseover,dude99,2018-08-17T17:22:38.943Z,0,THUMBNAILS:QUICK COMMANDS
29360,Reappearance of Find in Page highlight,metafaniel,2018-08-13T23:01:53.703Z,3,FIND IN PAGE
26030,Find Bar Should Disappear After a Set Time,rojaviv,2018-03-20T14:01:33.635Z,3,FIND IN PAGE
29309,Use a Shorter User Agent String,allo,2018-08-11T13:02:18.093Z,0,USER AGENT
25205,Add Reload all Button,CheVe11e_191,2018-02-18T17:01:02.966Z,7,BUTTON:REFRESH PAGE
29234,Auto-save on Capture Image,rojaviv,2018-08-07T20:01:30.730Z,5,SCREEN CAPTURE
29255,Make Mouse Wheel Scrolling Horizontal in Vertical Reading Mode,tsugane,2018-08-09T10:53:58.825Z,2,SCROLLING:READER VIEW:VERTICAL
29233,Remote Connections Manager,dbergwerf,2018-08-07T18:42:36.264Z,0,CONNECTION
29218,Customize a dark color for the new tab "blank page"...,TsunamiZ,2018-08-06T17:58:54.401Z,3,START PAGE
29202,Check for New Page on Reload,Chas4,2018-08-05T18:00:05.223Z,1,CACHE
29171,Freeze Page to Make Reading Easy,Andrew_M,2018-08-03T22:49:31.833Z,0,READER VIEW
29162,Icon for vivaldi://chrome-urls/,Hadden89,2018-08-03T15:39:42.828Z,5,VIVALDI:ICONS:URL:CHROME
29155,Improve Information on Secure Connections,BigMike,2018-08-03T08:57:05.342Z,6,SECURITY
29148,New Commands for Multi-Select Tabs  Tab Stack by Host  Bookmark all Open Pages,Ryo500,2018-08-02T21:00:01.208Z,1,SHORTCUTS
29143,☀️Weather Forecast,Ornorm,2018-08-02T16:08:28.811Z,0,
19410,Notification in Text Area if Caps Lock is Enabled,starkshaw,2017-07-26T04:15:31.875Z,2,NOTIFICATIONS:TEXT EDIT
25059,Ctrl+F Should Toggle Find in Page,torniojaws,2018-02-14T13:24:24.256Z,31,SHORTCUTS:FIND IN PAGE
28176,Restart from Menu without Extensions,Para-Noid,2018-06-22T16:17:40.354Z,17,EXTENSIONS:RESTART
28965,On Demand mode for Play Image Animation,dude99,2018-07-25T12:50:24.890Z,7,ANIMATIONS
29011,Browser Fingerprinting protection,dude99,2018-07-27T05:49:39.680Z,10,PRIVACY:SECURITY
29025,Ominibox Rich Entity Suggestions,AfsarPasha,2018-07-27T15:40:34.549Z,0,OMNIBOX
29006,Parallax Scrolling for Start-page Background,Ouroboros4545,2018-07-26T20:05:40.418Z,4,START PAGE:BACKGROUND
28974,Built-in Dictionary,Omen_20,2018-07-25T17:35:59.168Z,1,DICTIONARY
24527,Emoji keyboard,dominicw2,2018-02-02T10:46:19.671Z,3,KEYBOARD:EMOJI
28883,Sort Cookies by Domain,JBanana,2018-07-22T20:38:16.144Z,5,COOKIES:SORT
28856,Background Tabs Hibernation Keybind,dannyswift,2018-07-21T18:57:23.594Z,0,SHORTCUTS:HIBERNATION
28848,Add Firefox's SearchWP Functionality to Vivaldi's Search Field,David.P,2018-07-21T15:15:52.968Z,6,SEARCH
28843,Make Copy/Cut/Paste/Undo Shortcuts Configurable,tarbos,2018-07-21T09:49:57.574Z,2,SHORTCUTS:CUSTOMIZE:KEYBOARD
25236,Partner with Proton VPN,HumanoidVivaldionSteroids,2018-02-19T15:21:10.329Z,4,VPN
28837,Expand History Page on Double-clicking the Date,greatscot,2018-07-21T05:18:06.234Z,0,HISTORY LIST
28823,Add a Built-in DNS Changer,bumkailashkumar,2018-07-20T16:07:40.540Z,1,DNS
28795,Option to Show/Hide Toolbar in Fullscreen on MacOS,GBB,2018-07-19T19:43:35.121Z,0,TOOLBAR:MACOS:FULLSCREEN
28764,Commands for Zoom to Specific Values,Pesala,2018-07-18T18:41:12.813Z,6,ZOOM
28763,Option to Limit Vivaldi to one Window Instance,TsunamiZ,2018-07-18T18:14:10.550Z,6,WINDOW
26834,Add Website Availability Checker into "This Site Cannot be Reached" Warning Page,dude99,2018-04-21T05:42:36.896Z,6,SECURITY
28732,Tor Mode for Dummy,dude99,2018-07-17T13:44:05.938Z,4,TOR
28705,Context Menu for Reload Button in Developer Mode,sgo,2018-07-16T12:12:23.867Z,2,CONTEXT MENU:DEVELOPER TOOLS
28696,Enable/Disable Javascript Option inside Page Actions Menu,julioc1984,2018-07-15T11:49:42.100Z,6,JAVASCRIPT:PAGE ACTIONS
24673,Autocomplete Root Domain before Subdomain,NemoAnonymous,2018-02-04T14:10:59.585Z,37,AUTOCOMPLETE
24396,Drag Text to Tab Bar  Tabs to Search,kurevska_registracia,2018-02-01T10:20:38.629Z,28,SEARCH:DRAGANDDROP
28627,Notification Popups: Time Limit and Enable / Disable,ozoratsubasa,2018-07-12T06:15:54.879Z,2,NOTIFICATIONS
28496,Enhance Extension Page,Hadden89,2018-07-06T22:58:20.040Z,7,EXTENSIONS
24122,Keyboard shortcut to move a tab to the next window,jkierzkowski,2018-01-31T09:18:28.821Z,5,TABS:SHORTCUTS:WINDOW
28613,Use Standard Port for Sync Feature,iampowder,2018-07-11T15:07:09.050Z,0,SYNC
28547,URLs for Bug Reports and Feedback,jballester,2018-07-08T19:06:11.853Z,0,BUG REPORT
24166,Boss Key to Hide Browser,Pesala,2018-01-31T09:39:43.113Z,18,SHORTCUTS:MINIMIZE WINDOW
28481,Easily Clear Search History,cristiandogaru,2018-07-06T15:25:37.832Z,0,SHORTCUTS:HISTORY:SEARCH BAR
25206,Customize mouse buttons to activate gestures,CheVe11e_191,2018-02-18T17:28:13.671Z,5,CUSTOMIZE:MOUSE GESTURES:BUTTON:MOUSE BUTTONS
28393,Fullscreen Tab Media (video/images/games),Tavish,2018-07-04T20:45:32.919Z,2,VIDEO:FULLSCREEN
28364,Enable Hardware-accelerated Video Rendering by Default in Linux,david.cortes,2018-07-03T20:22:32.145Z,2,LINUX
28351,Allow 'Close Tab' for Pinned Tabs in Context Menu,rafiki,2018-07-03T11:55:37.739Z,5,CONTEXT MENU:PINNED TABS
28357,More Customization for Reader View,drynov,2018-07-03T15:14:46.972Z,3,READER VIEW
28318,Independent UI Zoom per Window,Pesala,2018-07-01T09:55:49.517Z,3,SPEED DIAL:ZOOM
28241,Open Bookmarks Bar Folders on Mouse Hover,BratetsVolk,2018-06-27T19:00:30.318Z,10,BOOKMARKS BAR
24363,Address Bar Search: Remove "Search Google",phil056,2018-02-01T03:49:09.675Z,17,ADDRESS BAR:GOOGLE:SUGGESTIONS
28217,Button to Save Internet Thumbnail Locally,ironklad,2018-06-26T16:15:07.713Z,0,SPEED DIAL:CUSTOMIZE:THUMBNAILS
28223,Shortcuts Ctrl+Shift+Number to Launch First 10 URLs in Bookmark Bar,washere,2018-06-26T18:33:19.537Z,1,SHORTCUTS:BOOKMARKS BAR
28219,Option for Find in Page Toolbar to Remain Open,SVGuss,2018-06-26T16:39:18.792Z,5,TOOLBAR:FIND IN PAGE:FIXED
28212,Auto-commit Modified Values in Zoom Field,dude99,2018-06-26T05:28:47.538Z,1,ZOOM:STATUS BAR
28211,Enable Referrals on HTTPS Sites,btabke,2018-06-26T02:35:14.335Z,1,PRIVACY:SECURITY:HTTPS REDIRECT
28138,Multiple Columns for Bookmark Bar Folder Dropdown Menu,vabalokis,2018-06-20T22:00:33.134Z,4,BOOKMARKS BAR:BOOKMARK FOLDER
25402,Lock/Protect Tabs,duarte.framos,2018-02-23T19:23:23.085Z,22,TABS:TAB:PINNED TABS:LOCK
28115,Please add News under Help Menu,floweringmind,2018-06-19T16:47:06.392Z,4,MENUS
28080,View Block Structure on Page,arbpen,2018-06-17T21:24:12.216Z,2,PAGE ACTIONS
28083,Full Dual Monitor Toolbar,hanjones,2018-06-17T23:16:21.655Z,3,TOOLBAR:DUALMONITORS
27828,Disable Auto-refreshing for History,myVivaldiUsername,2018-06-03T23:29:06.187Z,7,HISTORY
28041,Make Inline English Easier to Read in Vertical Reading Mode,kytse,2018-06-16T06:49:32.718Z,1,READER VIEW:VERTICAL
28028,Close Pinned Tabs Option in Context-menu,Losers,2018-06-15T14:54:02.011Z,0,CONTEXT MENU:PINNED TABS:CLOSE
28030,Option not to URL-encode the Search (%s),cxw,2018-06-15T16:27:03.208Z,2,SEARCH ENGINES
27977,Easier way to Reopen Closed Window from Trashcan,dude99,2018-06-13T10:09:32.593Z,2,TRASHCAN
27367,Different Web Page Zoom Settings for Different Monitors,fyhn,2018-05-13T09:01:42.637Z,4,ZOOM:DUALMONITORS
27986,Modify the URL Shortcut Icon Created by Drag and Drop a URL to Desktop,HiroInJapan,2018-06-13T14:38:37.997Z,0,ICONS:DRAGANDDROP:URL:DESKTOP
25483,Show Sync status / remote sessions in Incognito windows,ROTFL,2018-02-27T14:25:23.755Z,0,SYNC:PRIVATE WINDOW:REMOTE SESSIONS
27974,Add option to convert text formatting to Markdown,ROTFL,2018-06-13T09:23:10.906Z,2,NOTES:MARKDOWN
27852,Cookie Jar,Grimeton,2018-06-05T14:58:38.621Z,1,COOKIES:BLOCK:THIRD-PARTY
25229,'Go to top' and 'Go to end' on Right-click Menu,Isocult,2018-02-19T14:06:18.171Z,1,CUSTOMIZE:CONTEXT MENU:NAVIGATION
26665,Option to Add New Windows on Other Monitors,LadyJane,2018-04-13T14:41:56.031Z,3,NEW WINDOW:MULTI-MONITOR
27795,Remove Items from Websites' Text-box History List,dude99,2018-06-01T13:21:49.577Z,0,HISTORY LIST:WEBSITE
27956,Permit shrinking extension popup windows below the current minimum width,cxw,2018-06-12T13:22:55.755Z,0,EXTENSIONS
27947,Button to put Pop-ups Back into Tabs,Azenix,2018-06-11T20:18:55.105Z,1,POPUP
27474,Replace Encoding Feature Lost After Chromium 55,Plethora10000,2018-05-17T19:44:16.776Z,3,WEBPAGES
27298,Keyboard Shortcut for "Open Image",konoppo,2018-05-09T19:54:34.886Z,1,SHORTCUTS:IMAGE
27934,Quick Commands Remembers Text Entered,manas20,2018-06-11T01:41:11.499Z,2,QUICK COMMANDS
