ID,Title,Author,Date,Votes,Tags
24287,Get File Date/Time of Downloads from Server,d_A_y_x,2018-01-31T16:30:21.582Z,10,DOWNLOADS:DOWNLOADMANAGER
24292,Private Tab/Window Option for Handled URLs,sdgreene,2018-01-31T17:07:04.198Z,1,PRIVACY
24270,Update Channels,secondtruth,2018-01-31T14:09:20.034Z,0,AUTOUPDATE
24573,Hibernate New Background Tabs,tcely,2018-02-02T16:48:33.119Z,4,HIBERNATION:BACKGROUND TAB
24158,Three-way Toggle for View Status Bar,Pesala,2018-01-31T09:36:51.639Z,20,SHORTCUTS:STATUS BAR
24550,Use Nicknames in the Search Field,josephj11,2018-02-02T12:15:18.951Z,1,SEARCH ENGINES
24551,Dynamic DNS for Vivaldi.net account,ROTFL,2018-02-02T12:19:45.120Z,1,DYNAMIC DNS
24547,Ad-hoc Peer to Peer services,ROTFL,2018-02-02T11:57:48.780Z,1,PEER-TO-PEER
24456,Add Option to Check for Updates from Quick Command,CheVe11e_191,2018-02-01T20:33:06.957Z,2,QUICK COMMANDS:UPDATE
24530,Screencast,dominicw2,2018-02-02T10:55:49.263Z,4,VIDEO:SCREENSHOT
24526,Thumbnails auto-refreshing options,ROTFL,2018-02-02T10:30:24.107Z,5,SPEED DIAL:THUMBNAILS
24523,Enhance Extensions API,zakius,2018-02-02T09:53:38.325Z,3,EXTENSIONS:API
24521,Device (instance) listing & management for Sync with configuration options per instance,ROTFL,2018-02-02T09:36:38.389Z,10,SPEED DIAL:SYNC:SECURITY:DEVICE MANAGER
24496,Easy removal of remembered form logins / passwords / inputs,ROTFL,2018-02-02T00:17:34.556Z,4,AUTOCOMPLETE:CLEAR:FORM FILLING
24516,Classic Browser Title Bar with Webpage Title and Application Icon,MVV_,2018-02-02T06:17:44.543Z,1,GUI:ICONS:TITLE BAR
24490,Download speed graph,ROTFL,2018-02-01T23:51:46.347Z,18,DOWNLOADS:DOWNLOAD GRAPH
24477,"Report a bug" on the main menu,ROTFL,2018-02-01T22:52:04.092Z,15,MENUS:BUG REPORT
24472,Middle-click Scrolling Anywhere on the Page,Stardust,2018-02-01T21:44:00.047Z,1,SCROLLING:MIDDLE-CLICK
24373,Smooth Scrolling like Microsoft Edge,neltherion,2018-02-01T07:48:25.646Z,8,SMOOTHSCROLLING
24440,Pop-up Blocker,david.cortes,2018-02-01T18:34:53.208Z,9,BLOCK:POP-UP
24460,Persistent Page Actions,LonM,2018-02-01T21:04:31.896Z,9,PAGE ACTIONS:PIN
24458,Speaker Icon Appearance with Animations Disabled,CheVe11e_191,2018-02-01T20:47:06.240Z,5,GUI:ICONS:ANIMATIONS
24455,Option to Activate Pinned Tabs only After Clicking,CheVe11e_191,2018-02-01T20:31:21.176Z,1,PINNED TABS:HIBERNATION
24422,Emulate Handheld Mode,Pesala,2018-02-01T13:27:59.113Z,1,HANDHELD:EMULATION
24429,Wayland Support,Christian.Rauch,2018-02-01T14:59:19.719Z,0,LINUX
24384,Match Whole Words for Find in Page,Pesala,2018-02-01T08:52:29.326Z,9,FIND IN PAGE
24420,Implement Segment Break Transformation Rules,yudai-nkt,2018-02-01T13:18:26.008Z,2,TEXT:FORMATTING:JAPANESE
24416,Expand / Collapse Bookmark Folders with Single-click,becm,2018-02-01T12:33:53.851Z,5,BOOKMARK FOLDER
24377,Use One Shortcut to Cycle between Tiled Tab Views,neltherion,2018-02-01T07:54:21.457Z,3,SHORTCUTS:TILING
24374,Sort Search Engines by Name,neltherion,2018-02-01T07:49:31.822Z,4,SEARCH ENGINES:SORT
24372,Search History/Quick Commands by page names containing my words,neltherion,2018-02-01T07:47:17.029Z,3,
24360,Faster Assignment of Tab Tiling,Asires,2018-02-01T01:57:54.659Z,4,SHORTCUTS:TILING
24207,Ignore Mouse Pointer on Address Bar Suggestions unless it has been moved,PlusMinus0,2018-01-31T10:08:00.746Z,8,ADDRESS BAR:SUGGESTIONS:MOUSE POINTER
24346,Chat Client Like Opera Presto,burbuja,2018-01-31T22:38:50.338Z,8,CHAT
24217,Mute and Remember,RammsteinAM,2018-01-31T10:40:55.999Z,15,SITE SETTINGS:MUTE:BLACKLIST
24188,Find Next/Previous Without Showing Toolbar,Pesala,2018-01-31T09:49:37.593Z,11,FIND IN PAGE
24254,Option to not Append (n) when Saving Duplicate Files - Ask to Overwrite Instead,NemoAnonymous,2018-01-31T12:35:26.195Z,15,SAVING FILES
24201,Reduce Vertical Height of Navigation Bar in Start Page,Pesala,2018-01-31T10:00:33.453Z,3,START PAGE
24269,Close Tab Activation - Activate First Non-Hibernated Tab,longvoid,2018-01-31T13:53:32.276Z,1,CLOSE TABS:HIBERNATION
24258,Sessions as Desktop Shortcuts,PSGarak,2018-01-31T12:44:59.306Z,8,SHORTCUTS:SESSIONS:DESKTOP
24242,Button or Shortcut to Pause Video Player,jkierzkowski,2018-01-31T11:12:10.330Z,8,VIDEO:AUDIO:MEDIA:PLAYER:CONTROLS
24246,Scroll-sync for tiles,bimlas,2018-01-31T11:27:35.759Z,19,SCROLLING:TILING
24245,Window Position Lock or Force Maximized Window,formtapez,2018-01-31T11:22:40.503Z,0,WINDOW:POSITION:LOCK
24233,Extension Installation from Opera Catalog,Nekomajin,2018-01-31T11:00:02.218Z,10,EXTENSIONS:OPERA
24218,Option to Disable Text Decoration or Edit Values,Pesala,2018-01-31T10:41:27.992Z,4,CSS
24120,A Secondary Zone for Extension Buttons,GoldNoway,2018-01-31T08:51:14.494Z,6,EXTENSIONS:GUI:CUSTOMIZE:BUTTONS
24162,Proximity Search to Find Two or More Words,Pesala,2018-01-31T09:38:36.483Z,5,FIND IN PAGE
24191,Launch Applications with Shortcuts,Pesala,2018-01-31T09:52:24.994Z,1,SHORTCUTS:LAUNCH
24189,Keyboard Cheat Sheet Should Default to Collapsed,Pesala,2018-01-31T09:51:00.015Z,10,SHORTCUTS:GUI:CHEAT SHEET
24175,Open frame context menu option,LonM,2018-01-31T09:42:30.796Z,1,CONTEXT MENU:FRAME
24170,Easier access to saving sessions,LonM,2018-01-31T09:40:19.843Z,5,SESSIONS
24169,Advanced Content Permissions,LonM,2018-01-31T09:40:07.275Z,11,CONTENTBLOCKING
24155,Show Extended Connection Info in Status Bar,LonM,2018-01-31T09:35:59.801Z,10,STATUS BAR:CONNECTION:INFO
24154,Show Link Info as a Tooltip,LonM,2018-01-31T09:35:47.137Z,8,LINKS:TOOLTIPS
24146,Open New Window (over a link) Mouse Gesture,LonM,2018-01-31T09:33:18.256Z,3,MOUSE GESTURES:LINKS:NEW WINDOW
24139,Choose Fonts for GUI,Pesala,2018-01-31T09:29:35.587Z,30,GUI:FONTS:FONT SIZE
18487,Filters for Visual Impairment,pettrer,2017-07-06T06:34:40.712Z,3,PAGE ACTIONS:FILTERS:COLOR BLINDNESS
13744,Add Shortcut for Enable / Disable Mouse Gestures,im_athom3,2017-01-28T16:16:38.238Z,1,SHORTCUTS:MOUSE GESTURES
